12/08/2020, 15:37:13	12/08/2020, 04:30:00	Businesswire Funding	 Arcturus Therapeutics Announces Pricing of $150 Million Public Offering of Common Stock	http://www.businesswire.com/news/home/20201207006013/en/%C2%A0Arcturus-Therapeutics-Announces-Pricing-of-150-Million-Public-Offering-of-Common-Stock/	SAN DIEGO--(BUSINESS WIRE)---- $ARCT #Clinicaltrial--Arcturus Therapeutics Announces Pricing of $150.15 Million Public Offering of Common Stock	(Possible_Funding /IPOs)	Not Computed	('$150 Million', 'MONEY')	-
12/08/2020, 15:37:14	12/08/2020, 14:00:00	Businesswire IPO	Rodgers Silicon Valley Acquisition Corp. Announces Closing of $230 Million Initial Public Offering	http://www.businesswire.com/news/home/20201208005230/en/Rodgers-Silicon-Valley-Acquisition-Corp.-Announces-Closing-of-230-Million-Initial-Public-Offering/	WOODSIDE, Calif.--(BUSINESS WIRE)--Rodgers Silicon Valley Acquisition Corp. (NASDAQ: RSVAU, the “Company”) announced today that it closed its initial public offering of 23,000,000 units, which includes 3,000,000 units issued pursuant to the exercise by the underwriter of their over-allotment option. The offering was priced at $10.00 per unit, resulting in gross proceeds of $230,000,000. Each unit consists of one share of common stock and one-half of one redeemable warrant. Each whole warrant wi	(M&A /Possible_Funding /IPOs)	Not Computed	('Rodgers Silicon Valley Acquisition Corp.', 'ORG')('$230 Million', 'MONEY')	-
12/08/2020, 15:37:14	12/07/2020, 23:28:00	Businesswire IPO	Revolution Acceleration Acquisition Corp Announces Pricing of $250 Million Initial Public Offering	http://www.businesswire.com/news/home/20201207005972/en/Revolution-Acceleration-Acquisition-Corp-Announces-Pricing-of-250-Million-Initial-Public-Offering/	WASHINGTON--(BUSINESS WIRE)--Revolution Acceleration Acquisition Corp (the “Company”) announced today that it priced its initial public offering of 25,000,000 units at $10.00 per unit. The units will be listed on the Nasdaq Capital Market (“Nasdaq”) and trade under the ticker symbol “RAACU” beginning December 8, 2020. Each unit consists of one share of Class A common stock and one-third of one redeemable warrant. Each whole warrant entitles the holder thereof to purchase one share of Class A co	(M&A /Possible_Funding /IPOs)	Not Computed	('Revolution Acceleration Acquisition Corp Announces', 'ORG')('$250 Million', 'MONEY')	-
12/08/2020, 15:37:14	12/07/2020, 14:55:00	Businesswire IPO	Docebo Announces Closing of Initial Public Offering in the United States and Public Offering in Canada	http://www.businesswire.com/news/home/20201207005621/en/Docebo-Announces-Closing-of-Initial-Public-Offering-in-the-United-States-and-Public-Offering-in-Canada/	TORONTO--(BUSINESS WIRE)--Docebo Inc. (“Docebo” or the “Company”) (TSX:DCBO) today announced the closing of its previously-announced marketed public offering of common shares in the United States and Canada. A total of 3,450,000 common shares of Docebo were sold, including 450,000 common shares following the exercise in full by the underwriters of their over-allotment option, at a price of US$48.00 per share, for gross proceeds to the Company of US$165.6 million. Docebo expects that the net pro	(IPOs)	Not Computed	('Docebo', 'NORP')('the United States', 'GPE')('Canada', 'GPE')	-
12/08/2020, 15:37:15	12/07/2020, 14:34:00	Businesswire Divestiture	JCPenney’s Retail and Operating Assets to Exit Chapter 11	http://www.businesswire.com/news/home/20201207005595/en/JCPenney%E2%80%99s-Retail-and-Operating-Assets-to-Exit-Chapter-11/	PLANO, Texas--(BUSINESS WIRE)--JCPenney’s retail and operating assets to exit Chapter 11 as the Company continues to serve customers under the JCPenney banner.	(Bankruptcy)	Not Computed	('JCPenney', 'ORG')('Exit Chapter 11', 'PRODUCT')	-
12/08/2020, 15:37:17	12/08/2020, 14:55:00	PRNewswire -Auto & Transportation	WSGF - Vaycaychella Announces Goldman Small Cap Research RPT And $0.20 PPS TGT With Airbnb IPO Presented As Proxy And Comp	https://www.prnewswire.com:443/news-releases/wsgf--vaycaychella-announces-goldman-small-cap-research-rpt-and-0-20-pps-tgt-with-airbnb-ipo-presented-as-proxy-and-comp-301188501.html	DALLAS, Dec. 8, 2020 /PRNewswire/ -- World Series of Golf, Inc. (USOTC: WSGF) ("WSGF"), through its new subsidiary Vaycaychella (parent corporate name change pending), a sharing economy technology business serving the short-term rental market, today announced that Goldman Small Cap...	(IPOs)	Not Computed	('WSGF - Vaycaychella Announces', 'ORG')('Cap Research', 'PERSON')('0.20', 'MONEY')	-
12/08/2020, 15:37:21	12/08/2020, 20:29:33	BusinessJournal	JCPenney to exit bankruptcy by mid-2021 upon approval of sale	https://www.bizjournals.com/milwaukee/news/2020/12/08/jcpenney-exit-bankruptcy.html?ana=brss_1028	The previously announced sale was confirmed.	(Possible_M&A /Bankruptcy)	Not Computed	('JCPenney', 'ORG')('mid-2021', 'DATE')	-
12/08/2020, 15:37:21	12/08/2020, 19:30:45	BusinessJournal	Former Biscayne Neurotherapeutics CEO aims to raise $75M through SPAC IPO	https://www.bizjournals.com/southflorida/news/2020/12/08/big-cypress-acquisition-corp-aims-to-raise-75m.html?ana=brss_1028	The SPAC will focus on acquiring companies in the life sciences industry.	(Funding /IPOs)	Not Computed	('Biscayne Neurotherapeutics', 'PERSON')('75', 'MONEY')	-
12/08/2020, 15:37:21	12/08/2020, 12:42:27	BusinessJournal	JCPenney to exit bankruptcy by mid-2021 upon approval of sale	https://www.bizjournals.com/pittsburgh/news/2020/12/08/jcpenney-exit-bankruptcy.html?ana=brss_1028	The previously announced sale was confirmed.	(Possible_M&A /Bankruptcy)	Not Computed	('JCPenney', 'ORG')('mid-2021', 'DATE')	-
12/08/2020, 15:37:21	12/08/2020, 11:00:00	BusinessJournal	JCPenney to exit bankruptcy by mid-2021 upon approval of sale	https://www.bizjournals.com/bizwomen/news/latest-news/2020/12/jcpenney-exit-bankruptcy.html?ana=brss_1028	The previously announced sale was confirmed.	(Possible_M&A /Bankruptcy)	Not Computed	('JCPenney', 'ORG')('mid-2021', 'DATE')	-
12/08/2020, 15:37:21	12/07/2020, 21:58:37	BusinessJournal	Blue Star Donut emerges from bankruptcy	https://www.bizjournals.com/portland/news/2020/12/07/blue-star-donut-emerges-from-bankruptcy.html?ana=brss_1028	The doughnut maker has emerged from Chapter 11 through a partnership with Sortis Holdings.	(Bankruptcy)	Not Computed	('Blue Star Donut', 'ORG')	-
12/08/2020, 15:37:21	12/07/2020, 21:30:00	BusinessJournal	Superior Energy Services cut more than half its headcount ahead of bankruptcy	https://www.bizjournals.com/houston/news/2020/12/07/superior-energy-cut-headcount-before-bankruptcy.html?ana=brss_1028	The company filed for bankruptcy on Dec. 7 with just under 2,000 employees remaining.	(Bankruptcy)	Not Computed	('Superior Energy Services', 'ORG')('more than half', 'CARDINAL')	-
12/08/2020, 15:37:21	12/07/2020, 20:54:01	BusinessJournal	JCPenney to exit bankruptcy by mid-2021 upon approval of sale	https://www.bizjournals.com/dallas/news/2020/12/07/jcpenney-exit-bankruptcy.html?ana=brss_1028	The previously announced sale was confirmed.	(Possible_M&A /Bankruptcy)	Not Computed	('JCPenney', 'ORG')('mid-2021', 'DATE')	-
12/08/2020, 15:37:21	12/07/2020, 20:50:01	BusinessJournal	Wish is banking on an early Christmas gift with a $1.27 billion IPO	https://www.bizjournals.com/sanfrancisco/news/2020/12/07/wish-is-banking-on-an-early-christmas-gift.html?ana=brss_1028	The e-commerce marketplace platform startup is the latest Bay Area company to hit the IPO investor roadshow, as the busy holiday season gears up.	(IPOs)	Not Computed	('$1.27 billion', 'MONEY')	-
12/08/2020, 15:37:21	12/07/2020, 19:37:37	BusinessJournal	The Funded: Coursera, Intapp may join the IPO parade next year	https://www.bizjournals.com/sanjose/news/2020/12/07/2-bay-area-companies-test-waters-for-an-ipo.html?ana=brss_1028	Several Bay Area companies set price targets for what may be the busiest December for IPOs here, while others are exploring making their Wall Street debuts next year.	(Funding /IPOs)	Not Computed	('Coursera', 'PERSON')('Intapp', 'ORG')('next year', 'DATE')	-
12/08/2020, 15:37:21	12/07/2020, 19:12:26	BusinessJournal	Airbnb boosts IPO targets, could be valued as high as $42B	https://www.bizjournals.com/sanjose/news/2020/12/07/airbnb-ipo-tweaks-numbers-raises-demand-questions.html?ana=brss_1028	When it goes public later this week, its valuation could be as high as $42 billion, making it the most highly valued alumnus of the Mountain View-based Y Combinator accelerator program.	(IPOs)	Not Computed	('Airbnb', 'GPE')('as high as $42B', 'MONEY')	-
12/08/2020, 15:37:21	12/07/2020, 19:06:17	BusinessJournal	Silicon Valley startup Upstart doubling its Short North office after upcoming IPO	https://www.bizjournals.com/columbus/news/2020/12/07/silicon-valley-based-upstart-doubling-columbus-hq2.html?ana=brss_1028	A Silicon Valley consumer lending startup heading for an IPO plans to double its "HQ2" office in Columbus to 500 jobs.	(IPOs)	Not Computed	('Silicon Valley', 'LOC')('Short North', 'ORG')	-
12/08/2020, 15:37:21	12/07/2020, 16:38:45	BusinessJournal	Billionaire Siebel's C3.ai boosts IPO targets 12%, hopes to raise up to $677M	https://www.bizjournals.com/sanfrancisco/news/2020/12/07/c3ai-boosts-ipo-targets-12.html?ana=brss_1028	The Redwood City software company's Wall Street debut comes amid a flood of IPOs planned by Bay Area companies in what may be the busiest December ever.	(Funding /IPOs)	Not Computed	("Billionaire Siebel's", 'PERSON')('12%', 'PERCENT')('up to $677', 'MONEY')	-
12/08/2020, 15:37:21	12/07/2020, 16:33:55	BusinessJournal	Airbnb boosts IPO pricing range	https://www.bizjournals.com/sanfrancisco/news/2020/12/07/airbnb-ipo-tweaks-numbers-raises-demand-questions.html?ana=brss_1028	When it goes public later this week, its valuation could be as high as $42 billion.	(IPOs)	Not Computed	('Airbnb', 'GPE')	-
12/08/2020, 15:37:21	12/07/2020, 15:36:35	BusinessJournal	Billionaire Siebel's C3.ai boosts IPO targets 12%, hopes to raise up to $677M	https://www.bizjournals.com/sanjose/news/2020/12/07/c3ai-boosts-ipo-targets-12.html?ana=brss_1028	The Redwood City software company's Wall Street debut comes amid a flood of IPOs planned by Bay Area companies in what may be the busiest December ever.	(Funding /IPOs)	Not Computed	("Billionaire Siebel's", 'PERSON')('12%', 'PERCENT')('up to $677', 'MONEY')	-
12/08/2020, 15:37:21	12/07/2020, 14:40:18	BusinessJournal	Francesca's files Chapter 11 bankruptcy, plans to sell to investor	https://www.bizjournals.com/bizwomen/news/latest-news/2020/12/francescas-files-chapter-11-bankruptcy-plans-to.html?ana=brss_1028	The company previously announced plans to close 140 stores.	(Bankruptcy)	Not Computed	('Francesca', 'PERSON')('Chapter 11', 'LAW')	-
12/08/2020, 15:37:21	12/07/2020, 14:29:05	BusinessJournal	Superior Energy Services files Chapter 11 bankruptcy to restructure	https://www.bizjournals.com/houston/news/2020/12/07/superior-energy-services-chapter-11-bankruptcy.html?ana=brss_1028	Superior, which provides completion and production services and equipment to companies in the oil and gas business, has been planning to file for bankruptcy since at least September.	(Bankruptcy)	Not Computed	('Superior Energy Services', 'ORG')('Chapter 11', 'LAW')	-
12/08/2020, 15:37:21	12/07/2020, 10:55:00	BusinessJournal	Milwaukee-area Anytime Fitness franchisee files for Chapter 11	https://www.bizjournals.com/twincities/news/2020/12/07/milwaukee-area-anytime-fitness-franchisee-files.html?ana=brss_1028	The Anytime Fitness chain is franchised by Woodbury-based Self Esteem Brands LLC, which has franchisees operating the 24-hour gyms worldwide.	(Bankruptcy)	Not Computed	('Milwaukee', 'GPE')('Anytime Fitness', 'ORG')('Chapter 11', 'LAW')	-
12/08/2020, 15:37:45	12/07/2020, 07:30:38	PEHub	SPAC Capitol Investment Corp V raises $345m in IPO	https://www.pehub.com/spac-capitol-investment-corp-v-raises-345m-in-ipo/	Capitol Investment Corp raised $1.53 billion across five SPACs since 2007 and closed four SPAC mergers.	(Funding /Possible_Funding /IPOs)	Not Computed	('SPAC Capitol Investment Corp', 'ORG')('$345m', 'MONEY')	-
12/08/2020, 15:37:52	12/03/2020, 11:28:07	PEHub	Highland Transcend debuts IPO	https://www.pehub.com/highland-transcend-debuts-ipo/	Highland Transcend Partners I Corp, a tech-focused blank check company, has raised $275 million for its IPO after pricing its 27.5 million shares at $10 per share.	(IPOs)	Not Computed	('Highland Transcend', 'PERSON')	-
12/08/2020, 15:37:57	12/08/2020, 15:37:57	Fortune	 Nanobiotix, a French biotech developing cancer therapies, plans to raise $95 million in an IPO of ADSs. Read more.	https://www.sec.gov/Archives/edgar/data/1760854/000114036120027413/nt10009390x9_f1a.htm		(Funding /Possible_Funding /IPOs)	Not Computed	('Nanobiotix', 'PERSON')('French', 'NORP')('$95 million', 'MONEY')	-
12/08/2020, 15:37:57	12/08/2020, 15:37:57	Fortune	 Squarespace, the website hosting company, is seeking an IPO in the first half of 2021, per Bloomberg. General Atlantic, Accel, and Index Ventures are among its backers. Read more.	https://www.bloomberg.com/news/articles/2020-12-08/squarespace-is-said-to-talk-to-banks-about-plans-for-2021-ipo?srnd=deals		(IPOs)	Not Computed	('Squarespace', 'PERSON')('the first half of 2021', 'DATE')('Bloomberg', 'GPE')('Atlantic', 'LOC')('Accel', 'GPE')('Index Ventures', 'ORG')	-
12/08/2020, 15:37:57	12/08/2020, 15:37:57	Fortune	 Igua Saneamento SA, a Brazilian sanitation firm, resumed its plans for an initial public offering for the fourth time.	https://fortune.com/newsletter/termsheet/		(IPOs)	Not Computed	('Igua', 'ORG')('Saneamento SA', 'ORG')('Brazilian', 'NORP')('fourth', 'ORDINAL')	-
12/08/2020, 15:37:57	12/08/2020, 15:37:57	Fortune	 CF Acquisition IV, the fourth blank check company formed by Cantor Fitzgerald, filed on Monday with the SEC to raise up to $400 million in an initial public offering. Read more.	https://www.sec.gov/Archives/edgar/data/1825249/000114036120027552/nt10014872x2_s1.htm		(M&A /Funding /Possible_Funding /IPOs)	Not Computed	('CF Acquisition IV', 'ORG')('fourth', 'ORDINAL')('Cantor Fitzgerald', 'PERSON')('Monday', 'DATE')('SEC', 'ORG')('up to $400 million', 'MONEY')	-
12/08/2020, 15:38:30	09/25/2020, 00:00:00	PEProfessional	Paul Hastings Sees Active IPO Market	https://peprofessional.com/2020/09/paul-hastings-sees-active-ipo-market/	While the U.S. IPO market ground to a halt this spring due to the outbreak of the COVID-19 pandemic, beginning in May the market came roaring back, allowing companies with IPO plans in the pipeline before the start of the pandemic to access the market. The summer resurgence has set the stage for an active […]	(IPOs)	Not Computed	('Paul Hastings', 'PERSON')	-
12/08/2020, 15:38:43	12/07/2020, 00:00:00	Crunchbase News-Business	Airbnb Increases IPO Price Range Ahead Of Public Debut	https://news.crunchbase.com/news/airbnb-increases-ipo-price-range-ahead-of-public-debut/	The company has set an increased price range of between $56 and $60 per share, up from $44 to $50.	(IPOs)	Not Computed	('Airbnb Increases IPO Price', 'ORG')	-
12/08/2020, 15:38:43	11/30/2020, 00:00:00	Crunchbase News-Business	DoorDash Sets IPO Price Range, Could See Valuation Of $30B	https://news.crunchbase.com/news/doordash-prices-ipo-could-see-valuation-of-30b/	DoorDash's post-IPO valuation will nearly double from June.	(IPOs)	Not Computed	('30B', 'MONEY')	-
12/08/2020, 15:38:44	12/07/2020, 00:00:00	Crunchbase News-Startups	Wish Sets IPO Price Range	https://news.crunchbase.com/news/wish-sets-ipo-price-range/	When Wish begins trading, it has the potential to be valued at approximately $13.5 billion.	(IPOs)	Not Computed		-
12/08/2020, 15:38:44	12/07/2020, 00:00:00	Crunchbase News-Venture	The Briefing: Catawiki Raises $182M, Airbnb Eyes Upsized IPO Range, And More	https://news.crunchbase.com/news/briefing-12-7-20/	Crunchbase News' top picks of the news to stay current in the VC and startup world.	(Funding /IPOs)	Not Computed	('Catawiki Raises', 'ORG')	-
12/08/2020, 15:38:45	11/02/2020, 00:00:00	Crunchbase News-Liquidity	Unicorns Get More Magical: 2020 Cohort Shows Huge Increase In Valuation On IPO Day	https://news.crunchbase.com/news/unicorns-get-more-magical-2020/	The initial public offering markets have opened up for high-growth tech companies, but most of those filing have been revenue-losing tech companies...	(IPOs)	Not Computed	('2020', 'DATE')	-
12/08/2020, 15:38:45	10/26/2020, 00:00:00	Crunchbase News-Liquidity	This Startup Says Investors Are Most Eager to See These Companies IPO	https://news.crunchbase.com/news/this-startup-says-investors-are-most-eager-to-see-these-companies-ipo/	Stock option-focused platform EquityBee has polled its 5,000-member investor community to put together a pre-IPO “wish list” of companies it wants to...	(IPOs)	Not Computed		-
12/08/2020, 15:38:46	11/20/2020, 00:00:00	Crunchbase News-Public	Wish Files For IPO Citing Losses, Revenue Growth Due To COVID-19	https://news.crunchbase.com/news/wish-files-for-ipo-citing-losses-revenue-growth-due-to-covid-19/	Wish revealed in its IPO filing that it is quite cash wealthy, with about $1.1 billion in cash, cash equivalents and marketable securities.	(IPOs)	Not Computed	('Files For IPO Citing', 'PERSON')	-
12/08/2020, 15:38:46	11/13/2020, 00:00:00	Crunchbase News-Public	DoorDash’s IPO Filing Reveals Revenue, Losses, Market Share	https://news.crunchbase.com/news/doordashs-ipo-filing-reveals-revenue-losses-market-share/	The filing reveals a 226 percent increase in revenue over the past nine months, largely driven by the global pandemic.	(IPOs)	Not Computed		-
12/08/2020, 15:38:46	11/06/2020, 00:00:00	Crunchbase News-Public	Lending Platform Upstart’s IPO Filing Reveals Earnings, Ownership	https://news.crunchbase.com/news/inside-upstarts-s-1-earnings-ownership/	Upstart intends to raise $100 million.	(Possible_M&A /IPOs)	Not Computed		-
12/08/2020, 15:38:46	11/05/2020, 00:00:00	Crunchbase News-Public	Airbnb Lines Up Public IPO Filing For 2020 Debut	https://news.crunchbase.com/news/airbnb-ipo-filing/	Airbnb reportedly plans to set an IPO price range and launch an investor roadshow in December, subject to market conditions.	(IPOs)	Not Computed	('Airbnb', 'GPE')('2020', 'DATE')	-
