12/02/2020, 15:48:19	12/02/2020, 19:29:23	FinSME	fuboTV Acquires Balto Sports	https://www.finsmes.com/2020/12/fubotv-acquires-balto-sports.html	fuboTV Inc. (NYSE: FUBO), a sports-first live TV streaming platform, acquired Balto Sports, a company that develops tools for users to organize and play fantasy sports games. Terms of the deal were not disclosed. The acquisition marks fuboTV&#8217;s first move into the online sports wagering market, which is expected to reach $155 billion by 2024 [&#8230;]The post fuboTV Acquires Balto Sports appeared first on FinSMEs.	(M&A)	Not Computed	('fuboTV Acquires', 'PERSON')	-
12/02/2020, 15:48:19	12/02/2020, 19:05:39	FinSME	Curio Wellness Launches $30M Investment Fund	https://www.finsmes.com/2020/12/curio-wellness-launches-30m-investment-fund.html	Timonium, Md.-based medical cannabis and wellness company Curio Wellness has launched a new funding program. Led by Jerel Registre, Managing Director, the initiative will provide start-up capital to minority business owners to open their own Curio Wellness franchise location. Created for women, minorities and disabled veterans, Curio Wellness’s investment fund will allow the company to [&#8230;]The post Curio Wellness Launches $30M Investment Fund appeared first on FinSMEs.	(Funding)	Not Computed	('Curio Wellness', 'ORG')	-
12/02/2020, 15:48:19	12/02/2020, 18:15:50	FinSME	ShipMonk Raises $290M in Growth Equity Funding	https://www.finsmes.com/2020/12/shipmonk-raises-290m-in-growth-equity-funding.html	ShipMonk, a Fort Lauderdale, FL-based provider of ecommerce fulfillment and technology solutions, raised $290m in growth equity funding round. The round was led by global growth investor Summit Partners. In conjunction with the funding, Summit Partners’ Managing Director Christopher Dean and Vice President Chelsea Jurman joined its Board of Directors. The company intends to use [&#8230;]The post ShipMonk Raises $290M in Growth Equity Funding appeared first on FinSMEs.	(Funding)	Not Computed	('ShipMonk Raises', 'ORG')('290', 'MONEY')	-
12/02/2020, 15:48:19	12/02/2020, 17:57:17	FinSME	Step Raises $50M in Series B Funding	https://www.finsmes.com/2020/12/step-raises-50m-in-series-b-funding.html	Step, a San Francisco, CA-based financial services company built for teens and families, raised $50m in Series B funding. The round was led by Coatue, with participation from returning investors Stripe, Crosslink Capital, Collaborative Fund and Will Smith’s Dreamers VC and new investors Charli D’Amelio, Justin Timberlake, The Chainsmokers, Eli Manning, Kelvin Beachum, Larry Fitzgerald [&#8230;]The post Step Raises $50M in Series B Funding appeared first on FinSMEs.	(Funding)	Not Computed		-
12/02/2020, 15:48:19	12/02/2020, 17:39:30	FinSME	Capco Acquires Neos LLC	https://www.finsmes.com/2020/12/capco-acquires-neos-llc.html	Acquisition of insurance-focused consultancy underlines Capco’s continued commitment to growth in the sector NEW YORK&#8211;(BUSINESS WIRE)&#8211;Capco, the global management and technology consultancy, today announces the acquisition of NEOS LLC (‘NEOS’), a Hartford, CT based consultancy focused on helping leading insurance organizations drive transformational change. The transaction will complement and extend Capco’s growing insurance services. NEOS’s [&#8230;]The post Capco Acquires Neos LLC appeared first on FinSMEs.	(M&A)	Not Computed	('Capco Acquires Neos LLC', 'PERSON')	-
12/02/2020, 15:48:19	12/02/2020, 17:31:43	FinSME	Supergreat Raises $6.5M in Series A Funding	https://www.finsmes.com/2020/12/supergreat-raises-6-5m-in-series-a-funding.html	Supergreat, a NYC-based community-based app for beauty enthusiasts to review, shop, and share tips on their favorite products, raised $6.5m in Series A funding. The round, which brought the total amount raised to date to $9m, was led by Benchmark with participation from TQ Ventures, an investment fund led by Scooter Braun, Schuster Tanger and [&#8230;]The post Supergreat Raises $6.5M in Series A Funding appeared first on FinSMEs.	(Funding)	Not Computed	('Supergreat Raises', 'ORG')('$6.5M', 'MONEY')	-
12/02/2020, 15:48:19	12/02/2020, 17:14:34	FinSME	Soil Connect Raises $3.25M in Seed Funding	https://www.finsmes.com/2020/12/soil-connect-raises-3-25m-in-seed-funding.html	Soil Connect, a NYC-based digital marketplace focused on the soil and aggregates industry, closed a $3.25m seed funding round. The round was led by TIA Ventures and Heartland Ventures with participation from CEMEX Ventures, Great Oaks Venture Capital, Situs Real Estate, Altmark Group, AB Investment Group, J.G. Pertucci Company and Bazella Contracting. The company intends [&#8230;]The post Soil Connect Raises $3.25M in Seed Funding appeared first on FinSMEs.	(Funding)	Not Computed	('Soil Connect Raises', 'ORG')('3.25', 'MONEY')	-
12/02/2020, 15:48:19	12/02/2020, 17:01:21	FinSME	Virta Health Raises $65M in Series D Funding	https://www.finsmes.com/2020/12/virta-health-raises-65m-in-series-d-funding.html	Virta Health, a San Francisco, CA-based company dedicated to reversing type 2 diabetes without medications or surgery, raised $65m in Series D funding. The round, which brought total funding to more than $230m and valued Virta Health at over $1.1 billion, was led by Sequoia Capital Global Equities with participation from Caffeinated Capital. The company intends [&#8230;]The post Virta Health Raises $65M in Series D Funding appeared first on FinSMEs.	(Funding)	Not Computed	('Virta Health Raises', 'ORG')('$65M', 'MONEY')	-
12/02/2020, 15:48:19	12/02/2020, 16:32:21	FinSME	Openfit Acquires LeBron James’ and Arnold Schwarzenegger’s Sports Nutrition Company Ladder	https://www.finsmes.com/2020/12/openfit-acquires-lebron-james-and-arnold-schwarzeneggers-sports-nutrition-company-ladder.html	Ladder’s line of premium sports nutrition supplements to be fully incorporated into the Openfit offering Founding athletes also join Openfit with multi-year development and promotional partnership SANTA MONICA, Calif.&#8211;(BUSINESS WIRE)&#8211;Openfit, one of today’s fastest growing digital fitness and nutrition platforms, continues to expand its offering, today announcing its acquisition of Ladder, the sports nutrition company [&#8230;]The post Openfit Acquires LeBron James&#8217; and Arnold Schwarzenegger&#8217;s Sports Nutrition Company Ladder appeared first on FinSMEs.	(M&A)	Not Computed	('Openfit Acquires LeBron James’', 'ORG')('Arnold Schwarzenegger’s', 'PERSON')	-
12/02/2020, 15:48:19	12/02/2020, 14:38:45	FinSME	Voi Technology Raises $160M in Funding	https://www.finsmes.com/2020/12/voi-technology-raises-160m-in-funding.html	Voi Technology, a Stockholm, Sweden-based micro-mobility company, raised $160m in funding. The round was led by The Raine Group with participation from existing investors VNV Global, Balderton, Creandum, Project A, Inbox and Stena Sessan joined by top entrepreneurs and executives from Delivery Hero, Klarna, iZettle, Zillow, Kry/Livi and Amazon.  In conjunction with the funding, Voi [&#8230;]The post Voi Technology Raises $160M in Funding appeared first on FinSMEs.	(Funding)	Not Computed	('Voi Technology Raises', 'ORG')	-
12/02/2020, 15:48:19	12/02/2020, 13:41:17	FinSME	Ridecell Raises $45M in Series C Financing	https://www.finsmes.com/2020/12/ridecell-raises-45m-in-series-c-financing.html	Ridecell Inc., a San Francisco, CA-based fleet platform for digital transformation, secured $45m in Series C financing round. The round was led by new investor, Fort Ross Ventures, with participation from new investor Solasta Ventures and existing investors Activate Capital, DENSO, LG Technology Ventures, and Initialized Capital.  The company intends to use the funds to [&#8230;]The post Ridecell Raises $45M in Series C Financing appeared first on FinSMEs.	(Possible_Funding)	Not Computed	('Ridecell Raises', 'ORG')('45', 'MONEY')	-
12/02/2020, 15:48:19	12/02/2020, 13:24:25	FinSME	Bizzabo Raises $138M in Funding	https://www.finsmes.com/2020/12/bizzabo-raises-138m-in-funding.html	Bizzabo, a NYC-based Event Success Platform provider, raised $138m in Series E funding. The round was led by Insight Partners, with participation from previous investors, Viola Growth, Next47, and OurCrowd.In conjunction with the funding, Matt Gatto, a Managing Director at Insight Partners, will join the Bizzabo board of directors. Led by Eran Ben-Shushan, CEO &#38; [&#8230;]The post Bizzabo Raises $138M in Funding appeared first on FinSMEs.	(Funding)	Not Computed	('Bizzabo Raises', 'ORG')('138', 'MONEY')	-
12/02/2020, 15:48:19	12/02/2020, 12:38:07	FinSME	Avalara Buys Impendulo	https://www.finsmes.com/2020/12/avalara-buys-impendulo.html	Avalara (NYSE: AVLR), a provider of tax compliance automation software for businesses of all sizes, acquired Impendulo Limited, a London, UK-based provider of insurance tax compliance solutions. The financial terms of the deal were not disclosed. The acquisition will give Avalara access to the global insurance compliance business, a new market that could benefit from [&#8230;]The post Avalara Buys Impendulo appeared first on FinSMEs.	(M&A)	Not Computed	('Avalara Buys Impendulo', 'PERSON')	-
12/02/2020, 15:48:19	12/02/2020, 12:24:00	FinSME	MaaT Pharma Raises €7.35M Series B Extension; Closes €25.35M Round	https://www.finsmes.com/2020/12/maat-pharma-raises-e7-35m-series-b-extension-closes-e25-35m-round.html	MaaT Pharma, a Lyon, France-based clinical stage company, raised an additional €7.35m in ($8.7m) in Series B financing round, bringing the total raised in this round to €25.35m. The round was led by PSIM Fund, managed by Bpifrance on behalf of the French State, with participation from SkyViews Life Science and Celeste Management. In February, [&#8230;]The post MaaT Pharma Raises €7.35M Series B Extension; Closes €25.35M Round appeared first on FinSMEs.	(Possible_Funding)	Not Computed	('Pharma Raises', 'ORG')('7.35', 'MONEY')('25.35', 'MONEY')	-
12/02/2020, 15:48:19	12/02/2020, 10:33:22	FinSME	Kayentis Raises €7M in Funding	https://www.finsmes.com/2020/12/kayentis-raises-e7m-in-funding.html	Kayentis, a Grenoble, France-based provider of digital data capture systems for clinical trials, raised €7M (approx. $8.3M) in growth funding. The round was led by historical investors Extens and LBO France with participation from new backer Bpifrance. The company intends to use the funds to accelerate R&#38;D activities, enriching its new eCOA platform &#8211; Clin&#8217;form3 [&#8230;]The post Kayentis Raises €7M in Funding appeared first on FinSMEs.	(Funding)	Not Computed	('Kayentis Raises', 'ORG')	-
12/02/2020, 15:48:19	12/02/2020, 10:19:08	FinSME	Market Access Transformation Receives $30M in First Institutional Investment	https://www.finsmes.com/2020/12/market-access-transformation-receives-30m-in-first-institutional-investment.html	Market Access Transformation (MAT), a Short Hills, N.J.-based global healthcare company, received a $30m minority investment from Silversmith Capital Partners. The company intends to use the funds to expand the team and accelerate innovation of its product offerings. Founded in 2016, Market Access Transformation is a global healthcare company that uses technology to automate and modernize how life [&#8230;]The post Market Access Transformation Receives $30M in First Institutional Investment appeared first on FinSMEs.	(Funding)	Not Computed	('30', 'MONEY')	-
12/02/2020, 15:48:19	12/02/2020, 10:01:26	FinSME	Planned Raises $4.7M in Venture Financing	https://www.finsmes.com/2020/12/planned-raises-4-7m-in-venture-financing.html	Planned, a Montreal, Canada-based provider of a software solution that empowers corporate event planners to discover and book suppliers, while saving, and tracking budget, raised $4.7m in venture financing. Backers in the round, which brought total raised to $7M, included Inovia Capital, Telegraph Hill Capital and N49P. The company intends to use the funds to [&#8230;]The post Planned Raises $4.7M in Venture Financing appeared first on FinSMEs.	(Funding /Possible_Funding)	Not Computed	('$4.7M', 'MONEY')	-
12/02/2020, 15:48:19	12/02/2020, 09:31:18	FinSME	Dorm Raises $1M in Funding	https://www.finsmes.com/2020/12/dorm-raises-1m-in-funding.html	Dorm, a London, UK-based education platform for influencers, entrepreneurs and creators, raised $1m in funding. Backers included Plug &#38; Play Ventures, Playfair Capital, and RLC Ventures. Founded by former Sweatcoin chief growth officer Ranbir Arora and chief operating officer Taras Polischuk, Dorm provides an education platform for influencers, entrepreneurs and creators in the passion economy. Launching [&#8230;]The post Dorm Raises $1M in Funding appeared first on FinSMEs.	(Funding)	Not Computed	('Dorm Raises', 'ORG')('$1M', 'MONEY')	-
12/02/2020, 15:48:19	12/02/2020, 09:21:47	FinSME	RxSight Receives $60M Credit Facility from Oxford Finance	https://www.finsmes.com/2020/12/rxsight-receives-60m-credit-facility-from-oxford-finance.html	RxSight, Inc., an Aliso Viejo, CA-based medical technology company that has commercialized FDA-approved adjustable intraocular lens that is customized after cataract surgery, closed a $60m senior secured term loan with Oxford Finance. The funds will be used for general working capital, including sales and marketing, and research and development. RxSight has developed FDA-approved adjustable intraocular [&#8230;]The post RxSight Receives $60M Credit Facility from Oxford Finance appeared first on FinSMEs.	(Possible_Funding)	Not Computed	('60M Credit Facility', 'FAC')	-
12/02/2020, 15:48:19	12/02/2020, 01:05:04	FinSME	Accenture Acquires Olikka	https://www.finsmes.com/2020/12/accenture-acquires-olikka.html	Accenture (NYSE: ACN) acquired Olikka, a Melbourne, Australia-based provider of cloud migration and related services. The amount of the deal was not disclosed. The acquisition will enhance Accenture’s Amazon Web Services (AWS) and Microsoft Azure capabilities, as well as its broader cloud capabilities across Australia and New Zealand. The addition of Olikka’s team will further [&#8230;]The post Accenture Acquires Olikka appeared first on FinSMEs.	(M&A)	Not Computed		-
12/02/2020, 15:48:19	12/02/2020, 00:25:14	FinSME	Salesforce to Acquire Acumen Solutions	https://www.finsmes.com/2020/12/salesforce-to-acquire-acumen-solutions.html	Salesforce (NYSE: CRM) is to acquire Acumen Solutions, a McLean, VA-based professional services firm with deep Salesforce knowledge and extensive industry expertise across public sector, manufacturing, financial services and more. The amount of the deal was not disclosed. With Acumen Solutions&#8217; industry knowledge and expertise, Salesforce Professional Services will be able to help industry customers [&#8230;]The post Salesforce to Acquire Acumen Solutions appeared first on FinSMEs.	(M&A)	Not Computed		-
12/02/2020, 15:48:19	12/02/2020, 00:03:50	FinSME	Salesforce To Acquire Slack Technologies, for $27.7 Billion	https://www.finsmes.com/2020/12/salesforce-to-acquire-slack-technologies-for-27-7-billion.html	CRM giant Salesforce (NYSE: CRM) is to acquire enterprise communications platform Slack Technologies, Inc. (NYSE: WORK). Under the terms of the deal, Slack shareholders will receive $26.79 in cash and 0.0776 shares of Salesforce common stock for each Slack share, representing an enterprise value of approximately $27.7 billion based on the closing price of Salesforce’s [&#8230;]The post Salesforce To Acquire Slack Technologies, for $27.7 Billion appeared first on FinSMEs.	(M&A)	Not Computed	('$27.7 Billion', 'MONEY')	-
12/02/2020, 15:48:19	12/01/2020, 22:18:58	FinSME	West Monroe Acquires Two Six Capital, a Data Science Firm for Private Equity	https://www.finsmes.com/2020/12/west-monroe-acquires-two-six-capital-a-data-science-firm-for-private-equity.html	CHICAGO&#8211;(BUSINESS WIRE)&#8211;West Monroe, a national business and technology consulting firm, today announced it has acquired Two Six Capital, a San Francisco-based, technology-enabled firm that pioneered data science for private equity. Founded in 2013, Two Six Capital leverages proprietary technology—powered by artificial intelligence and machine learning—to advise private equity firms with one primary objective: understand and [&#8230;]The post West Monroe Acquires Two Six Capital, a Data Science Firm for Private Equity appeared first on FinSMEs.	(M&A)	Not Computed		-
12/02/2020, 15:48:19	12/01/2020, 22:08:26	FinSME	GoSecure Closes $35M Series E Funding Round	https://www.finsmes.com/2020/12/gosecure-closes-35m-series-e-funding-round.html	GoSecure, a Montreal, Canada- and La Jolla, CA-based provider of Managed Detection and Response (MDR) solutions, closed a $35m Series E funding round. The round was led by W Investments Group, with guidance from Yaletown Partners. The company intends to use the funds to continue to expand operations and its business reach. Led by Neal Creighton, [&#8230;]The post GoSecure Closes $35M Series E Funding Round appeared first on FinSMEs.	(Possible_Funding)	Not Computed	('35', 'MONEY')	-
12/02/2020, 15:48:19	12/01/2020, 21:03:06	FinSME	Tallac Therapeutics Raises $62M in Series A Financing	https://www.finsmes.com/2020/12/tallac-therapeutics-raises-62m-in-series-a-financing.html	Tallac Therapeutics, Inc., a Burlingame, Calif.-based biopharmaceutical company harnessing the power of innate and adaptive immunity to fight cancer, raised $62m in Series A financing. Backers included venBio Partners, Morningside Venture, Lightstone Ventures, Matrix Partners China, and MRL Ventures Fund. The company plans to use the funding to advance the discovery and development of immunotherapy [&#8230;]The post Tallac Therapeutics Raises $62M in Series A Financing appeared first on FinSMEs.	(Possible_Funding)	Not Computed	('Tallac Therapeutics Raises', 'ORG')('$62M', 'MONEY')	-
12/02/2020, 15:48:19	12/01/2020, 19:18:25	FinSME	Proscia Raises $23M in Series B Funding	https://www.finsmes.com/2020/12/proscia-raises-23m-in-series-b-funding.html	Proscia, a Philadelphia, PA-based provider of digital and computational pathology solutions, secured $23m in Series B funding. The round, which brought its funding total to $35m, was led by Scale Venture Partners, with participation from Hitachi Ventures, the strategic corporate venture capital arm of Hitachi, Ltd. The company will use the funds to: accelerate commercial expansion, ramping [&#8230;]The post Proscia Raises $23M in Series B Funding appeared first on FinSMEs.	(Funding)	Not Computed	('Proscia Raises', 'ORG')('23', 'MONEY')	-
12/02/2020, 15:48:19	12/01/2020, 19:06:29	FinSME	Newomics Raises $7.9M in Series B Financing	https://www.finsmes.com/2020/12/newomics-raises-7-9m-in-series-b-financing.html	Newomics Inc., a Berkeley, Calif.-based biotechnology company developing and commercializing mass spectrometry solutions for molecular detection applications, closed a $7.9m Series B financing. The round was led by MSA Capital with participation from new investor LDV Partners, and existing Series A investors the Berkeley Catalyst Fund and the Photon Fund. The proceeds will be used [&#8230;]The post Newomics Raises $7.9M in Series B Financing appeared first on FinSMEs.	(Possible_Funding)	Not Computed	('7.9', 'MONEY')	-
12/02/2020, 15:48:19	12/01/2020, 18:50:50	FinSME	EVerZom Raises €1.1M in Funding	https://www.finsmes.com/2020/12/everzom-raises-e1-1m-in-funding.html	EVerZom, a Paris, France-based biopharmaceutical company specialized in the bioproduction of exosomes, raised €1.1m in funding. Backers included institutional and private investors. This funding will speed up the platform development and scale-up, with the objective to allow routine clinical grade production by 2022. Led by Jeanne Volatron, Co-founder and President, EVerZom is to develop an [&#8230;]The post EVerZom Raises €1.1M in Funding appeared first on FinSMEs.	(Funding)	Not Computed	('EVerZom Raises', 'ORG')	-
12/02/2020, 15:48:19	12/01/2020, 18:07:29	FinSME	Flock Freight Raises $113.5M in Series C Funding	https://www.finsmes.com/2020/12/flock-freight-raises-113-5m-in-series-c-funding.html	Flock Freight, a Solona Beach, Calif.-based digital logistics provider that offers a shared truckload shipping solution for businesses, raised $113.5m in Series C financing. The round was led by Softbank Vision Fund 2, with participation from existing investors SignalFire, GLP Capital Partners, and GV and new investor Volvo Group Venture Capital. In conjunction with the funding, Ervin [&#8230;]The post Flock Freight Raises $113.5M in Series C Funding appeared first on FinSMEs.	(Funding)	Not Computed	('113.5', 'MONEY')	-
12/02/2020, 15:48:19	12/02/2020, 18:35:00	Businesswire Merger	Steele Expands Industry-Leading Risk Data &amp; Insights Platform Through info4c Acquisition	http://www.businesswire.com/news/home/20201202005867/en/Steele-Expands-Industry-Leading-Risk-Data-Insights-Platform-Through-info4c-Acquisition/	SAN FRANCISCO & ZURICH--(BUSINESS WIRE)--Steele Compliance Solutions, Inc. today announced the acquisition of info4c, bolstering its patented AI-driven platform, Risk Intelligence Data.	(M&A)	Not Computed	('Steele Expands Industry-Leading', 'PERSON')('Insights Platform Through info4c Acquisition', 'ORG')	-
12/02/2020, 15:48:19	12/02/2020, 18:00:00	Businesswire Merger	Exactech Acquires Muvr, Innovative Patient Wearable and Communication Solutions for Orthopaedic Practices	http://www.businesswire.com/news/home/20201202005809/en/Exactech-Acquires-Muvr-Innovative-Patient-Wearable-and-Communication-Solutions-for-Orthopaedic-Practices/	GAINESVILLE, Fla.--(BUSINESS WIRE)--Exactech, a developer and producer of innovative implants, instrumentation and smart technologies for joint replacement surgery, today announced the acquisition of Muvr Labs Inc, a pioneer in intelligent patient wearables and digital communication tools. The latest addition to Exactech’s Active Intelligence® platform of technologies, the Muvr portfolio is designed to help surgeons engage with their joint replacement patients throughout the journey of care. Th	(M&A)	Not Computed	('Exactech Acquires Muvr', 'ORG')('Innovative Patient Wearable and Communication Solutions for Orthopaedic Practices', 'ORG')	-
12/02/2020, 15:48:19	12/02/2020, 17:28:00	Businesswire Merger	RMG Acquisition Corp. Announces the Nomination of Paul Williams to Serve on the Board of Directors of Romeo Power upon Consummation of Merger	http://www.businesswire.com/news/home/20201202005811/en/RMG-Acquisition-Corp.-Announces-the-Nomination-of-Paul-Williams-to-Serve-on-the-Board-of-Directors-of-Romeo-Power-upon-Consummation-of-Merger/	NEW YORK & LOS ANGELES--(BUSINESS WIRE)--RMG Acquisition Corp. (the “Company”) announced the nomination of Paul Williams for election at a special meeting of stockholders of the Company to serve on the board of directors of the combined company upon consummation of the previously announced merger between the Company and Romeo Systems, Inc. (“Romeo Power”). Prior to his retirement in 2018, Mr. Williams served as a Partner and Managing Director of Major, Lindsey &amp; Africa, LLC, an executive re	(M&A)	Not Computed	('RMG Acquisition Corp.', 'ORG')('the Nomination of', 'ORG')('Paul Williams', 'PERSON')('the Board of Directors', 'ORG')('Romeo Power', 'PERSON')	-
12/02/2020, 15:48:19	12/02/2020, 16:52:00	Businesswire Merger	Convergint Technologies Deepens Expertise in Financial and Healthcare Industries With Two Acquisitions	http://www.businesswire.com/news/home/20201202005781/en/Convergint-Technologies-Deepens-Expertise-in-Financial-and-Healthcare-Industries-With-Two-Acquisitions/	SCHAUMBURG, Ill.--(BUSINESS WIRE)--Convergint Technologies, a global leader in service-based systems integration, today announced the acquisition of Innovative Medical Systems (IMS), a leading value-added reseller of select acute care and technical products for hospitals, and the acquisition of Smith Hamilton, Inc., a nationally recognized provider of equipment and security solutions for financial institutions. Both acquisitions will further deepen and expand Convergint’s presence within the fi	(M&A)	Not Computed	('Convergint Technologies Deepens Expertise in Financial and Healthcare Industries With Two Acquisitions', 'ORG')	-
12/02/2020, 15:48:19	12/02/2020, 16:30:00	Businesswire Merger	Fifth Third Bancorp Builds Upon Healthcare Industry M&amp;A and Investment Banking Capabilities with Acquisition of Hammond Hanlon Camp LLC	http://www.businesswire.com/news/home/20201202005640/en/Fifth-Third-Bancorp-Builds-Upon-Healthcare-Industry-MA-and-Investment-Banking-Capabilities-with-Acquisition-of-Hammond-Hanlon-Camp-LLC/	CINCINNATI--(BUSINESS WIRE)--Fifth Third Bancorp (Nasdaq: FITB) announced today that Fifth Third Acquisition Holdings, LLC., has agreed to acquire Hammond Hanlon Camp LLC (“H2C”), a premier strategic advisory and investment banking firm focused on hospitals, health systems, and related organizations. “As Fifth Third continues to seek opportunities to build upon the strength of its healthcare team, the addition of H2C further deepens the value we provide to the industry,” said Kevin Lavender, ex	(M&A /Funding)	Not Computed	('Fifth', 'ORDINAL')('Third', 'ORDINAL')('Investment Banking Capabilities with Acquisition of', 'ORG')('Hammond Hanlon Camp LLC', 'ORG')	-
