11/11/2020, 17:16:38	11/10/2020, 21:03:37	BusinessJournal	Houston real estate investment trust Hartman names next CEO	https://www.bizjournals.com/houston/news/2020/11/10/hartman-reit-names-mark-torok-next-ceo.html?ana=brss_1028	Mark Torok, who joined Hartman more than five years ago and was promoted to COO in July, will be the next CEO.	(Funding)	Not Computed	('Houston', 'GPE')('Hartman', 'PERSON')	-
11/11/2020, 17:16:38	11/10/2020, 21:02:03	BusinessJournal	Amazon facing antitrust charges in Europe	https://www.bizjournals.com/seattle/news/2020/11/10/amazon-facing-antitrust-charges-in-europe.html?ana=brss_1028	The EU says Amazon is unfairly using third-party seller data to benefit sales of its own products, which directly compete with those of independent merchants.	(No Keywords detect)	(Possible_M&A)	('Amazon', 'ORG')('Europe', 'LOC')	-
11/11/2020, 17:16:38	11/10/2020, 20:56:01	BusinessJournal	Maize retail strip — with a new fast-food restaurant coming soon — sells to new owner	https://www.bizjournals.com/wichita/news/2020/11/10/maize-retail-strip-sells-to-new-owner.html?ana=brss_1028	"We were looking for properties that were mildly resistant to Covid," the broker said.	(Possible_M&A)	Not Computed		-
11/11/2020, 17:16:38	11/10/2020, 20:52:08	BusinessJournal	Mystery investor takes stake in SA oil company	https://www.bizjournals.com/sanantonio/news/2020/11/10/unnamed-investor-takes-a-piece-of-sa-oil-company.html?ana=brss_1028	The unnamed investor has plunked $15 million into upgrading an oil way station in the Caribbean.	(No Keywords detect)	(Possible_Funding)	('SA', 'ORG')	-
11/11/2020, 17:16:38	11/10/2020, 20:44:32	BusinessJournal	Rockwell reinstates full pay for employees early as revenue improves	https://www.bizjournals.com/milwaukee/news/2020/11/10/rockwell-revenue-improving-benefits-for-employees.html?ana=brss_1028	With Rockwell Automation’s sales rebounding in the most recent quarter — a positive bellwether for an industrial recovery — the company will accelerate by one month reinstating full pay and a 401(k) match for employees.	(No Keywords detect)	(Possible_M&A)	('Rockwell', 'ORG')	-
11/11/2020, 17:16:38	11/10/2020, 20:41:27	BusinessJournal	JCPenney purchase approved by court, on track to operate under new ownership this month	https://www.bizjournals.com/dallas/news/2020/11/10/jcpenney-bankruptcy.html?ana=brss_1028	The court approved the sale of the retail company, which is now on track to operate under new ownership by the end of the month.	(Possible_M&A)	Not Computed	('JCPenney', 'ORG')('this month', 'DATE')	-
11/11/2020, 17:16:38	11/10/2020, 20:33:46	BusinessJournal	Apartment complex near UNC Charlotte sells for $95.3 million	https://www.bizjournals.com/charlotte/news/2020/11/10/haven-49-unc-charlotte-apartment-sale.html?ana=brss_1028	TPG Real Estate purchased an apartment complex on University City Boulevard for more than $95 million last week, according to real estate records. The firm acquired the complex from an entity affiliated with Preferred Apartment Communities Inc.	(Possible_M&A /Possible_Funding)	Not Computed	('UNC Charlotte', 'GPE')('$95.3 million', 'MONEY')	-
11/11/2020, 17:16:38	11/10/2020, 20:33:28	BusinessJournal	Homebuilder buys site near Ross Bridge for $12M	https://www.bizjournals.com/birmingham/news/2020/11/10/signature-homes-acquires-property-off-highway-150.html?ana=brss_1028	Signature Homes has closed on a large swathe of vacant land for a new development.	(M&A)	Not Computed	('Ross Bridge', 'FAC')('12', 'MONEY')	-
11/11/2020, 17:16:38	11/10/2020, 20:32:38	BusinessJournal	Zix acquires Israel-based CloudAlly for $30M	https://www.bizjournals.com/dallas/news/2020/11/10/zix-cloudally.html?ana=brss_1028	Zix has made an acquisition that adds key tools in cloud storage.	(M&A)	Not Computed	('Zix', 'ORG')('Israel', 'GPE')('CloudAlly', 'ORG')('30', 'MONEY')	-
11/11/2020, 17:16:38	11/10/2020, 20:25:26	BusinessJournal	Pick 'n Save parent Kroger revamps distribution plan to add micro-fulfillment centers	https://www.bizjournals.com/milwaukee/news/2020/11/10/kroger-adds-micro-fulfillment-centers.html?ana=brss_1028	Kroger Co. has shifted gears for its plans to develop new distribution centers aimed at boosting digital sales by getting products to customers more quickly and efficiently.	(No Keywords detect)	(Possible_M&A)	('Pick', 'ORG')('Kroger', 'PERSON')	-
11/11/2020, 17:16:38	11/10/2020, 20:24:16	BusinessJournal	Ohio REIT scoops land slated for apartments, retail near Crabtree Mall	https://www.bizjournals.com/triangle/news/2020/11/10/welltower-buys-site-for-apartments-crabtree-mall.html?ana=brss_1028	A REIT with a history of investment in the Triangle has bought land slated for a new apartment and retail project next to Crabtree Valley Mall.	(Possible_Funding)	Not Computed	('Ohio', 'GPE')	-
11/11/2020, 17:16:38	11/10/2020, 20:24:00	BusinessJournal	Convention center rebuilds events schedule with first-time shows, millions in new biz	https://www.bizjournals.com/orlando/news/2020/11/10/convention-center-recoups-lost-business-orlando.html?ana=brss_1028	The industry has been rocked by the pandemic.	(Possible_Funding)	Not Computed	('first', 'ORDINAL')('millions', 'CARDINAL')	-
11/11/2020, 17:16:38	11/10/2020, 20:22:33	BusinessJournal	Meritex doubles down on Eagan with $36M industrial acquisition	https://www.bizjournals.com/twincities/news/2020/11/10/meritex-buys-eagan-buildings-36-million.html?ana=brss_1028	The Meritex Co. has paid $36 million for three fully-leased industrial buildings in Eagan, and the Minneapolis-based firm has an appetite for more acquisitions.	(M&A)	Not Computed	('Eagan', 'GPE')('36', 'MONEY')	-
11/11/2020, 17:16:38	11/10/2020, 20:19:12	BusinessJournal	Chase Properties in Beachwood buys Alabama shopping center in spite of Covid-19	https://www.bizjournals.com/cleveland/news/2020/11/10/chase-properties-buys-alabama-shopping-center.html?ana=brss_1028	Shops on the Circle is a 183,000-square-foot shopping center anchored by TJ Maxx, Big Lots, PetSmart, Five Below and Old Navy.	(M&A)	Not Computed	('Chase Properties', 'ORG')('Beachwood', 'GPE')('Alabama', 'GPE')	-
11/11/2020, 17:16:38	11/10/2020, 20:17:11	BusinessJournal	Criterion Development Partners buys 43 acres in Éilan mixed-use community	https://www.bizjournals.com/sanantonio/news/2020/11/10/developer-buys-43-acres-in-mixed-use.html?ana=brss_1028	The new development will continue the rapid growth of the surrounding area.	(M&A)	Not Computed	('Criterion Development Partners', 'ORG')('43 acres', 'QUANTITY')('Éilan', 'LOC')	-
11/11/2020, 17:16:38	11/10/2020, 20:16:38	BusinessJournal	Spruce raises $8M for on-demand housekeeping for apartment communities	https://www.bizjournals.com/austin/inno/stories/fundings/2020/11/10/on-demand-housekeeping-for-apartment-communities.html?ana=brss_1028	Originally called Apartment Butler, Spruce offers apartment communities a range of services through a marketplace platform and app. That includes housekeeping, dog walking, disinfecting, laundry and smaller, one-off jobs like the dishes.	(Funding)	Not Computed	('$8M', 'MONEY')	-
11/11/2020, 17:16:38	11/10/2020, 20:14:49	BusinessJournal	Highwoods sells Greensboro properties as part of $127.5 million sale	https://www.bizjournals.com/triangle/news/2020/11/10/highwoods-sells-more-of-greensboro-properties.html?ana=brss_1028	A Greensboro group buys three of the buildings.	(Possible_M&A)	Not Computed	('Greensboro', 'ORG')('$127.5 million', 'MONEY')	-
11/11/2020, 17:16:38	11/10/2020, 20:10:00	BusinessJournal	Why Anchor Bank pursued acquisition of rival during a pandemic	https://www.bizjournals.com/southflorida/news/2020/11/10/why-anchor-bank-to-acquire-bank.html?ana=brss_1028	The purchase will give the $168 million-asset bank a presence in Broward County.	(M&A)	Not Computed		-
11/11/2020, 17:16:38	11/10/2020, 20:09:56	BusinessJournal	Mayo Clinic establishes new fund for racial equity — and is looking for First Coast nonprofits to partner with	https://www.bizjournals.com/jacksonville/news/2020/11/10/mayo-clinic-establishes-new-grant-racial-equity.html?ana=brss_1028	The Mayo Clinic recently announced the creation of a new grant fund with the goal of promote racial equity in local communities served by the organization.	(Funding)	Not Computed	('Mayo Clinic', 'ORG')('First Coast', 'ORG')	-
11/11/2020, 17:16:38	11/10/2020, 20:07:18	BusinessJournal	Duke Energy to offer North Carolina's rooftop solar rebates in two rounds starting next year	https://www.bizjournals.com/triangle/news/2020/11/10/duke-energy-will-offer-ncs-rooftop-solar-rebates.html?ana=brss_1028	For three years, Duke Energy has taken applications for $12.3 million worth of rooftop solar rebates on one day in January, creating a mad rush annually. In 2021, Duke will accept applications for half of those rebates in January and the remainder in July.	(Possible_Funding)	Not Computed	('Duke Energy', 'ORG')("North Carolina's", 'GPE')('two', 'CARDINAL')('next year', 'DATE')	-
11/11/2020, 17:16:38	11/10/2020, 20:05:10	BusinessJournal	Atlanta developer Portman Residential pursues project beyond outfield wall of Nashville Sounds ballpark	https://www.bizjournals.com/nashville/news/2020/11/10/atlanta-developer-nashville-sounds-ballpark-land.html?ana=brss_1028	Early this year, Austin-based developer John Trube had been under contract to buy part of the same site, where he planned a seven-story hotel. Financing for those type of projects all but evaporated after the Covid-19 pandemic broke out.	(No Keywords detect)	(M&A /Possible_Funding)	('Atlanta', 'GPE')('Portman', 'NORP')('Nashville Sounds', 'GPE')	-
11/11/2020, 17:16:38	11/10/2020, 20:05:09	BusinessJournal	Douglas sells significant chunk of its New City DC land near Ivy City	https://www.bizjournals.com/washington/news/2020/11/10/douglas-development-new-city-dc-land-sale.html?ana=brss_1028	The $35 million deal involves more than a quarter of the site.	(Possible_M&A /Possible_Funding)	Not Computed	('Douglas', 'PERSON')('New City DC', 'GPE')('Ivy City', 'GPE')	-
11/11/2020, 17:16:38	11/10/2020, 20:05:00	BusinessJournal	New mansion in Boca Raton sells for $14M	https://www.bizjournals.com/southflorida/news/2020/11/10/new-mansion-in-boca-raton-sells-for-14m.html?ana=brss_1028	The home has a clubroom with a bar.	(Possible_M&A)	Not Computed	('Boca Raton', 'GPE')('14', 'MONEY')	-
11/11/2020, 17:16:38	11/10/2020, 19:58:55	BusinessJournal	TIAA buys Octave apartments for $86.1 million	https://www.bizjournals.com/nashville/news/2020/11/10/octave-apartments.html?ana=brss_1028	A Charlotte-based LLC registered to the Teachers Insurance and Annuity Association of America-College Retirement Equities Fund, or TIAA, recently bought Melrose apartment complex Octave.	(M&A /Possible_Funding)	Not Computed	('TIAA', 'ORG')('$86.1 million', 'MONEY')	-
11/11/2020, 17:16:38	11/10/2020, 19:54:45	BusinessJournal	Columbus investor buys big Georgia property	https://www.bizjournals.com/columbus/news/2020/11/10/core-real-estate-capital-buys-in-georgia.html?ana=brss_1028	The transaction marks the 50th investment from Core, which has more than $1 billion in assets under management.	(M&A)	Not Computed	('Columbus', 'ORG')('Georgia', 'GPE')	-
11/11/2020, 17:16:38	11/10/2020, 19:53:40	BusinessJournal	Esper’s firing unlikely to rock contractors’ boats, but concerns remain	https://www.bizjournals.com/washington/news/2020/11/10/espers-firing-wont-affect-dod-contracts.html?ana=brss_1028	The move two months before inauguration isn't likely to impact contractors' work, but it does raise national security concerns.	(No Keywords detect)	(Funding)		-
11/11/2020, 17:16:38	11/10/2020, 19:53:21	BusinessJournal	North Florida Land Trust purchases three acres for Fernandina Beach	https://www.bizjournals.com/jacksonville/news/2020/11/10/nflt-three-acres-fernandina-beach.html?ana=brss_1028	The North Florida Land Trust announced the completion of its purchase of two parcels of conservation land for the City of Fernandina Beach.	(Possible_Funding)	Not Computed	('North Florida Land Trust', 'ORG')('three acres', 'QUANTITY')('Fernandina Beach', 'GPE')	-
11/11/2020, 17:16:38	11/10/2020, 19:52:05	BusinessJournal	After buying a Brooklyn warehouse, this executive is looking for more opportunities in New York City	https://www.bizjournals.com/newyork/news/2020/11/10/brooklyn-industrial-property-sells-28-million.html?ana=brss_1028	A Maryland company has purchased another New York City industrial property, and it's looking for more acquisition opportunities, an executive says: "We're very much in growth mode."	(M&A)	Not Computed	('Brooklyn', 'GPE')('New York City', 'GPE')	-
11/11/2020, 17:16:38	11/10/2020, 19:47:13	BusinessJournal	Huge Oldham County health care project could go head-to-head with major area industry players	https://www.bizjournals.com/louisville/news/2020/11/10/oldham-county-health-care-development-could-rival.html?ana=brss_1028	Executives involved with the project said that, while final estimates are not available, projects of a similar scope could cost $100 million.	(No Keywords detect)	(Possible_Funding)	('Oldham County', 'GPE')	-
11/11/2020, 17:16:38	11/10/2020, 19:46:16	BusinessJournal	Duke Energy awards $1M in promised justice, equity grants for North Carolina nonprofits	https://www.bizjournals.com/charlotte/news/2020/11/10/duke-energy-makles-promised-1m-in-nc-justice-and.html?ana=brss_1028	Local nonprofits will get $125,000 of the $1 million that Duke Energy Foundation awarded Tuesday to address issues of social justice and racial equity.	(No Keywords detect)	(Possible_Funding)	('Duke Energy', 'ORG')('$1M', 'MONEY')('North Carolina', 'GPE')	-
11/11/2020, 17:16:38	11/10/2020, 19:42:33	BusinessJournal	Cleveland financial advisor puts together financing to redevelop historic NASA Glenn site	https://www.bizjournals.com/cleveland/news/2020/11/10/cleveland-firm-finds-financing-for-nasa-glenn-site.html?ana=brss_1028	The Brown Gibbons Lang team had to be creative to put together financing to redevelop a historic NASA Glenn site.	(Possible_Funding)	Not Computed	('Cleveland', 'GPE')('NASA', 'ORG')('Glenn', 'PERSON')	-
11/11/2020, 17:16:38	11/10/2020, 19:40:24	BusinessJournal	Mazzone Hospitality to take over catering at Mohawk Golf Club	https://www.bizjournals.com/albany/news/2020/11/10/mohawk-golf-club-mazzone-hospitality-deal.html?ana=brss_1028	The club's new owner has invested more than $2 million on a new pool, pool house, the golf course, grounds and banquet area.	(No Keywords detect)	(Funding /Possible_Funding)	('Mohawk Golf Club', 'PERSON')	-
11/11/2020, 17:16:38	11/10/2020, 19:39:24	BusinessJournal	Prairiefire revision includes more retail, including grocer, in place of office	https://www.bizjournals.com/kansascity/news/2020/11/10/prairiefire-merrill-overland-park-changes-plan.html?ana=brss_1028	Overland Park planners gave the thumbs-up to the second revision Merrill Cos. LLC has made this year for Prairiefire's village center — an estimated $63.3 million phase.	(No Keywords detect)	(Possible_Funding)		-
11/11/2020, 17:16:38	11/10/2020, 19:34:56	BusinessJournal	Grubhub providing $2M in grants to help restaurants prepare for winter amid Covid-19 resurgence	https://www.bizjournals.com/philadelphia/news/2020/11/10/grubhub-providing-2m-grant-to-help-restaurants.html?ana=brss_1028	The new Restaurant Strong Fund will accept applications from all restaurants in Philadelphia, New York City, Boston or Chicago with five or fewer locations.	(No Keywords detect)	(Funding)	('$2M', 'MONEY')('winter', 'DATE')	-
11/11/2020, 17:16:38	11/10/2020, 19:33:38	BusinessJournal	Houston Wire & Cable appoints permanent CFO	https://www.bizjournals.com/houston/news/2020/11/10/houston-wire-cable-appoints-permanent-cfo.html?ana=brss_1028	The move comes after a series of changes at the top of the company this year.	(No Keywords detect)	(Possible_Funding)	('Houston Wire & Cable', 'ORG')	-
11/11/2020, 17:16:38	11/10/2020, 19:30:27	BusinessJournal	Spotify to buy podcast ad platform Megaphone for $235M	https://www.bizjournals.com/newyork/news/2020/11/10/spotify-to-buy-podcast-ad-platform-megaphone.html?ana=brss_1028	Ad revenue will get a boost through Megaphone’s targeted ads and streaming ad insertions.	(M&A)	Not Computed	('Megaphone', 'ORG')('235', 'MONEY')	-
11/11/2020, 17:16:38	11/10/2020, 19:29:21	BusinessJournal	Beyoncé, Peloton ink multi-year partnership deal	https://www.bizjournals.com/newyork/news/2020/11/10/beyonc-peloton-ink-multi-year-partnership-deal.html?ana=brss_1028	The collaboration will include workouts themed around HBCU Homecoming.	(Possible_Funding)	Not Computed	('Peloton', 'ORG')('multi-year', 'DATE')	-
11/11/2020, 17:16:38	11/10/2020, 19:28:11	BusinessJournal	Broward insurance company FedNat could be considering a sale	https://www.bizjournals.com/southflorida/news/2020/11/10/fednat-could-be-considering-a-sale.html?ana=brss_1028	The insurer's board of directors created a strategic review committee to review its options.	(Possible_M&A)	Not Computed	('Broward', 'GPE')('FedNat', 'ORG')	-
11/11/2020, 17:16:38	11/10/2020, 19:24:19	BusinessJournal	Highwoods Properties sells Greensboro properties as part of $127.5 million sale	https://www.bizjournals.com/triad/news/2020/11/10/highwoods-sells-more-of-greensboro-properties.html?ana=brss_1028	A Greensboro group buys three of the buildings.	(Possible_M&A)	Not Computed	('Highwoods Properties', 'ORG')('Greensboro', 'ORG')('$127.5 million', 'MONEY')	-
11/11/2020, 17:16:38	11/10/2020, 19:24:14	BusinessJournal	Packaged food maker expanding in Hudson with a little help from partners	https://www.bizjournals.com/cleveland/news/2020/11/10/arlington-valley-farms-expanding-in-hudson.html?ana=brss_1028	The maker of Snack'N Waffles plans to invest $4.5 million in capital equipment and hire 97 people to run its production lines.	(No Keywords detect)	(Funding /Possible_Funding)	('Hudson', 'LOC')	-
11/11/2020, 17:16:38	11/10/2020, 19:23:40	BusinessJournal	Highmark Health presents delayed $20 million renovation plan for Fifth Avenue Place headquarters	https://www.bizjournals.com/pittsburgh/news/2020/11/10/highmark-health-presents-20-million-renovation.html?ana=brss_1028	Presentation by AE7 calls for reconfigured entrance, outdoor terrace space and more new trees and plantings.	(Possible_Funding)	Not Computed	('Highmark Health', 'ORG')('$20 million', 'MONEY')('Fifth Avenue Place', 'FAC')	-
11/11/2020, 17:16:38	11/10/2020, 19:18:48	BusinessJournal	Plug Power hits record quarter, poised to pick new factory site this year	https://www.bizjournals.com/albany/news/2020/11/10/fuel-cell-maker-plug-power-marks-record-quarter.html?ana=brss_1028	The Latham fuel cell maker just finished its third quarter with $125.6 million in gross billings, the highest tally since the company was founded in 1997.	(No Keywords detect)	(Possible_Funding)	('Plug Power', 'ORG')('quarter', 'DATE')('this year', 'DATE')	-
11/11/2020, 17:16:38	11/10/2020, 19:15:07	BusinessJournal	With merger complete, JCAP CEO talks staff reduction, potential HQ move	https://www.bizjournals.com/memphis/news/2020/11/10/jcap-ceo-john-good-merger.html?ana=brss_1028	Some key executives will be leaving, and JCAP's name is set to change to NexPoint Storage.	(M&A)	Not Computed		-
11/11/2020, 17:16:38	11/10/2020, 19:14:38	BusinessJournal	Sansone Group scores East Coast site for latest industrial development	https://www.bizjournals.com/stlouis/news/2020/11/10/sansone-group-new-jersey-acquisition.html?ana=brss_1028	The commercial real estate firm plans to build a 1.3 million-square-foot speculative distribution center.	(Possible_Funding)	Not Computed	('Sansone Group', 'ORG')('East Coast', 'LOC')	-
11/11/2020, 17:16:38	11/10/2020, 19:13:31	BusinessJournal	Kroger revamps distribution plan to add micro-fulfillment centers	https://www.bizjournals.com/cincinnati/news/2020/11/10/kroger-adds-micro-fulfillment-centers.html?ana=brss_1028	Kroger Co. has shifted gears for its plans to develop new distribution centers aimed at boosting digital sales by getting products to customers more quickly and efficiently.	(No Keywords detect)	(Possible_M&A)		-
11/11/2020, 17:16:38	11/10/2020, 19:05:06	BusinessJournal	Revolution backs 3D printing startup working to repair tissues and organs	https://www.bizjournals.com/chicago/inno/stories/fundings/2020/11/10/revolution-backs-dimension-inx.html?ana=brss_1028	A Northwestern University spinout that creates materials for organ and tissue implants raised a seed round of funding from backers that include well-known VC firm Revolution.	(No Keywords detect)	(Funding)		-
11/11/2020, 17:16:38	11/10/2020, 19:04:15	BusinessJournal	Trailhead Biosystems raises $6.6 million to fight Covid-19, Alzheimer’s, diabetes	https://www.bizjournals.com/cleveland/news/2020/11/10/cleveland-biotech-raises-6-6-million.html?ana=brss_1028	The Cleveland company said it's also developing a drug combination to treat Covid-19.	(Funding /Possible_Funding)	Not Computed	('$6.6 million', 'MONEY')	-
11/11/2020, 17:16:38	11/10/2020, 19:00:49	BusinessJournal	SBA ordered to release PPP loan details — and that could help deter fraud in a second PPP round	https://www.bizjournals.com/washington/news/2020/11/10/sba-ppp-loan-fraud-court.html?ana=brss_1028	More transparency in the loan program could deter bad actors, a slew of experts said.	(Possible_Funding)	Not Computed	('SBA', 'ORG')('second', 'ORDINAL')	-
11/11/2020, 17:16:38	11/10/2020, 19:00:00	BusinessJournal	Custom framing company Framebridge continues to push into new markets	https://www.bizjournals.com/bizwomen/news/latest-news/2020/11/custom-framing-company-framebridge-new-markets.html?ana=brss_1028	CEO Susan Tynan has led record-setting funding rounds.	(No Keywords detect)	(Funding /Possible_Funding)	('Framebridge', 'PRODUCT')	-
11/11/2020, 17:16:38	11/10/2020, 18:48:18	BusinessJournal	St. Louis fiber startup targets expansion after snagging private equity investment	https://www.bizjournals.com/stlouis/news/2020/11/10/st-louis-fiber-startup-targets-expansion-after-sn.html?ana=brss_1028	Gateway Fiber Holdings, a locally based developer of fiber broadband networks, has plans to expand its footprint into St. Charles County after obtaining an investment from a private equity partner.	(Funding)	Not Computed	('St. Louis', 'GPE')	-
11/11/2020, 17:16:38	11/10/2020, 18:42:02	BusinessJournal	Conlon & Co., a Chicago-based merchant bank, buys 690K-SF industrial building in Midlothian	https://www.bizjournals.com/dallas/news/2020/11/10/conlon-midlothian-industrial.html?ana=brss_1028	This is the company's second acquisition in North Texas in the last 30 days.	(M&A)	Not Computed	('Conlon & Co.', 'ORG')('Chicago', 'GPE')	-
11/11/2020, 17:16:38	11/10/2020, 18:37:55	BusinessJournal	Scholfield opens new pre-owned car lot in west Wichita space vacated because of Covid	https://www.bizjournals.com/wichita/news/2020/11/10/scholfield-honda-used-car-dealership-west-wichita.html?ana=brss_1028	Now that Covid-19 has forced the closure of Enterprise Car Sales, a new dealership has quickly taken its place.	(No Keywords detect)	(Possible_M&A)	('west Wichita', 'LOC')	-
11/11/2020, 17:16:38	11/10/2020, 18:35:26	BusinessJournal	Netrality executive buys Miami Beach mansion for $11M (Photos)	https://www.bizjournals.com/southflorida/news/2020/11/10/netrality-executive-buys-miami-beach-mansion.html?ana=brss_1028	The home has a large rooftop deck.	(M&A)	Not Computed	('Miami Beach', 'GPE')('11', 'MONEY')	-
11/11/2020, 17:16:38	11/10/2020, 18:30:44	BusinessJournal	Sale of St. Louis hospital inches closer	https://www.bizjournals.com/stlouis/news/2020/11/10/sale-of-st-louis-hospital-inches-closer.html?ana=brss_1028	The facility has been involved in two bankruptcies in as many years, but may soon emerge from court proceedings with a new owner.	(Possible_M&A)	Not Computed	('St. Louis', 'GPE')	-
11/11/2020, 17:16:38	11/10/2020, 18:28:50	BusinessJournal	New lease deals: Empire State Building signs another new tenant, while gallery inks renewal	https://www.bizjournals.com/newyork/news/2020/11/10/office-deals-manhattan-empire-state-building.html?ana=brss_1028	Two tenants have taken space in Midtown Manhattan, one with a new lease and the other with a lease renewal.	(Possible_Funding)	Not Computed	('Empire State Building', 'FAC')	-
11/11/2020, 17:16:38	11/10/2020, 18:25:34	BusinessJournal	City of Orlando condemns I-Drive Grand Resort & Suites	https://www.bizjournals.com/orlando/news/2020/11/10/orlando-condemns-idrive-grand-resort-and-suites.html?ana=brss_1028	The property has been on and off the market for sale in recent years.	(No Keywords detect)	(Possible_M&A)	('Orlando', 'GPE')	-
11/11/2020, 17:16:38	11/10/2020, 18:21:27	BusinessJournal	Builders, architects, owners of five Triad housing complexes settle discrimination cases	https://www.bizjournals.com/triad/news/2020/11/10/triad-housing-complexes-settle-discrimination-case.html?ana=brss_1028	Respondents agreed to make $1.3 million in accessibility modifications to make the complexes accessible to persons with disabilities in compliance with the federal Fair Housing Act.	(No Keywords detect)	(Possible_Funding)	('five', 'CARDINAL')('Triad', 'ORG')	-
11/11/2020, 17:16:38	11/10/2020, 18:20:19	BusinessJournal	Venminder closes on $33 million in Series C fundraising round	https://www.bizjournals.com/louisville/news/2020/11/10/venminder-raises-33-million.html?ana=brss_1028	The fast-growing company has tripled its revenue over the past three years.	(Possible_Funding)	Not Computed	('$33 million', 'MONEY')('Series C', 'EVENT')	-
11/11/2020, 17:16:38	11/10/2020, 18:09:33	BusinessJournal	Gahanna property fetches $20M	https://www.bizjournals.com/columbus/news/2020/11/10/gahanna-property-fetches-20m.html?ana=brss_1028	A brand-new warehouse in Gahanna has sold to Pennsylvania-based Exeter Property Group for $20 million.	(No Keywords detect)	(Possible_Funding)	('Gahanna', 'PERSON')('20', 'MONEY')	-
