11/11/2020, 17:16:38	11/09/2020, 16:13:48	BusinessJournal	Ohio State, Power Five sought to outflank NCAA on athlete name and image legislation, emails show	https://www.bizjournals.com/dayton/news/2020/11/09/ohio-state-power-five-ncaa-name-image-likeness.html?ana=brss_1028	Leaders from the Big Ten, SEC, Pac-12, ACC and Big 12 sought to take the lead on efforts to lobby Congress about the rights of student-athletes to their name, image and likeness, which could drastically change the college sports landscape by allowing athletes to score lucrative sponsorship deals.	(No Keywords detect)	(Possible_Funding)	('Ohio State', 'ORG')('Five', 'CARDINAL')('NCAA', 'ORG')	-
11/11/2020, 17:16:38	11/09/2020, 16:13:36	BusinessJournal	Hudson Hill Capital buys British shipping franchising company InXpress	https://www.bizjournals.com/newyork/news/2020/11/09/hudson-hill-capital-buys-british-shipping.html?ana=brss_1028	New York-based Hudson Hill Capital said it acquired a majority stake of InXpress Holdings in conjunction with the company's senior management team.	(M&A)	Not Computed	('Hudson Hill Capital', 'ORG')('British', 'NORP')	-
11/11/2020, 17:16:38	11/09/2020, 16:09:57	BusinessJournal	Milwaukee selects General Capital, KG Development to build affordable apartments on North Avenue land	https://www.bizjournals.com/milwaukee/news/2020/11/09/city-selects-general-capital-kg-for-north-ave-site.html?ana=brss_1028	General Capital Group is partnering with Milwaukee minority developer KG Development Group to potentially build affordable apartments on East North Avenue.	(Possible_Funding)	Not Computed	('Milwaukee', 'GPE')('General Capital', 'ORG')('KG Development', 'ORG')('North Avenue', 'FAC')	-
11/11/2020, 17:16:38	11/09/2020, 15:54:25	BusinessJournal	Red Rabbit Kitchen and Bar in Midtown getting new ownership	https://www.bizjournals.com/sacramento/news/2020/11/09/red-rabbit-leadership-changes.html?ana=brss_1028	"Like all startups, things go through an evolution," said Sonny Mayugba, a primary shareholder in the business.	(Possible_M&A)	Not Computed		-
11/11/2020, 17:16:38	11/09/2020, 15:50:16	BusinessJournal	Louisville Pizza Week returns this month	https://www.bizjournals.com/louisville/news/2020/11/09/louisville-pizza-week-returns-this-month.html?ana=brss_1028	Find out who is participating this year and how you can score $9 pies.	(No Keywords detect)	(Possible_Funding)	('Louisville Pizza Week', 'ORG')('this month', 'DATE')	-
11/11/2020, 17:16:38	11/09/2020, 15:46:52	BusinessJournal	These are the highest-paid employees at JCPS (DATABASE)	https://www.bizjournals.com/louisville/news/2020/11/09/highest-paid-employees-jcps.html?ana=brss_1028	In our Public Paycheck series, we've created a database of JCPS employees.	(No Keywords detect)	(Possible_Funding)		-
11/11/2020, 17:16:38	11/09/2020, 15:31:09	BusinessJournal	'Queer Eye' launches merchandise store on Amazon	https://www.bizjournals.com/bizwomen/news/latest-news/2020/11/queer-eye-launches-a-merchandise-store-on-amazon.html?ana=brss_1028	The Netflix series already has inspired a Walmart furniture collection.	(No Keywords detect)	(Possible_Funding)	("Queer Eye'", 'ORG')('Amazon', 'ORG')	-
11/11/2020, 17:16:38	11/09/2020, 15:13:33	BusinessJournal	Bonanza Creek Energy buying Colorado oil competitor in deal valued at $376M	https://www.bizjournals.com/denver/news/2020/11/09/bonanza-creek-energy-highpoint-oil-merger-denver.html?ana=brss_1028	Oil industry consolidation drives two Colorado players to combine.	(M&A)	Not Computed	('Bonanza Creek Energy', 'ORG')('Colorado', 'GPE')('376', 'MONEY')	-
11/11/2020, 17:16:38	11/09/2020, 15:06:43	BusinessJournal	Nuro raises $500M more to further develop self-driving delivery technology	https://www.bizjournals.com/sanjose/news/2020/11/09/nuro-raises-500m-self-driving-delivery.html?ana=brss_1028	The new funding for the Mountain View autonomous technology company is said to push its valuation to $5 billion.	(Funding)	Not Computed	('$500M', 'MONEY')	-
11/11/2020, 17:16:38	11/09/2020, 14:45:31	BusinessJournal	Here’s what marketing experts expect from this season’s holiday ads	https://www.bizjournals.com/bizwomen/news/latest-news/2020/11/here-s-what-marketing-experts-expect-from-this-sea.html?ana=brss_1028	Take a look at how brands will get you to buy during a Covid Christmas.	(No Keywords detect)	(M&A)	('season', 'DATE')	-
11/11/2020, 17:16:38	11/09/2020, 14:44:13	BusinessJournal	Why The Vested Group funded an e-waste documentary	https://www.bizjournals.com/dallas/inno/stories/news/2020/11/09/the-vested-group.html?ana=brss_1028	Looking to walk the talk of "conscious capitalism," Plano's The Vested Group has funded a documentary highlighting the issues surrounding e-waste.	(Funding)	Not Computed	('The Vested Group', 'ORG')	-
11/11/2020, 17:16:38	11/09/2020, 14:42:37	BusinessJournal	Another Auburn Boulevard property sold to dealership	https://www.bizjournals.com/sacramento/news/2020/11/09/auburn-boulevard-property-sold-to-dealership.html?ana=brss_1028	Auburn Boulevard's popularity for auto dealers continues, with another sale of land likely to become part of one under a new owner.	(No Keywords detect)	(Possible_M&A /Possible_Funding)		-
11/11/2020, 17:16:38	11/09/2020, 14:39:25	BusinessJournal	VA home loans skyrocket in North Texas with 119% increase	https://www.bizjournals.com/dallas/news/2020/11/09/veterans-affairs-va-home-loans-dallas-fort-worth.html?ana=brss_1028	Millennials and Gen X veterans buying homes and refinancing mortgages is fueling a spike in VA loans in DFW.	(No Keywords detect)	(M&A)	('North Texas', 'LOC')('119%', 'PERCENT')	-
11/11/2020, 17:16:38	11/09/2020, 14:35:06	BusinessJournal	Birmingham developer's project sells for $76M	https://www.bizjournals.com/birmingham/news/2020/11/09/pasco-apartments-sold-for-76million.html?ana=brss_1028	The garden-style development wrapped up construction in 2019.	(Possible_M&A)	Not Computed	('Birmingham', 'GPE')('76', 'MONEY')	-
11/11/2020, 17:16:38	11/09/2020, 14:27:43	BusinessJournal	Global Finance recognizes BBVA for pandemic response	https://www.bizjournals.com/birmingham/news/2020/11/09/global-finance-recognizes-bbva-usa-for-pandemic.html?ana=brss_1028	One of Birmingham’s largest banks has been recognized for its leadership during the global Covid-19 pandemic.	(Possible_Funding)	Not Computed	('Global Finance', 'ORG')	-
11/11/2020, 17:16:38	11/09/2020, 14:21:53	BusinessJournal	SpringFree Trampoline, with U.S. office in Plano, saw demand soar as pandemic hit	https://www.bizjournals.com/dallas/news/2020/11/09/springfree-trampoline-plano.html?ana=brss_1028	SpringFree Trampoline saw online sales more than quadruple in the U.S.	(No Keywords detect)	(Possible_M&A)	('SpringFree Trampoline', 'ORG')('U.S.', 'GPE')('Plano', 'GPE')	-
11/11/2020, 17:16:38	11/09/2020, 14:13:11	BusinessJournal	Former CEO of Bay Area medical device startup sentenced to 11 years in prison	https://www.bizjournals.com/sanjose/news/2020/11/09/former-ceo-garrans-sanovas-startup-jail.html?ana=brss_1028	The sentence for fraud and other charges comes after former Sanovas CEO Larry Gerrans was found guilty of siphoning money from the company to buy a $2 million San Anselmo home, a Maserati and more, according to the U.S. Department of Justice.	(No Keywords detect)	(M&A /Possible_Funding)	('Bay Area', 'LOC')('11 years', 'DATE')	-
11/11/2020, 17:16:38	11/09/2020, 14:11:29	BusinessJournal	VTA program seeks to help small businesses through Covid with faster payments	https://www.bizjournals.com/sanjose/news/2020/11/09/vta-small-business-covid.html?ana=brss_1028	The region's transit authority finds a way to do something more with the $1.7 billion worth of stuff it buys every year — pay its suppliers faster.	(No Keywords detect)	(M&A)	('Covid', 'PERSON')	-
11/11/2020, 17:16:38	11/09/2020, 14:10:46	BusinessJournal	St. Louis startup Flipstik wins investment on 'Shark Tank'	https://www.bizjournals.com/stlouis/news/2020/11/09/st-louis-startup-wins-investment-on-shark-tank.html?ana=brss_1028	This St. Louis entrepreneur won an investment on Friday's episode of "Shark Tank" for his local startup Flipstik. Here's which shark he lured in.	(Funding)	Not Computed	('St. Louis', 'GPE')	-
11/11/2020, 17:16:38	11/09/2020, 14:10:26	BusinessJournal	Atlanta firm buys defunct movie theater in key Raleigh, N.C. corridor	https://www.bizjournals.com/atlanta/news/2020/11/09/atlanta-firm-buys-defunct-movie-theater-in-raleigh.html?ana=brss_1028	An Atlanta real estate investor paid $8 million for the site of a shuttered Raleigh movie theater in an area the city has targeted for growth.	(M&A)	Not Computed	('Atlanta', 'GPE')('Raleigh', 'GPE')('N.C.', 'GPE')	-
11/11/2020, 17:16:38	11/09/2020, 13:56:52	BusinessJournal	Florida universities to be judged on new metrics for some state funding	https://www.bizjournals.com/jacksonville/news/2020/11/09/new-metrics-for-state-university-funding.html?ana=brss_1028	Performance based funding now has two new metrics for the 12 state universities.	(Funding)	Not Computed	('Florida', 'GPE')	-
11/11/2020, 17:16:38	11/09/2020, 13:50:00	BusinessJournal	Palantir co-founder Joe Lonsdale moving VC firm to Austin from San Francisco	https://www.bizjournals.com/austin/news/2020/11/09/palantir-co-founder-takes-his-vc-firm-hq-to-texas.html?ana=brss_1028	Joe Lonsdale co-founded Palantir Technologies, which just went public, and was an early employee at PayPal. But in recent years he's been a venture capitalist, running 8VC out of San Francisco. Now he's moving the investment firm to Austin, driven out of California by taxes and other concerns. According to CNBC, Lonsdale has already hosted Elon Musk and Michael Dell at his new Austin home.	(No Keywords detect)	(Funding)	('Joe Lonsdale', 'PERSON')('Austin', 'PERSON')('San Francisco', 'GPE')	-
11/11/2020, 17:16:38	11/09/2020, 13:46:01	BusinessJournal	Evidence mounts of potential widespread fraud in PPP program	https://www.bizjournals.com/kansascity/news/2020/11/09/ppp-fraud-sba-fbi.html?ana=brss_1028	As Covid-19 surges anew and talk of another round of stimulus heats up, government officials and data point to potentially widespread abuse and fraud in the Paycheck Protection Program.	(No Keywords detect)	(Possible_Funding)		-
11/11/2020, 17:16:38	11/09/2020, 13:45:27	BusinessJournal	DeSoto County uses $300K in CARES Act funds to promote tourism	https://www.bizjournals.com/memphis/news/2020/11/09/desoto-county-cares-act-tourism.html?ana=brss_1028	DeSoto County is using CARES Act funds to entice travelers to visit North Mississippi.	(Funding)	Not Computed	('DeSoto County', 'GPE')('300', 'MONEY')	-
11/11/2020, 17:16:38	11/09/2020, 13:30:33	BusinessJournal	Spyglass Apartments sell for $54 million	https://www.bizjournals.com/jacksonville/news/2020/11/09/spyglass-apartments-sell-for-54-million.html?ana=brss_1028	Walker & Dunlop announced the sale of a Jacksonville apartment complex to a California-based property management company for $54 million last week.	(Possible_M&A /Possible_Funding)	Not Computed	('$54 million', 'MONEY')	-
11/11/2020, 17:16:38	11/09/2020, 13:27:37	BusinessJournal	Guidewell acquires WebTPA, an administrator of self-funded employer health plans.	https://www.bizjournals.com/jacksonville/news/2020/11/09/guidewell-acquires-webtpa.html?ana=brss_1028	The deal is the second recently announced acquisition by the Jacksonville-based holding company.	(M&A)	Not Computed	('Guidewell', 'ORG')	-
11/11/2020, 17:16:38	11/09/2020, 13:10:00	BusinessJournal	‘Fargo’ may have been shot in Chicago, but KC architecture provides inspiration for sets	https://www.bizjournals.com/kansascity/news/2020/11/09/fargo-fx-kansas-city-architecture.html?ana=brss_1028	The fourth season of the FX hit series may be filmed in Chicago, but it's set in Kansas City, which provides inspiration for the sets and architecture.	(No Keywords detect)	(Possible_Funding)	('Fargo', 'PERSON')('Chicago', 'GPE')('KC', 'GPE')	-
11/11/2020, 17:16:38	11/09/2020, 13:04:03	BusinessJournal	Photo tour: Step inside the $115M luxury Harpeth Square development in historic downtown Franklin	https://www.bizjournals.com/nashville/news/2020/11/09/harpeth-square-franklin.html?ana=brss_1028	A photo tour of a $115 million mixed-use development in historic downtown Franklin — which has economic development officials excited about the role it can play in recruiting companies.	(No Keywords detect)	(Possible_Funding)	('$115M', 'MONEY')('Harpeth Square', 'FAC')('Franklin', 'PERSON')	-
11/11/2020, 17:16:38	11/09/2020, 12:46:47	BusinessJournal	Tech Bytes: CM Group buys European company; entrepreneurs win Mitsubishi program	https://www.bizjournals.com/nashville/news/2020/11/09/tech-bytes-cm-group-buys-european-company.html?ana=brss_1028	In an effort to keep important happenings from slipping through the cracks, we’ve created Tech Bytes — a weekly round up of Middle Tennessee startup and tech-related news, capital raises and other activity.	(M&A)	Not Computed	('CM Group', 'ORG')('European', 'NORP')('Mitsubishi', 'ORG')	-
11/11/2020, 17:16:38	11/09/2020, 12:44:44	BusinessJournal	Exclusive: Apartments in Pasco County sell for $76 million	https://www.bizjournals.com/tampabay/news/2020/11/09/pasco-apartments-sold-for-76million.html?ana=brss_1028	The garden-style development wrapped up construction in 2019.	(Possible_M&A /Possible_Funding)	Not Computed	('Pasco County', 'GPE')('$76 million', 'MONEY')	-
11/11/2020, 17:16:38	11/09/2020, 12:38:17	BusinessJournal	Stockbridge buys Cobb County project near The Battery Atlanta for almost $114M	https://www.bizjournals.com/atlanta/news/2020/11/09/stockbrige-buys-cobb-project-near-the-battery-atla.html?ana=brss_1028	The apartment transaction is one of the largest so far this year in suburban Cobb County, based on sales price.	(M&A)	Not Computed	('Stockbridge', 'ORG')('Cobb County', 'GPE')('The Battery Atlanta', 'ORG')('almost $114', 'MONEY')	-
11/11/2020, 17:16:38	11/09/2020, 12:33:10	BusinessJournal	Georgia native Chase Elliott secures first NASCAR Series Cup title	https://www.bizjournals.com/atlanta/news/2020/11/09/elliott-chase-nascar-georgia-covid-pandemic.html?ana=brss_1028	Dawsonville, Ga. native joins good company in first Cup Series championship.	(Possible_Funding)	Not Computed	('Georgia', 'GPE')('Chase Elliott', 'ORG')('first', 'ORDINAL')('NASCAR Series Cup', 'EVENT')	-
11/11/2020, 17:16:38	11/09/2020, 12:26:13	BusinessJournal	Owners of Halfmoon athletic center seek $1.9 million in tax incentives	https://www.bizjournals.com/albany/news/2020/11/09/halfmoon-athletic-center-seeking-tax-incentives.html?ana=brss_1028	Impact Athletic Center expects to host 40 weekend basketball and volleyball tournaments during its first year, attracting 25,000 spectators, players and coaches from outside the region, generating $250,000 in sales tax revenue for the county.	(Possible_Funding)	Not Computed	('Halfmoon', 'PERSON')('$1.9 million', 'MONEY')	-
11/11/2020, 17:16:38	11/09/2020, 12:20:05	BusinessJournal	Water Street Tampa, more than two years and 5 million square feet into vertical construction, takes shape as a mini city (Photos)	https://www.bizjournals.com/tampabay/news/2020/11/09/water-street-tampa-construction-update.html?ana=brss_1028	Water Street Tampa is rising quickly on a previously moribund corner of Tampa's urban core. We have a building-by-building breakdown of the construction progress — and what you can expect in the months ahead.	(Possible_Funding)	Not Computed	('more than two years', 'DATE')('5 million square feet', 'QUANTITY')	-
11/11/2020, 17:16:38	11/09/2020, 12:10:00	BusinessJournal	NEWSMAKER: How he's planning to double the size of Ingersoll Rand	https://www.bizjournals.com/charlotte/news/2020/11/09/newsmaker-how-he-will-double-ingersoll-rand.html?ana=brss_1028	Gardner Denver Inc.'s acquisition of what is now Trane Technologies’ industrial products divisions turned the Milwaukee manufacturer into an engineered machinery company with its headquarters in Davidson.	(No Keywords detect)	(M&A)	('Ingersoll', 'ORG')	-
11/11/2020, 17:16:38	11/09/2020, 12:00:00	BusinessJournal	Q&A: Why this industrial real estate owner has big ambitions for St. Louis	https://www.bizjournals.com/stlouis/news/2020/11/09/q-a-alfredo-gutierrez-sparrowhawk.html?ana=brss_1028	The company believes the pandemic has proven how its investment strategy is paying off.	(No Keywords detect)	(Funding)	('St. Louis', 'GPE')	-
11/11/2020, 17:16:38	11/09/2020, 11:56:42	BusinessJournal	Large Kosair Charities donation to benefit hospital's emergency department, NICU	https://www.bizjournals.com/louisville/news/2020/11/09/kosair-charities-gift-to-benefit-hospitals-emerge.html?ana=brss_1028	The funding will allow the emergency department, Neonatal Intensive Care Unit and BirthPlace teams to purchase new equipment to help some of their most fragile and youngest patients.	(No Keywords detect)	(Funding)		-
11/11/2020, 17:16:38	11/09/2020, 11:43:26	BusinessJournal	Ventures Roundup: Ryder launches $50M VC fund; Caribshopper raises $1.4M	https://www.bizjournals.com/southflorida/news/2020/11/09/ventures-roundup-11-06-2020.html?ana=brss_1028	The week's venture capital and technology news.	(Funding)	Not Computed	('Ryder', 'ORG')('Caribshopper', 'GPE')('$1.4', 'MONEY')	-
11/11/2020, 17:16:38	11/09/2020, 11:32:09	BusinessJournal	DBJ Pizza Madness Round 2: Giovanni’s Pizza vs. Milano’s Pizza	https://www.bizjournals.com/dayton/news/2020/11/09/dbj-pizza-madness-round-2-giovanni-s-pizza-vs-mi.html?ana=brss_1028	Few foods conjure up as much passion as pizza.	(Possible_Funding)	Not Computed	('DBJ Pizza Madness Round 2:', 'ORG')('Giovanni’s Pizza', 'ORG')('Milano', 'PERSON')	-
11/11/2020, 17:16:38	11/09/2020, 11:25:47	BusinessJournal	Money Roundup: Despite pandemic, Beacon Council reports wins for 2020; Miami-based Acamar Partners inks acquisition	https://www.bizjournals.com/southflorida/news/2020/11/09/money-roundup-11-06-2020.html?ana=brss_1028	The week's banking, finance and economic development news.	(M&A /Possible_Funding)	Not Computed	('Beacon Council', 'ORG')('2020', 'DATE')('Miami', 'GPE')('Acamar Partners', 'ORG')	-
11/11/2020, 17:16:38	11/09/2020, 11:10:59	BusinessJournal	Butler County plant to help produce 200M Covid-19 vaccines	https://www.bizjournals.com/cincinnati/news/2020/11/09/astrazeneca-army-contract.html?ana=brss_1028	A biopharmaceutical company's local facility is part of a nearly $287 million Army contract for the delivery of 200 million doses of a Covid-19 vaccine.	(No Keywords detect)	(Possible_Funding)	('Butler County', 'GPE')('200', 'CARDINAL')	-
11/11/2020, 17:16:38	11/09/2020, 11:00:00	BusinessJournal	GCOM adds $20M in revenue with latest acquisition	https://www.bizjournals.com/albany/news/2020/11/09/gcom-acquires-2020-teknology.html?ana=brss_1028	This is the third acquisition that’s closed since CEO Kamal Bherwani has been involved with the company.	(M&A)	Not Computed	('GCOM', 'ORG')('$20M', 'MONEY')	-
11/11/2020, 17:16:38	11/09/2020, 11:00:00	BusinessJournal	How plant-based meat startup Atlast attracted a well-known chef and GE exec	https://www.bizjournals.com/albany/news/2020/11/09/atlast-food-startup-nick-ruscitto-stephen-lomnes.html?ana=brss_1028	The Green Island startup Atlast Food Co. has made a $20 million bet that it can create and sell a plant-based bacon that tastes like the real thing. And the promise of such a disruptive product has drawn an interesting mix of people to the company.	(No Keywords detect)	(Possible_M&A /Possible_Funding)	('GE', 'ORG')	-
11/11/2020, 17:16:38	11/09/2020, 11:00:00	BusinessJournal	South Jersey CPA firm moves into Southeastern Pennsylvania with acquisition	https://www.bizjournals.com/philadelphia/news/2020/11/09/south-jersey-cpa-firm-moves-into-southeastern-pa.html?ana=brss_1028	The combined firm will include 60 employees with offices in Marlton and Fort Washington.	(M&A)	Not Computed	('South Jersey', 'GPE')('Southeastern Pennsylvania', 'ORG')	-
11/11/2020, 17:16:38	11/09/2020, 10:00:00	BusinessJournal	Washington's most impactful government contracting M&A deals of the last decade	https://www.bizjournals.com/washington/news/2020/11/09/dcs-10-most-impactful-m-a-deals-of-the-decade.html?ana=brss_1028	Bob Kipps, managing director of Tysons investment firm KippsDeSanto & Co., discusses the signature deals that shaped government contracting.	(No Keywords detect)	(Funding)	('Washington', 'GPE')('the last decade', 'DATE')	-
11/11/2020, 17:16:38	11/09/2020, 00:00:00	BusinessJournal	MSI General's Debbink expands ownership to two executives	https://www.bizjournals.com/milwaukee/news/2020/11/08/msi-generals-debbink-expands-ownership-to-two.html?ana=brss_1028	Dirk Debbink, chairman, CEO and sole owner of MSI General Corp. since 2000, brought executives and long-time employees and executives Ken Krahe and John Kutz into the Nashotah construction firm’s ownership circle.	(Possible_M&A)	Not Computed	("MSI General's", 'ORG')('two', 'CARDINAL')	-
11/11/2020, 17:16:53	11/10/2020, 00:00:00	vcaonline	(Deal News) CoImmune, Inc. Announces Closing of $45 Million Series A Financing	https://www.vcaonline.com/news/news.asp?ID=2020111001		(Possible_Funding)	Not Computed	('Deal News)', 'ORG')('CoImmune,', 'ORG')('$45 Million', 'MONEY')	-
11/11/2020, 17:16:53	11/10/2020, 00:00:00	vcaonline	(Deal News) Trailhead Biosystems Raises $6.6 Million in Series A Financing
Therapeutic cell pioneer Trailhead Biosystems raises Series A funding for development of specialized human cells	https://www.vcaonline.com/news/news.asp?ID=2020111010		(Possible_Funding)	Not Computed	('Deal News', 'ORG')('Biosystems Raises', 'ORG')('$6.6 Million', 'MONEY')('Trailhead Biosystems', 'PERSON')('Series', 'EVENT')	-
11/11/2020, 17:16:53	11/10/2020, 00:00:00	vcaonline	(Deal News) Venminder Raises $33 Million in Growth Funding Led by Silversmith Capital Partners	https://www.vcaonline.com/news/news.asp?ID=2020111012		(Funding)	Not Computed	('Deal News', 'ORG')('$33 Million', 'MONEY')('Silversmith Capital Partners', 'ORG')	-
11/11/2020, 17:16:53	11/10/2020, 00:00:00	vcaonline	(Buyout News) Vance Street Capital Partners with Leading Interventional Medical Component Manufacturer Wytech Industries	https://www.vcaonline.com/news/news.asp?ID=2020111032		(M&A)	Not Computed	('Buyout News', 'ORG')('Vance Street Capital Partners', 'ORG')('Leading Interventional Medical Component Manufacturer Wytech Industries', 'ORG')	-
11/11/2020, 17:16:53	11/10/2020, 00:00:00	vcaonline	(Fund News) Bentley Systems Commits $100 Million of Venture Funding to Accelerate Infrastructure Digital Twins	https://www.vcaonline.com/news/news.asp?ID=2020111022		(Funding)	Not Computed	('Fund News', 'ORG')('Bentley Systems Commits', 'ORG')('$100 Million', 'MONEY')	-
11/11/2020, 17:16:53	11/10/2020, 00:00:00	vcaonline	(Deal News) Cigna Ventures, Humana, and Optum Ventures Among Investor Set Re-Upping in Buoy Health Series C Financing	https://www.vcaonline.com/news/news.asp?ID=2020111004		(Possible_Funding)	Not Computed	('Deal News', 'ORG')('Cigna Ventures', 'ORG')('Humana', 'ORG')('Optum Ventures Among', 'ORG')('Set Re-Upping', 'PERSON')('Buoy Health Series C', 'ORG')	-
11/11/2020, 17:16:53	11/10/2020, 00:00:00	vcaonline	(Deal News) Carbon Health Secures $100M in Series C Funding to Become Leading National Healthcare Provider	https://www.vcaonline.com/news/news.asp?ID=2020111002		(Funding /Possible_Funding)	Not Computed	('Deal News)', 'ORG')('Carbon Health Secures', 'ORG')('100', 'MONEY')	-
11/11/2020, 17:16:53	11/10/2020, 00:00:00	vcaonline	(Deal News) Hopin Announces $125 Million in Series B Funding to Power the Surging Virtual and Hybrid Event Industry	https://www.vcaonline.com/news/news.asp?ID=2020111003		(Possible_Funding)	Not Computed	('Deal News', 'ORG')('Hopin', 'NORP')('$125 Million', 'MONEY')	-
11/11/2020, 17:16:53	11/10/2020, 00:00:00	vcaonline	(Deal News) Remote Secures $35 Million in Series A Funding to Transform Global Talent Market	https://www.vcaonline.com/news/news.asp?ID=2020111005		(Possible_Funding)	Not Computed	('Deal News', 'ORG')('Remote Secures', 'ORG')('$35 Million', 'MONEY')	-
11/11/2020, 17:16:53	11/10/2020, 00:00:00	vcaonline	(Deal News) JumpCloud Raises $75 Million to Accelerate Growth	https://www.vcaonline.com/news/news.asp?ID=2020111013		(Funding /Possible_Funding)	Not Computed	('Deal News', 'ORG')('JumpCloud Raises', 'PERSON')('$75 Million', 'MONEY')	-
11/11/2020, 17:16:53	11/10/2020, 00:00:00	vcaonline	(Deal News) R-Zero Raises $15M, Democratizing Access to Biosafety Technologies in the COVID-19 Era and Beyond	https://www.vcaonline.com/news/news.asp?ID=2020111008		(Funding)	Not Computed	('Deal News', 'ORG')('15', 'MONEY')('Biosafety Technologies', 'ORG')('Era', 'PERSON')	-
11/11/2020, 17:16:53	11/10/2020, 00:00:00	vcaonline	(Deal News) Isovalent Launches Breakthrough New Approach to Cloud-Native Networking With $29 Million Series A Led by Andreessen Horowitz and Google	https://www.vcaonline.com/news/news.asp?ID=2020111011		(Possible_Funding)	Not Computed	('Deal News)', 'ORG')('Cloud-Native Networking', 'ORG')('$29 Million', 'MONEY')('Andreessen Horowitz', 'PERSON')	-
11/11/2020, 17:16:53	11/10/2020, 00:00:00	vcaonline	(Deal News) RegTech Pioneer, Compliance.ai Secures Series A Funding Fueling the Expansion of its Platform and Expert Advisory Board	https://www.vcaonline.com/news/news.asp?ID=2020111009		(Funding /Possible_Funding)	Not Computed	('Deal News', 'ORG')('RegTech Pioneer', 'ORG')('Platform and Expert Advisory Board', 'ORG')	-
11/11/2020, 17:16:53	11/10/2020, 00:00:00	vcaonline	(Transition News) TA Associates Announces Hire of Director of Investor Relations	https://www.vcaonline.com/news/news.asp?ID=2020111025		(No Keywords detect)	Not Computed	('Transition News', 'ORG')('TA Associates', 'ORG')	-
11/11/2020, 17:16:53	11/10/2020, 00:00:00	vcaonline	(Transition News) Revelstoke Capital Partners Names New Operating Partner
