11/11/2020, 17:16:17	11/11/2020, 22:09:12	FinSME	Spruce Raises $8M in Series A Funding	https://www.finsmes.com/2020/11/spruce-raises-8m-in-series-a-funding.html	Spruce, an Austin, Texas-based provider of lifestyle services to the multifamily industry, announced $8m in Series A financing. The round was led by Mercury Fund with participation from Sweat Equity Partners. In conjunction with the funding, Andrew White, President of Sweat Equity Partners, will join Spruce&#8217;s board of directors along with Steven Pho, a seasoned marketplace executive with [&#8230;]The post Spruce Raises $8M in Series A Funding appeared first on FinSMEs.	(Funding)	Not Computed	('Spruce Raises', 'PERSON')('$8M', 'MONEY')	-
11/11/2020, 17:16:17	11/11/2020, 19:37:35	FinSME	R-Hauz Solutions Secures $4.5M in Seed Funding	https://www.finsmes.com/2020/11/r-hauz-solutions-secures-4-5m-in-seed-funding.html	R-Hauz Solutions, a Toronto, Canada-based real estate product startup, closed a C$4.5M seed funding round. Backers included BDC Capital, R-LABS, corporate investors, and several angel investors from the Toronto real estate industry. The company focuses on delivering high-quality, purpose-built housing by integrating design and mass-production techniques from manufacturing and automotive industries with City planning frameworks. The company intends to [&#8230;]The post R-Hauz Solutions Secures $4.5M in Seed Funding appeared first on FinSMEs.	(Funding)	Not Computed	('$4.5M', 'MONEY')	-
11/11/2020, 17:16:17	11/11/2020, 19:23:45	FinSME	Trailhead Biosystems Raises $6.6M in Series A Financing	https://www.finsmes.com/2020/11/trailhead-biosystems-raises-6-6m-in-series-a-financing.html	Trailhead Biosystems Inc., a Cleveland, OH-based biotechnology company pioneering the application of machine-enabled science towards understanding and controlling biology, raised $6.6m in Series A financing.  Financing will expand the company&#8217;s High Dimensional Design of Experiments platform (HD-DoE), support the generation of multiple specialized human cells with therapeutic properties and their pilot scale manufacturing. Led by Jan Jensen, PhD, [&#8230;]The post Trailhead Biosystems Raises $6.6M in Series A Financing appeared first on FinSMEs.	(Possible_Funding)	Not Computed	('Biosystems Raises', 'ORG')('6.6M', 'ORG')	-
11/11/2020, 17:16:17	11/11/2020, 18:46:04	FinSME	Qapla’ Closes €950K Funding Round	https://www.finsmes.com/2020/11/qapla-closes-e950k-funding-round.html	Qapla&#8217;, a Near Florence, Italy-based provider of a integrated platform that enables B2C eCommerces to manage shipments in all their steps, closed a €950K funding round. Backers included Track2Marketing (the vehicle company aggregating the Italian Angels for Growth, Doorway e Moffulabs shareholders), CDP Venture Capital SGR via Fondo Acceleratori, and other shareholders including Club Acceleratori [&#8230;]The post Qapla&#8217; Closes €950K Funding Round appeared first on FinSMEs.	(Funding /Possible_Funding)	Not Computed	('Qapla', 'GPE')('950', 'MONEY')	-
11/11/2020, 17:16:17	11/11/2020, 18:28:35	FinSME	Ajay Vashee Joins IVP as General Partner	https://www.finsmes.com/2020/11/ajay-vashee-joins-ivp-as-general-partner.html	IVP, a Menlo Park, Calif.-based later-stage venture capital and growth equity firm, announced that Ajay Vashee is joining as a General Partner. Vashee brings deep operational and financial experience to the role, and will invest in high-growth technology companies across a range of markets, with an initial focus on SaaS, collaboration software, and subscription businesses. [&#8230;]The post Ajay Vashee Joins IVP as General Partner appeared first on FinSMEs.	(No Keywords detect)	(Funding)	('Ajay Vashee Joins IVP', 'PERSON')	-
11/11/2020, 17:16:17	11/11/2020, 17:15:51	FinSME	Roots Automation Raises $3.2M in Seed Funding	https://www.finsmes.com/2020/11/roots-automation-raises-3-2m-in-seed-funding.html	Roots Automation, a NYC-based Digital Coworkers as a Service company, raised $3.2M in seed funding. The round was led by Vestigo Ventures. The company intends to use the funds to accelerate the development of its proven cognitive process automation technology called Digital Coworkers and customer acquisition across financial services, insurance and healthcare verticals. Launched in [&#8230;]The post Roots Automation Raises $3.2M in Seed Funding appeared first on FinSMEs.	(Funding)	Not Computed	('$3.2M in Seed Funding', 'MONEY')	-
11/11/2020, 17:16:17	11/11/2020, 16:55:59	FinSME	R-Zero Raises $15M in Series A Funding	https://www.finsmes.com/2020/11/r-zero-raises-15m-in-series-a-funding.html	R-Zero, a San Francisco, CA-based biosafety company dedicated to developing hospital-grade technologies to reduce the spread of infectious disease, raised $15M in Series A funding. The round was led by DBL Partners, with participation from Bedrock Capital and HAX / SOSV. As part of the round, Ira Ehrenpreis, Managing Partner at DBL Partners, has joined R-Zero’s Board of Directors. This new [&#8230;]The post R-Zero Raises $15M in Series A Funding appeared first on FinSMEs.	(Funding)	Not Computed	('$15M', 'MONEY')	-
11/11/2020, 17:16:17	11/11/2020, 16:45:15	FinSME	Better.com Raises $200M in Series D Funding Round	https://www.finsmes.com/2020/11/better-com-raises-200m-in-series-d-funding-round.html	Better.com, a NYC-based homeownership platform, raised $200m in Series D funding. The round was led L Catterton, which joined existing shareholders Activant Capital, Ally Financial, American Express Ventures, Ping An Global Voyager Fund, and 9Yards Capital. The company, which has raised over $400M in equity capital since inception, intends to use the funds to grow [&#8230;]The post Better.com Raises $200M in Series D Funding Round appeared first on FinSMEs.	(Funding /Possible_Funding)	Not Computed	('Better.com Raises', 'ORG')('$200M', 'MONEY')	-
11/11/2020, 17:16:17	11/11/2020, 15:18:05	FinSME	SentinelOne Raises $267M in Series F Funding; Valued at Over $3 Billion	https://www.finsmes.com/2020/11/sentinelone-raises-267m-in-series-f-funding-valued-at-over-3-billion.html	SentinelOne, a Mountain View, Calif.-based autonomous cybersecurity platform company, raised $267m in Series F funding. The round was led by Tiger Global Management, with participation from Sequoia Capital Global Equities and existing investors including Insight Partners and Third Point Ventures. Since Series E funding in February 2020, SentinelOne&#8217;s valuation has tripled, exceeding $3 billion. The company intends [&#8230;]The post SentinelOne Raises $267M in Series F Funding; Valued at Over $3 Billion appeared first on FinSMEs.	(Funding)	Not Computed	('SentinelOne', 'ORG')('267', 'MONEY')('Series F Funding', 'ORG')('$3 Billion', 'MONEY')	-
11/11/2020, 17:16:17	11/11/2020, 14:55:06	FinSME	TrustClarity Closes $300K Pre-Seed Funding	https://www.finsmes.com/2020/11/trustclarity-closes-300k-pre-seed-funding.html	TrustClarity Inc., a Chicago, IL-based B2B software as a service (SaaS) storefront platform, closed a $300k pre-seed funding round. Backers included Baskar Puvanathasan (Co-founder at PagerDuty), Ninetwenty Capital, Sim Nation, Vel Investment Holdings and CRS Recycling Services, along with angels who are former senior executives in the enterprise telecom and logistics industries. The financing will be used to fund development of the platform, continued [&#8230;]The post TrustClarity Closes $300K Pre-Seed Funding appeared first on FinSMEs.	(Funding)	Not Computed	('300', 'MONEY')	-
11/11/2020, 17:16:17	11/11/2020, 14:45:38	FinSME	Bentley Systems Commits $100M of Venture Funding	https://www.finsmes.com/2020/11/bentley-systems-commits-100m-of-venture-funding.html	Bentley Systems (Nasdaq: BSY), an Exton, Pa.-based infrastructure engineering software company, established a $100m corporate venture capital fund.  Bentley iTwin Ventures will invest in technology companies addressing the emerging opportunity for infrastructure digital twin solutions for roadways, railways, waterways, bridges, utilities, industrial facilities, and other infrastructure assets. The fund will target investments in transformational digital twin solutions supporting [&#8230;]The post Bentley Systems Commits $100M of Venture Funding appeared first on FinSMEs.	(Funding)	Not Computed	('Bentley Systems Commits', 'ORG')('100', 'MONEY')	-
11/11/2020, 17:16:17	11/11/2020, 14:23:41	FinSME	Zero Egg Raises $5M in Series A Funding	https://www.finsmes.com/2020/11/zero-egg-raises-5m-in-series-a-funding.html	Zero Egg, a San Francisco, CA-based maker of a plant-based egg alternative, raised $5m in Series A funding. The round was led by Powerplant Ventures, joined by existing investors Unovis Asset Management-New Crop Capital and Strauss Group-The Kitchen Hub. In conjunction with the funding, Powerplant Ventures co-founder and partner, T.K. Pillan, joined the Zero Egg board of [&#8230;]The post Zero Egg Raises $5M in Series A Funding appeared first on FinSMEs.	(Funding)	Not Computed	('Zero', 'CARDINAL')('Egg Raises', 'ORG')('$5M', 'MONEY')	-
11/11/2020, 17:16:17	11/11/2020, 12:45:56	FinSME	Intrinsic Capital Partners Raises More Than $100M	https://www.finsmes.com/2020/11/intrinsic-capital-partners-raises-more-than-100m.html	Intrinsic Capital Partners, a Conshohocken, Pa.-based private equity firm, closed a $102m growth equity fund. Intrinsic Health Partners, L.P., invests in life science and technology businesses focusing on ancillary life science and technology companies that support the broader cannabis and hemp industries. Founded by principals Gerald Stahlecker, Cornelius Merlini and Goodwin, Intrinsic focuses on ancillary cannabis and hemp businesses. Key [&#8230;]The post Intrinsic Capital Partners Raises More Than $100M appeared first on FinSMEs.	(Funding)	Not Computed	('Intrinsic Capital Partners Raises', 'ORG')	-
11/11/2020, 17:16:17	11/11/2020, 12:34:30	FinSME	Peregrine Ventures Launches $300M Fund Focused on Late Stage Life Science Companies	https://www.finsmes.com/2020/11/peregrine-ventures-launches-300m-fund-focused-on-late-stage-life-science-companies.html	Peregrine Ventures, an Israeli venture capital firm focused on life sciences, has launched a new growth fund.  Peregrine closed $101 million of the planned $300m fund, its fifth vehicle, and first growth one, with participation of Israeli institutional investors and is currently aiming to raise additional funds from institutional investors and family offices worldwide.    The performance [&#8230;]The post Peregrine Ventures Launches $300M Fund Focused on Late Stage Life Science Companies appeared first on FinSMEs.	(Funding)	Not Computed	('Peregrine Ventures', 'ORG')	-
11/11/2020, 17:16:17	11/11/2020, 10:35:25	FinSME	Highwing Raises $4M in Seed Funding	https://www.finsmes.com/2020/11/highwing-raises-4m-in-seed-funding.html	Highwing, a Denver, Colo.-based insurance technology company, raised $4M in seed funding. The round was led by a middle market subsidiary of BRP Group, Inc. (NASDAQ:BRP), and BrokerTech Ventures, with participation from Holmes Murphy, The ABD Team, Conner Strong &#38; Buckelew and Heffernan Insurance Brokers. They join SkyKnight Capital, Revolution&#8217;s Rise of the Rest Seed Fund, SpringTime Ventures, Cameron Ventures, and Service Provider Capital. Led by CEO [&#8230;]The post Highwing Raises $4M in Seed Funding appeared first on FinSMEs.	(Funding)	Not Computed	('$4M', 'MONEY')	-
11/11/2020, 17:16:17	11/11/2020, 10:04:06	FinSME	Fabric Raises $18M in Series B Funding	https://www.finsmes.com/2020/11/fabric-raises-18m-in-series-b-funding.html	Fabric, a Brooklyn, New York-based provider of products helping parents protect their family&#8217;s financial future, raised $18m in Series B funding. The round was led by CNO Financial Group (NYSE: CNO) with participation from Guardian Life, Nippon Life, Samsung Ventures, Securian Ventures, and existing investors, including Bessemer Venture Partners. The company intends to use the [&#8230;]The post Fabric Raises $18M in Series B Funding appeared first on FinSMEs.	(Funding)	Not Computed	('18', 'MONEY')	-
11/11/2020, 17:16:17	11/11/2020, 09:29:40	FinSME	Lightico Raises $12.6M in Funding	https://www.finsmes.com/2020/11/lightico-raises-12-6m-in-funding.html	Lightico, a London, UK-based provider of a digital customer interaction platform, raised $12.6m in funding. The round, which brought total amount raised to $27m, was led by Oxx, with participation from Capital One Ventures and Harmony Partners and existing investors lool Ventures, Crescendo Venture Partners, Mangrove Capital Partners, and Spinach Angels. The company intends to [&#8230;]The post Lightico Raises $12.6M in Funding appeared first on FinSMEs.	(Funding)	Not Computed	('Lightico Raises', 'ORG')	-
11/11/2020, 17:16:17	11/11/2020, 09:16:22	FinSME	OutSense Raises $2.2M in Series A Funding	https://www.finsmes.com/2020/11/outsense-raises-2-2m-in-series-a-funding.html	OutSense, an Israeli IoT technology startup, raised $2.2m in a Series A funding. Peregrine Ventures made the investment. The company intends to use the funds to complete the development and testing of an IoT technology which monitors health and helps prevent life threatening diseases by quickly and accurately analyzing human waste from within a standard toilet [&#8230;]The post OutSense Raises $2.2M in Series A Funding appeared first on FinSMEs.	(Funding)	Not Computed	('OutSense Raises', 'ORG')('2.2', 'MONEY')	-
11/11/2020, 17:16:17	11/11/2020, 09:01:45	FinSME	Kinetic Secures $11.25M in Series A Funding	https://www.finsmes.com/2020/11/kinetic-secures-11-25m-in-series-a-funding.html	Kinetic, a NYC-based company providing wearable technology that fosters safe environments for the industrial workforce, raised $11.25m in Series A funding. The round was led by Crosslink Capital with participation from Primary Ventures and Nationwide&#8217;s venture capital team and new investors Prologis Ventures, the venture capital arm of Prologis, and Ubiquity Ventures. The company intends to [&#8230;]The post Kinetic Secures $11.25M in Series A Funding appeared first on FinSMEs.	(Funding /Possible_Funding)	Not Computed	('Kinetic Secures', 'PERSON')('11.25', 'MONEY')	-
11/11/2020, 17:16:17	11/10/2020, 23:36:59	FinSME	Venminder Raises $33M in Growth Funding	https://www.finsmes.com/2020/11/venminder-raises-33m-in-growth-funding.html	Venminder, an Elizabethtown, KY-based provider of third-party risk management solutions, raised $33m in Series C funding. The round was led by new investor Silversmith Capital Partners, with participation from existing major institutional investors, Bain Capital Ventures and MissionOG. The company plans to use the funds for feature development, capture additional share in core verticals and [&#8230;]The post Venminder Raises $33M in Growth Funding appeared first on FinSMEs.	(Funding)	Not Computed	('Raises', 'PERSON')('$33M', 'MONEY')	-
11/11/2020, 17:16:17	11/10/2020, 23:21:46	FinSME	Yotta Energy Raises $5M in Seed Funding	https://www.finsmes.com/2020/11/yotta-energy-raises-5m-in-seed-funding.html	Yotta Energy, an Austin, Texas-based energy tech company, closed a $5M seed funding. Backers included Fiftysix Investments, EDP Ventures, Skyview Ventures and other undisclosed investors. The company intends to use the funds to finalize UL certification and commence commercial production of its panel-level, PV-Coupled™ energy storage technology. Led by CEO Omeed Badkoobeh, Yotta Energy provides a patented thermal [&#8230;]The post Yotta Energy Raises $5M in Seed Funding appeared first on FinSMEs.	(Funding)	Not Computed	('Yotta Energy Raises', 'ORG')('$5M in Seed Funding', 'MONEY')	-
11/11/2020, 17:16:17	11/10/2020, 23:14:49	FinSME	Compliance.ai Raises $3M in Series A Funding	https://www.finsmes.com/2020/11/compliance-ai-raises-3m-in-series-a-funding.html	Compliance.ai, a San Francisco, CA-based RegTech company, raised $3m in Series A financing. The round was led by Cota Capital. The company intends to use the funds to expand operations and its business reach. Led by Kayvan Alikhani, CEO and co-founder, Compliance.ai provides a Modern Regulatory Change Management (RCM) solution that empowers banks, financial services [&#8230;]The post Compliance.ai Raises $3M in Series A Funding appeared first on FinSMEs.	(Funding)	Not Computed	('Compliance.ai Raises', 'PERSON')('$3M', 'MONEY')	-
11/11/2020, 17:16:17	11/10/2020, 22:57:07	FinSME	Adagio Therapeutics Raises $80M in Series B Funding	https://www.finsmes.com/2020/11/adagio-therapeutics-raises-80m-in-series-b-funding.html	Adagio Therapeutics, Inc., a Waltham, Mass.-based company developing antibodies that broadly neutralize SARS-CoV-2, SARS-CoV-1, and additional potentially emergent coronaviruses, closed an $80m Series B financing. The round was led by GV, with participation from existing investors Polaris Partners, Mithril Capital, Fidelity Management &#38; Research Company, LLC, and OrbiMed, as well as new investors, Population Health [&#8230;]The post Adagio Therapeutics Raises $80M in Series B Funding appeared first on FinSMEs.	(Funding)	Not Computed	('Adagio Therapeutics Raises', 'PERSON')('80', 'MONEY')	-
11/11/2020, 17:16:17	11/10/2020, 20:27:07	FinSME	Hopin Raises $125M in Series B Funding	https://www.finsmes.com/2020/11/hopin-raises-125m-in-series-b-funding.html	Hopin, a London, UK-based virtual events provider, raised $125M in Series B funding. The round was led by existing investor IVP and new investor Tiger Global and joined by Coatue and DFJ Growth, along with returning investors Accel, Northzone, Salesforce Ventures, and Seedcamp. The company intends to use the funds to continue to scale its [&#8230;]The post Hopin Raises $125M in Series B Funding appeared first on FinSMEs.	(Funding)	Not Computed	('Hopin Raises', 'ORG')('$125M', 'MONEY')	-
11/11/2020, 17:16:17	11/10/2020, 20:06:04	FinSME	Tailscale Raises $12M in Series A Funding	https://www.finsmes.com/2020/11/tailscale-raises-12m-in-series-a-funding.html	Tailscale, a Toronto, Canada-based corporate VPN for remote teams and organizations to securely access the services they need, raised US$12m in Series A funding. The round was led by Accel, with participation from Heavybit and Uncork Capital. The company intends to use the funds to continue to scale the engineering team and build out their [&#8230;]The post Tailscale Raises $12M in Series A Funding appeared first on FinSMEs.	(Funding)	Not Computed	('Tailscale Raises', 'ORG')	-
11/11/2020, 17:16:17	11/10/2020, 19:53:53	FinSME	TA Associates and TPG To Acquire Planview from Thoma Bravo, for $1.6 Billion	https://www.finsmes.com/2020/11/ta-associates-and-tpg-to-acquire-planview-from-thoma-bravo-for-1-6-billion.html	TPG Capital and TA Associates are to acquire Planview, a Austin, Texas-based provider of Portfolio Management and Work Management solutions, for a purchase price of $1.6 billion. The seller was Planview’s existing majority shareholder, Thoma Bravo, which will retain a minority interest in the company. UBS Investment Bank and Deutsche Bank Securities Inc. provided committed [&#8230;]The post TA Associates and TPG To Acquire Planview from Thoma Bravo, for $1.6 Billion appeared first on FinSMEs.	(M&A)	Not Computed	('TA Associates', 'ORG')('Thoma Bravo', 'ORG')('$1.6 Billion', 'MONEY')	-
11/11/2020, 17:16:17	11/10/2020, 16:46:46	FinSME	Buoy Health Raises $37.5M in Series C Funding	https://www.finsmes.com/2020/11/buoy-health-raises-37-5m-in-series-c-funding.html	Buoy Health, a Boston, MA-based AI-powered healthcare navigation platform, raised $37.5m in Series C funding. The round, which has raised $66.5m to date, was led by Cigna Ventures and Humana with participation from Optum Ventures, WR Hambrecht + Co, and Trustbridge Partners. The company intends to use the funds to further buildout its IP with [&#8230;]The post Buoy Health Raises $37.5M in Series C Funding appeared first on FinSMEs.	(Funding)	Not Computed	('Buoy Health Raises', 'ORG')('37.5', 'MONEY')	-
11/11/2020, 17:16:17	11/10/2020, 16:24:52	FinSME	Carbon Health Secures $100M in Series C Funding	https://www.finsmes.com/2020/11/carbon-health-secures-100m-in-series-c-funding.html	Carbon Health, a San Francisco, CA-based technology-enabled healthcare provider, secured $100m in Series C funding. The round was led by Dragoneer Investment Group, with participation from existing investors Brookfield Technology Partners (BTP), DCVC, and Builders VC. The company intends to use the funds to further advance its omnichannel care strategy and scale nationally as a [&#8230;]The post Carbon Health Secures $100M in Series C Funding appeared first on FinSMEs.	(Funding /Possible_Funding)	Not Computed	('Carbon Health Secures', 'ORG')('100', 'MONEY')	-
11/11/2020, 17:16:17	11/10/2020, 16:08:04	FinSME	Maestro Raises $7.2M in Series A Funding	https://www.finsmes.com/2020/11/maestro-raises-7-2m-in-series-a-funding.html	Maestro, a NYC-based software business focused on maximizing value in private equity-backed companies, completed a $7.2m Series A round of financing. The round was led by S&#38;P Global Market Intelligence with participation from Accordion. Launched in 2019 by Accordion and led by Omar Divina, recently named CEO, Maestro provides private equity firms with a tech-enabled [&#8230;]The post Maestro Raises $7.2M in Series A Funding appeared first on FinSMEs.	(Funding)	Not Computed	('Maestro Raises', 'ORG')('7.2', 'MONEY')	-
11/11/2020, 17:16:19	11/11/2020, 20:56:00	Businesswire Merger	World Insurance Associates Acquires Brian S. O’Neill &amp; Associates, Inc. (d/b/a Collier O’Neill &amp; Associates)	http://www.businesswire.com/news/home/20201111005857/en/World-Insurance-Associates-Acquires-Brian-S.-O%E2%80%99Neill-Associates-Inc.-dba-Collier-O%E2%80%99Neill-Associates/	TINTON FALLS, N.J.--(BUSINESS WIRE)-- #acquisitions--World Insurance Associates LLC acquired Collier O'Neill & Associates on November 1, 2020.	(M&A)	Not Computed	('World Insurance Associates Acquires', 'ORG')('Associates,', 'ORG')('Associates', 'ORG')	-
11/11/2020, 17:16:19	11/11/2020, 18:00:00	Businesswire Merger	Inszone Insurance Services Announces Entry Into Utah Market With the Acquisition of ISU Wiseman Insurance	http://www.businesswire.com/news/home/20201111005235/en/Inszone-Insurance-Services-Announces-Entry-Into-Utah-Market-With-the-Acquisition-of-ISU-Wiseman-Insurance/	SACRAMENTO, Calif.--(BUSINESS WIRE)--Inszone Insurance Services, a rapidly growing national provider of personal and commercial lines insurance, announced today its entry into Utah market with the acquisition of ISU Wiseman Insurance. The entry into Utah supports the Company’s strategic business goals of expansion within the western part of the Unites States, growing its local presence, while continuing to serve throughout the country. “Utah is a very important piece to our growth strategy and	(M&A)	Not Computed	('Inszone Insurance Services Announces Entry', 'ORG')	-
11/11/2020, 17:16:19	11/11/2020, 16:01:00	Businesswire Merger	AM Best Comments on Intact Financial Corporation’s Potential Acquisition of Certain Lines from RSA Insurance Group plc	http://www.businesswire.com/news/home/20201111005635/en/AM-Best-Comments-on-Intact-Financial-Corporation%E2%80%99s-Potential-Acquisition-of-Certain-Lines-from-RSA-Insurance-Group-plc/	OLDWICK, N.J.--(BUSINESS WIRE)--AM Best has commented that the Long-Term Issuer Credit Rating (Long-Term ICR) of “a-” of Intact Financial Corporation (IFC) [TSX: IFC] (Ontario, Canada) and the Financial Strength Ratings of A+ (Superior) and the Long-Term ICRs of “aa-” of its operating subsidiaries remain unchanged following the recent announcement that IFC, together with Tryg A/S, have approached RSA Insurance Group plc (RSA) with a cash takeover offer. In addition, all existing debt ratings re	(M&A)	Not Computed	('RSA Insurance Group plc', 'ORG')	-
11/11/2020, 17:16:19	11/11/2020, 15:49:00	Businesswire Merger	World Insurance Associates Acquires LIA Great Bend, Inc. (d/b/a Alliance Insurance Group)	http://www.businesswire.com/news/home/20201111005621/en/World-Insurance-Associates-Acquires-LIA-Great-Bend-Inc.-dba-Alliance-Insurance-Group/	TINTON FALLS, N.J.--(BUSINESS WIRE)-- #acquisitions--World Insurance Associates LLC acquired Alliance Insurance Group on November 1, 2020.	(M&A)	Not Computed	('Alliance Insurance Group', 'ORG')	-
11/11/2020, 17:16:19	11/11/2020, 14:57:00	Businesswire Merger	Urgent Care Group Expands to the Myrtle Beach area with the Acquisition of Access Medical in North Myrtle Beach	http://www.businesswire.com/news/home/20201111005565/en/Urgent-Care-Group-Expands-to-the-Myrtle-Beach-area-with-the-Acquisition-of-Access-Medical-in-North-Myrtle-Beach/	NASHVILLE, Tenn.--(BUSINESS WIRE)--Urgent Care Group, a leading Nashville-based urgent care company, announced today the completion of the acquisition of Access Medical in North Myrtle Beach, SC. Access Medical has been providing convenient and affordable on-demand care to the North Myrtle Beach community since 1987. “When exploring partner options for Access Medical, we were impressed with the experience and patient-centric vision of Urgent Care Group,“ said Jeri McCumbee, President of Access	(M&A)	Not Computed	('Urgent Care Group', 'ORG')('Myrtle Beach', 'GPE')('the Acquisition of Access Medical', 'ORG')('North Myrtle Beach', 'GPE')	-
