11/11/2020, 17:16:33	11/11/2020, 21:05:00	PRNewswire -Health	GoHealth Reports Third Quarter 2020 Results and Increases 2020 Outlook As a Result of Strong Medicare Enrollments and Operating Leverage	https://www.prnewswire.com:443/news-releases/gohealth-reports-third-quarter-2020-results-and-increases-2020-outlook-as-a-result-of-strong-medicare-enrollments-and-operating-leverage-301171322.html	CHICAGO, Nov. 11, 2020 /PRNewswire/ -- GoHealth, Inc. (GoHealth or the Company) (Nasdaq: GOCO), a leading health insurance marketplace, announced financial results for the three and nine months ended September 30, 2020. Third quarter 2020 net revenues of $163.4 million increased 52%...	(No Keywords detect)	(Possible_Funding)	('GoHealth Reports Third Quarter 2020', 'ORG')	-
11/11/2020, 17:16:33	11/11/2020, 21:04:00	PRNewswire -Health	SenesTech Restructures Board for Commercial Growth	https://www.prnewswire.com:443/news-releases/senestech-restructures-board-for-commercial-growth-301171251.html	PHOENIX, Nov. 11, 2020 /PRNewswire/ -- SenesTech, Inc. (NASDAQ: SNES), a developer of proprietary technologies for managing animal pest populations through fertility control, today announced that it has elected three new directors to its Board of Directors, in a move to position the Board...	(Bankruptcy)	Not Computed	('SenesTech Restructures Board for Commercial Growth', 'ORG')	-
11/11/2020, 17:16:34	11/11/2020, 18:51:00	PRNewswire -People & Culture	DICK'S Sporting Goods teams up with LISC to invest $12.5 million in Black Economic Development Fund	https://www.prnewswire.com:443/news-releases/dicks-sporting-goods-teams-up-with-lisc-to-invest-12-5-million-in-black-economic-development-fund-301171212.html	NEW YORK, Nov. 11, 2020 /PRNewswire/ -- DICK'S Sporting Goods, Inc., the largest U.S.-based, omni-channel sporting goods retailer, is investing $12.5 million in the Black Economic Development Fund to fuel minority lenders and anchor institutions and businesses as part of an effort to...	(Funding)	Not Computed	('$12.5 million', 'MONEY')('Black Economic Development Fund', 'ORG')	-
11/11/2020, 17:16:34	11/11/2020, 17:03:00	PRNewswire -Policy & Public Interest	Newman's Own® Awards Announce 2020 Grant Winners	https://www.prnewswire.com:443/news-releases/newmans-own-awards-announce-2020-grant-winners-301170320.html	ROCKVILLE, Md., Nov. 11, 2020 /PRNewswire/ -- Fisher House Foundation, Military Times, and Newman's Own have awarded grants to six non-profit organizations supporting military servicemembers and their families. Newman's Own® Awards provide funding toward innovative programs created to...	(No Keywords detect)	(Funding)	('Newman', 'ORG')	-
11/11/2020, 17:16:34	11/11/2020, 19:17:00	PRNewswire -Telecomm­unications	Estimated 270 Million Political Text Messages Requesting Donations Sent After November 3rd	https://www.prnewswire.com:443/news-releases/estimated-270-million-political-text-messages-requesting-donations-sent-after-november-3rd-301171232.html	NEW YORK, Nov. 11, 2020 /PRNewswire/ -- RoboKiller, the app that eliminates unwanted calls and texts, has identified continued large-scale efforts requesting campaign donations from Americans post-election. RoboKiller estimates that Americans received nearly 270 million political text...	(Possible_Funding)	Not Computed	('270 Million', 'CARDINAL')('November 3rd', 'DATE')	-
11/11/2020, 17:16:34	11/11/2020, 18:23:00	PRNewswire -Sports	VENN Teams With Microsoft For New Syndication Deal	https://www.prnewswire.com:443/news-releases/venn-teams-with-microsoft-for-new-syndication-deal-301171192.html	LOS ANGELES, Nov. 11, 2020 /PRNewswire/ -- VENN (www.venn.tv), the live 24/7 streaming network for gaming and entertainment, announced today a new syndication deal for its content through Microsoft's MSN platform. Under the non-exclusive partnership, clips from VENN's various series,...	(No Keywords detect)	(Possible_Funding)	('VENN', 'ORG')('Microsoft', 'ORG')	-
11/11/2020, 17:16:34	11/10/2020, 21:46:00	PRNewswire -Sports	College Basketball Coaches and Celebrities Donate Local Rounds of Golf in Coaches vs. Cancer Auction	https://www.prnewswire.com:443/news-releases/college-basketball-coaches-and-celebrities-donate-local-rounds-of-golf-in-coaches-vs-cancer-auction-301170351.html	LEXINGTON, Ky., Nov. 10, 2020 /PRNewswire/ -- Nearly 100 college basketball coaches and national celebrities have joined forces during the global pandemic to assist Coaches vs. Cancer in raising funds to fight cancer. The Coaches vs. Cancer "Member for a Day" Golf Auction, presented by...	(Possible_Funding)	Not Computed	('Cancer Auction', 'PERSON')	-
11/11/2020, 17:16:34	11/11/2020, 15:47:00	PRNewswire -Travel	i6 Group cierra una ronda de inversión de serie A	https://www.prnewswire.com:443/news-releases/i6-group-cierra-una-ronda-de-inversion-de-serie-a-833727241.html	FARNBOROUGH, Inglaterra, 11 de noviembre de 2020 /PRNewswire/ -- i6 Group Limited (i6), el líder en software de gestión de combustible para la industria de aviación, anuncia el cierre de una ronda de inversión de serie A. A principios de este año i6 se asoció con Deloitte para crear un...	(Possible_Funding)	Not Computed	('una ronda de inversión de serie', 'PERSON')	-
11/11/2020, 17:16:34	11/11/2020, 15:33:00	PRNewswire -Travel	i6 Group cierra una ronda de inversión de serie A	https://www.prnewswire.com:443/news-releases/i6-group-cierra-una-ronda-de-inversion-de-serie-a-869267879.html	Esta ronda de inversión permite a i6 acelerar, expandir y mejorar su oferta de tecnología y servicios. FARNBOROUGH, Inglaterra, 11 de noviembre de 2020 /PRNewswire/ -- i6 Group Limited (i6), el líder en software de gestión de combustible para la industria de aviación, anuncia el cierre de...	(Possible_Funding)	Not Computed	('una ronda de inversión de serie', 'PERSON')	-
11/11/2020, 17:16:34	11/11/2020, 14:04:00	PRNewswire -Travel	Boeing Provides More Than $14 Million for Veterans Causes	https://www.prnewswire.com:443/news-releases/boeing-provides-more-than-14-million-for-veterans-causes-301171006.html	CHICAGO, Nov. 11, 2020 /PRNewswire/ -- In observance of Veterans Day in the United States and Remembrance Day in Australia, Canada and the United Kingdom, Boeing [NYSE: BA] today announced a $14.2 million charitable grants package supporting 97 veterans organizations worldwide....	(Possible_Funding)	Not Computed	('Boeing', 'ORG')('$14 Million', 'MONEY')	-
11/11/2020, 17:16:34	11/11/2020, 14:00:00	PRNewswire -Travel	Record-Breaking Fundraiser Shows FlowPlay Players Going for Gold in the Fight to Cure Childhood Cancer	https://www.prnewswire.com:443/news-releases/record-breaking-fundraiser-shows-flowplay-players-going-for-gold-in-the-fight-to-cure-childhood-cancer-301170827.html	SEATTLE, Nov. 11, 2020 /PRNewswire/ -- FlowPlay, creator of one of the most powerful connected gaming platforms, today announced that its Vegas World in-game October fundraising campaign for the American Cancer Society (ACS) broke its individual campaign record for giving, garnering...	(No Keywords detect)	(Possible_Funding)		-
11/11/2020, 17:16:34	11/11/2020, 13:42:00	PRNewswire -Travel	AEROCOR Acquires BlueMAX Wireless Data Transfer Unit from Australia Based Control-J Pty Ltd	https://www.prnewswire.com:443/news-releases/aerocor-acquires-bluemax-wireless-data-transfer-unit-from-australia-based-control-j-pty-ltd-301170748.html	HENDERSON, Nev., Nov. 11, 2020 /PRNewswire/ -- AEROCOR announces the acquisition of the BlueMAX wireless data transfer unit from Australia based Control-J Pty Ltd. The BlueMax is a bluetooth adapter that enables aircraft operators to wirelessly stream aircraft data to a portable device...	(M&A)	Not Computed	('AEROCOR Acquires BlueMAX', 'ORG')('Australia', 'GPE')('Control-J Pty Ltd', 'ORG')	-
11/11/2020, 17:16:38	11/11/2020, 22:03:57	BusinessJournal	Mayo Clinic establishes new fund for racial equity — and is looking to Minnesota nonprofits to fund	https://www.bizjournals.com/twincities/news/2020/11/11/mayo-clinic-establishes-new-grant-racial-equity.html?ana=brss_1028	The Mayo Clinic recently announced the creation of a new grant fund with the goal of promote racial equity in local communities served by the organization.	(Funding)	Not Computed	('Mayo Clinic', 'ORG')('Minnesota', 'GPE')	-
11/11/2020, 17:16:38	11/11/2020, 21:21:37	BusinessJournal	Kaiser Permanente pledges $1M to American Heart Association fund in honor of late CEO	https://www.bizjournals.com/sanfrancisco/news/2020/11/11/kaiser-permanente-donates.html?ana=brss_1028	Kaiser CEO Bernard J. Tyson died suddenly one year ago at the age of 60 after suffering a heart attack in his sleep.	(Funding)	Not Computed	('Kaiser Permanente', 'ORG')('$1M', 'MONEY')('American Heart Association', 'ORG')	-
11/11/2020, 17:16:38	11/11/2020, 20:57:08	BusinessJournal	The Olde Mecklenburg Brewery nabs international honors	https://www.bizjournals.com/charlotte/news/2020/11/11/olde-mecklenburg-brewery-nabs.html?ana=brss_1028	Charlotte's largest brewery has again snagged top honors in an international competition.	(Possible_Funding)	Not Computed		-
11/11/2020, 17:16:38	11/11/2020, 20:50:21	BusinessJournal	Mizzou receives $5M NASA grant to study origin of life on Earth	https://www.bizjournals.com/stlouis/news/2020/11/11/mizzou-receives-5m-nasa-grant-to-study-origin.html?ana=brss_1028	The National Aeronautic and Space Administration (NASA) has awarded a team of University of Missouri-Columbia researchers with a $5 million grant to study the origin of life on Earth.	(No Keywords detect)	(Possible_Funding)	('5', 'MONEY')('NASA', 'ORG')('Earth', 'LOC')	-
11/11/2020, 17:16:38	11/11/2020, 20:50:06	BusinessJournal	Local arts groups fight for survival as pandemic drags on	https://www.bizjournals.com/charlotte/news/2020/11/11/arts-groups-hope-the-show-can-go-on.html?ana=brss_1028	A $6 million grants program for local arts groups is the latest step in a months-long campaign to keep cultural nonprofits going in a time when audiences are limited or nonexistent.	(No Keywords detect)	(Possible_Funding)		-
11/11/2020, 17:16:38	11/11/2020, 20:45:05	BusinessJournal	Third building for 20 Midtown moving forward as developers recapitalize, secure financing	https://www.bizjournals.com/birmingham/news/2020/11/11/construction-to-begin-on-20-midtown-phase-2.html?ana=brss_1028	Construction is about to begin on the third building for 20 Midtown.	(Possible_Funding)	Not Computed	('Third', 'ORDINAL')('20', 'CARDINAL')	-
11/11/2020, 17:16:38	11/11/2020, 20:43:25	BusinessJournal	City of Houston breaks ground on Alief Neighborhood Center and Park	https://www.bizjournals.com/houston/news/2020/11/11/alief-neighborhood-center-and-park-breaks-ground.html?ana=brss_1028	The $54 million, 69,900-square-foot mixed-used center is scheduled to open in 2022.	(No Keywords detect)	(Possible_Funding)	('Houston', 'GPE')('Alief Neighborhood Center', 'FAC')	-
11/11/2020, 17:16:38	11/11/2020, 20:42:04	BusinessJournal	Here's how to apply for the latest round of restaurant grants in Greater Baltimore	https://www.bizjournals.com/baltimore/news/2020/11/11/restaurant-relief-grants-how-to-apply.html?ana=brss_1028	Gov. Larry Hogan is requiring jurisdictions to disburse the money to restaurants by the end of the year.	(Possible_Funding)	Not Computed	('Greater Baltimore', 'GPE')	-
11/11/2020, 17:16:38	11/11/2020, 20:40:20	BusinessJournal	JCPenney purchase approved by court, on track to operate under new ownership this month	https://www.bizjournals.com/phoenix/news/2020/11/11/jcpenney-bankruptcy.html?ana=brss_1028	The court approved the sale of the retail company, which is now on track to operate under new ownership by the end of the month.	(Possible_M&A)	Not Computed	('JCPenney', 'ORG')('this month', 'DATE')	-
11/11/2020, 17:16:38	11/11/2020, 20:30:00	BusinessJournal	South Florida inventors, entrepreneurs shift focus to online sales as e-commerce wave continues	https://www.bizjournals.com/southflorida/news/2020/11/11/consumer-product-companies-pivot-to-e-commerce.html?ana=brss_1028	These local businesses are pivoting to online sales and finding success.	(Possible_M&A)	Not Computed	('South Florida', 'ORG')	-
11/11/2020, 17:16:38	11/11/2020, 20:29:50	BusinessJournal	Memphis-based automotive products distributor acquired by Chicago investment firm	https://www.bizjournals.com/memphis/news/2020/11/11/highline-aftermarket-acquired-pritzker.html?ana=brss_1028	“We’re not anticipating any employee losses with the merger or announcing any cuts. We have a growth plan and that is what we are concentrating on.”	(M&A /Funding)	Not Computed	('Memphis', 'GPE')('Chicago', 'GPE')	-
11/11/2020, 17:16:38	11/11/2020, 20:29:24	BusinessJournal	Justice to sell for $90M, all remaining stores to close	https://www.bizjournals.com/twincities/news/2020/11/11/justice-to-sell-for-90m.html?ana=brss_1028	The tween fashion brand still has Twin Cities-area stores open at the Mall of America and at Albertville Premium Outlets, according to Justice's website.	(Possible_M&A)	Not Computed	('Justice', 'ORG')('$90M', 'MONEY')	-
11/11/2020, 17:16:38	11/11/2020, 20:29:00	BusinessJournal	Raytheon acquiring Colorado small-satellite manufacturer	https://www.bizjournals.com/denver/news/2020/11/11/raytheon-blue-canyon-acquisition-small-satellites.html?ana=brss_1028	The company has been growing fast and plans to keep its local operations unchanged.	(M&A)	Not Computed	('Colorado', 'GPE')	-
11/11/2020, 17:16:38	11/11/2020, 20:26:14	BusinessJournal	South Carolina land brokerage firm plans increased focus on New Mexico	https://www.bizjournals.com/albuquerque/news/2020/11/11/national-land-realty-plans-new-mexico-focus.html?ana=brss_1028	National Land Realty has 42 New Mexico listings with the majority of the properties coming outside the state's bigger metropolitan areas.	(Possible_Funding)	Not Computed	('South Carolina', 'GPE')('New Mexico', 'GPE')	-
11/11/2020, 17:16:38	11/11/2020, 20:16:35	BusinessJournal	Charlotte's Asana Partners under contract to purchase iconic block in downtown Denver	https://www.bizjournals.com/charlotte/news/2020/11/11/asana-partners-larimer-square-buyer-denver.html?ana=brss_1028	If the sale closes, it'll be the first time the iconic Denver block has traded in nearly 30 years.	(No Keywords detect)	(Possible_M&A)	('Charlotte', 'GPE')('Asana Partners', 'ORG')('Denver', 'GPE')	-
11/11/2020, 17:16:38	11/11/2020, 20:15:16	BusinessJournal	Spectrum hiring 120 in Milwaukee for sales and retention center	https://www.bizjournals.com/milwaukee/news/2020/11/11/spectrum-hiring-120-in-milwaukee.html?ana=brss_1028	Charter has more than 3,800 employees in Wisconsin with employment centers in Milwaukee, Appleton, Fond du Lac and Madison.	(Possible_M&A)	Not Computed	('120', 'CARDINAL')('Milwaukee', 'GPE')	-
11/11/2020, 17:16:38	11/11/2020, 20:14:39	BusinessJournal	Bay Area private equity firm TPG Capital part of $1.6 billion acquisition of software maker Planview	https://www.bizjournals.com/sanjose/news/2020/11/11/thoma-bravo-secures-another-1-billion-plus-deal.html?ana=brss_1028	The new owners said Planview is positioned to help companies navigate the changing nature of work	(M&A)	Not Computed	('Bay Area', 'LOC')('TPG Capital', 'ORG')('$1.6 billion', 'MONEY')	-
11/11/2020, 17:16:38	11/11/2020, 20:13:29	BusinessJournal	Carbon Health lands $100M to open 1,500 clinics nationwide by 2025	https://www.bizjournals.com/sanjose/news/2020/11/11/carbon-health-lands-100m-to-open-1-500-clinics-na.html?ana=brss_1028	This year alone, the San Francisco-based healthtech has expanded from seven clinics to 27 and from 100 employees to 800. And it is just getting started.	(Possible_Funding)	Not Computed	('lands $100', 'MONEY')('1,500', 'CARDINAL')('2025', 'CARDINAL')	-
11/11/2020, 17:16:38	11/11/2020, 20:11:10	BusinessJournal	Judge confirms Oasis Petroleum bankruptcy plan	https://www.bizjournals.com/houston/news/2020/11/11/judge-confirms-oasis-petroleum-bankruptcy-plan.html?ana=brss_1028	The court approval means the company could still meet its original timeline for the restructuring.	(Bankruptcy)	Not Computed	('Oasis', 'GPE')	-
11/11/2020, 17:16:38	11/11/2020, 20:08:59	BusinessJournal	Novavax mulls up to $500M raise as Covid, flu programs move forward	https://www.bizjournals.com/washington/news/2020/11/11/novavax-readies-to-raise-500m-as-covid-flu-progr.html?ana=brss_1028	Novavax has experienced “accelerated expansion … in every functional area,” CEO Stanley Erck said on a Nov. 9 company earnings call.	(Funding)	Not Computed	('up to $500', 'MONEY')('Covid', 'ORG')	-
11/11/2020, 17:16:38	11/11/2020, 20:05:59	BusinessJournal	Alamance County to consider $1M in incentives for Chick-fil-A distribution hub, 160 new jobs	https://www.bizjournals.com/triangle/news/2020/11/11/alamance-to-weigh-incentives-for-chick-fil-a-hub.html?ana=brss_1028	Nearly $1 million package hoped to entice facility to invest $52 million in North Carolina Industrial Center site in Mebane.	(No Keywords detect)	(Possible_Funding)	('Alamance County', 'GPE')('$1M', 'MONEY')('Chick', 'ORG')('160', 'CARDINAL')	-
11/11/2020, 17:16:38	11/11/2020, 20:05:31	BusinessJournal	UofL Health to pump $6 million into surgery at Jewish Hospital	https://www.bizjournals.com/louisville/news/2020/11/11/uofl-health-to-pump-6m-into-surgery-at-jewish-hos.html?ana=brss_1028	The move to improve surgery at Jewish Hospital also brings more less-invasive surgery options to patients.	(Possible_Funding)	Not Computed	('UofL Health', 'ORG')('$6 million', 'MONEY')('Jewish Hospital', 'ORG')	-
11/11/2020, 17:16:38	11/11/2020, 20:03:16	BusinessJournal	Nassau County apartment complex sells for $44M	https://www.bizjournals.com/jacksonville/news/2020/11/11/nassau-county-apartment-complex-sells-for-44m.html?ana=brss_1028	A 240-unit apartment complex in Nassau County sold for more than $44 million Tuesday, marking one more in a series of multifamily property sales on the First Coast.	(Possible_M&A)	Not Computed	('Nassau County', 'GPE')('44', 'MONEY')	-
11/11/2020, 17:16:38	11/11/2020, 20:01:47	BusinessJournal	Kanbe’s Markets lands $200K grant from Bank of America	https://www.bizjournals.com/kansascity/news/2020/11/11/kanbes-markets-bank-of-america-grant-max-kaniger.html?ana=brss_1028	Kanbe’s Markets' founder talks about how the Neighborhood Builders honor will propel the nonprofit forward.	(Possible_Funding)	Not Computed	('Kanbe’s Markets', 'ORG')('200', 'MONEY')('Bank of America', 'ORG')	-
11/11/2020, 17:16:38	11/11/2020, 20:01:46	BusinessJournal	California firm buys 351-unit Waters Edge apartments in Grand Prairie	https://www.bizjournals.com/dallas/news/2020/11/11/buchanan-street-partners-waters-edge-grand-prairie.html?ana=brss_1028	A California-based real estate investment management firm has acquired Waters Edge, a 351-unit multifamily community at 3651 Prairie Waters Drive in Grand Prairie.	(M&A)	Not Computed	('California', 'GPE')('Waters Edge', 'ORG')('Grand Prairie', 'GPE')	-
11/11/2020, 17:16:38	11/11/2020, 20:01:01	BusinessJournal	Park Place Technologies acquires Charlotte-based IT firm Curvature	https://www.bizjournals.com/charlotte/news/2020/11/11/curvature-park-place-technologies-acquisition.html?ana=brss_1028	Ohio-based Park Place Technologies this week acquired Charlotte's Curvature Inc., a global firm for IT maintenance and support.	(M&A)	Not Computed	('Park Place Technologies', 'ORG')('Charlotte', 'GPE')	-
11/11/2020, 17:16:38	11/11/2020, 19:59:44	BusinessJournal	Lender seizes Boca Raton office building in $19M foreclosure judgment	https://www.bizjournals.com/southflorida/news/2020/11/11/lender-seizes-office-building-in-19m-foreclosure.html?ana=brss_1028	A large company vacated the building in early 2020.	(Bankruptcy)	Not Computed	('Boca Raton', 'GPE')('19', 'MONEY')	-
11/11/2020, 17:16:38	11/11/2020, 19:58:49	BusinessJournal	Boost for Belcourt Theatre is the latest example of Amazon showing desire to 'be a good neighbor' — and she's crafting the strategy	https://www.bizjournals.com/nashville/news/2020/11/11/amazon-nashville-community-donations.html?ana=brss_1028	This person is Amazon's local executive shaping the strategy for where the company invests next, in schools or nonprofits or key community issues.	(No Keywords detect)	(Funding)	('Belcourt Theatre', 'FAC')('Amazon', 'ORG')	-
11/11/2020, 17:16:38	11/11/2020, 19:57:10	BusinessJournal	Change Today, Change Tomorrow opening store on Story Avenue	https://www.bizjournals.com/louisville/news/2020/11/11/change-today-change-tomorrow-pocket-change.html?ana=brss_1028	Change Today, Change Tomorrow (CTCT) is opening Pocket Change, a multi-business retail space, at 1403 Story Ave. this weekend.	(No Keywords detect)	(Possible_Funding)	('Today', 'DATE')('Tomorrow', 'DATE')('Story Avenue', 'FAC')	-
11/11/2020, 17:16:38	11/11/2020, 19:56:17	BusinessJournal	Puppet names board members as it eyes 2021 IPO	https://www.bizjournals.com/portland/news/2020/11/11/puppet-eyes-2021-ipo-names-2-board-members.html?ana=brss_1028	Puppet has been seen by the Portland startup community as an IPO contender for years. That may be a reality soon.	(IPOs)	Not Computed	('2021', 'CARDINAL')	-
11/11/2020, 17:16:38	11/11/2020, 19:55:20	BusinessJournal	Durham clinical research firm continues rapid growth with West Coast acquisition	https://www.bizjournals.com/triangle/news/2020/11/11/durham-clinical-research-firms-makes-acquisition.html?ana=brss_1028	A Durham-based clinical site company that's rapidly expanding has added more sites to its portfolio, this time a pair the company hopes will give it an edge with federal infectious disease contracts.	(M&A)	Not Computed	('West Coast', 'LOC')	-
11/11/2020, 17:16:38	11/11/2020, 19:54:16	BusinessJournal	Skin care startup launches through U of M's FedEx Institute of Technology, Epicenter	https://www.bizjournals.com/memphis/news/2020/11/11/skin-care-startup-launches-through.html?ana=brss_1028	Nuvelus is one of six startups funded by the partnership.	(No Keywords detect)	(Funding)	('FedEx Institute of Technology', 'ORG')	-
11/11/2020, 17:16:38	11/11/2020, 19:53:26	BusinessJournal	Neighbors lose bid to stop potential Saratoga Hospital construction	https://www.bizjournals.com/albany/news/2020/11/11/saratoga-hospital-lawsuit-neighbors-dismissed.html?ana=brss_1028	Saratoga Hospital bought 16 acres near its Saratoga Springs campus for $3.15 million in 2019.	(No Keywords detect)	(Possible_Funding)	('Saratoga Hospital', 'ORG')	-
11/11/2020, 17:16:38	11/11/2020, 19:52:59	BusinessJournal	Canton recruiting software firm Top Echelon acquires CATS Software	https://www.bizjournals.com/cleveland/news/2020/11/11/recruiting-software-firm-top-echelon-acquires-minn.html?ana=brss_1028	Canton-based Top Echelon Software said CATS Software is used by professional recruiters who help companies with their hiring needs.	(M&A)	Not Computed	('Canton', 'GPE')('Top Echelon', 'ORG')('CATS Software', 'PERSON')	-
11/11/2020, 17:16:38	11/11/2020, 19:51:18	BusinessJournal	No fans, no funds: Projected game-day losses for Reds, Indians, other MLB teams in 2020 with no fans in attendance	https://www.bizjournals.com/dayton/news/2020/11/11/mlb-projected-gameday-revenue-lost.html?ana=brss_1028	Major League Baseball teams played shorter seasons this year because of the pandemic and they did so without fans in the stands. That meant a lot less game-day revenue across the league and for each of its 30 clubs.	(Funding)	Not Computed	('Reds', 'ORG')('Indians', 'NORP')('2020', 'DATE')	-
11/11/2020, 17:16:38	11/11/2020, 19:49:37	BusinessJournal	Women’s apparel retailer Bebe purchases 47 Buddy’s Home Furnishings stores for $35 million	https://www.bizjournals.com/sanfrancisco/news/2020/11/11/bebe-stores-ventures-into-home-furnishings.html?ana=brss_1028	The stores "have a strong and consistent record of free cash flow generation" said CEO Manny Mashouf.	(Possible_Funding)	Not Computed	('Bebe', 'PERSON')('47', 'CARDINAL')('Buddy', 'ORG')('Home Furnishings', 'ORG')('$35 million', 'MONEY')	-
11/11/2020, 17:16:38	11/11/2020, 19:49:11	BusinessJournal	Justice to sell for $90M, all remaining stores to close	https://www.bizjournals.com/newyork/news/2020/11/11/justice-to-sell-for-90m.html?ana=brss_1028	Ascena Retail Group has reached a deal to sell Columbus-based Justice for $90 million, with a wind-down of all its remaining stores expected to conclude next year.	(Possible_M&A)	Not Computed	('Justice', 'ORG')('$90M', 'MONEY')	-
11/11/2020, 17:16:38	11/11/2020, 19:48:22	BusinessJournal	Park Place Technologies acquires Curvature Inc., creating a top third-party maintenance company	https://www.bizjournals.com/cleveland/news/2020/11/11/park-place-technologies-acquires-curvature.html?ana=brss_1028	The acquisition doubles Park Place's employment and revenue and likely makes it the largest pure-play in the highly fragmented data center maintenance industry.	(M&A)	Not Computed	('Park Place Technologies', 'ORG')('Curvature Inc.', 'ORG')('third', 'ORDINAL')	-
11/11/2020, 17:16:38	11/11/2020, 19:44:53	BusinessJournal	Fry's parent revamps distribution plan to add micro-fulfillment centers	https://www.bizjournals.com/phoenix/news/2020/11/11/kroger-adds-micro-fulfillment-centers.html?ana=brss_1028	The parent company of Fry's Food Stores has shifted gears for its plans to develop new distribution centers aimed at boosting digital sales by getting products to customers more quickly and efficiently.	(No Keywords detect)	(Possible_M&A)	('Fry', 'ORG')	-
11/11/2020, 17:16:38	11/11/2020, 19:44:40	BusinessJournal	Prairie View A&M University receives $10M from anonymous donor	https://www.bizjournals.com/houston/news/2020/11/11/prairie-view-a-m-university-receives-donation.html?ana=brss_1028	The funds will go to junior and senior students at the university.	(No Keywords detect)	(Funding)	('Prairie View A&M University', 'ORG')('10', 'MONEY')	-
