12/02/2020, 15:48:23	12/02/2020, 19:44:00	PRNewswire -Business Technology	Apty Raises $5.4 Million in Post-Seed Funding	https://www.prnewswire.com:443/news-releases/apty-raises-5-4-million-in-post-seed-funding-301185079.html	FRISCO, Texas, Dec. 2, 2020 /PRNewswire/ -- Apty Inc., a leading Digital Adoption Platform, today announced that it secured $5.4 million in post-seed funding. Apty develops Digital Adoption Platform (DAP) software catering to Enterprises with complex business processes, enabling them to...	(Funding)	Not Computed	('Apty Raises', 'ORG')('$5.4 Million', 'MONEY')	-
12/02/2020, 15:48:23	12/02/2020, 19:41:00	PRNewswire -Business Technology	Digital Learning Equity Gaps Returning to Pre-pandemic Levels, New Research Finds	https://www.prnewswire.com:443/news-releases/digital-learning-equity-gaps-returning-to-pre-pandemic-levels-new-research-finds-301185077.html	RALEIGH, N.C., Dec. 2, 2020 /PRNewswire/ -- LearnPlatform, developer of an edtech effectiveness system used states and districts serving more than 4 million students, today published new research on disparities in edtech engagement during the era of COVID-19. It shows that the digital...	(No Keywords detect)	(Possible_Funding)	('Digital Learning Equity Gaps Returning', 'ORG')('Levels', 'GPE')('New Research Finds', 'ORG')	-
12/02/2020, 15:48:23	12/02/2020, 19:30:00	PRNewswire -Business Technology	Parsons Introduces Revolutionary Cloud Native Stream Platforms	https://www.prnewswire.com:443/news-releases/parsons-introduces-revolutionary-cloud-native-stream-platforms-301183959.html	CENTREVILLE, Va., Dec. 2, 2020 /PRNewswire/ -- Parsons Corporation (NYSE: PSN) announced today the creation of an organically developed series of Cloud Native Stream Platforms that deliver government and commercial customers with capabilities to meet current and future mission objectives...	(No Keywords detect)	(Possible_Funding)		-
12/02/2020, 15:48:23	12/02/2020, 19:46:00	PRNewswire -Consumer Products & Retail	Delta Dental Donates to Support an Additional 1.2 Million Meals in LA County	https://www.prnewswire.com:443/news-releases/delta-dental-donates-to-support-an-additional-1-2-million-meals-in-la-county-301185080.html	LOS ANGELES, Dec. 2, 2020 /PRNewswire/ -- The Delta Dental Community Care Foundation announced that it will donate an additional $300,000 to the Los Angeles Regional Food Bank to help communities impacted by COVID-19 as some businesses scale back or shut down again due to an increase in...	(Possible_Funding)	Not Computed	('Delta Dental Donates', 'ORG')('LA County', 'GPE')	-
12/02/2020, 15:48:23	12/02/2020, 19:25:00	PRNewswire -Consumer Products & Retail	PURA Highlights ALKM Cannabis Co Packing Plans For $2 Trillion Market Opportunity	https://www.prnewswire.com:443/news-releases/pura-highlights-alkm-cannabis-co-packing-plans-for-2-trillion-market-opportunity-301183763.html	DALLAS, Dec. 2, 2020 /PRNewswire/ -- Puration, Inc. (USOTC: PURA) today highlighted plans for its recently announced partnership with Alkame Holdings Inc. (USOTC: ALKM). As part of PURA's overall hemp lifestyle brand strategy, PURA has acquired a five percent stake in ALKM as part of a...	(No Keywords detect)	(M&A)	('PURA Highlights ALKM Cannabis Co', 'ORG')('$2 Trillion', 'MONEY')	-
12/02/2020, 15:48:23	12/02/2020, 18:55:00	PRNewswire -Consumer Products & Retail	Thanksgiving Cannabis Sales Top $238 Million, Mark Biggest Sales Day of the Year	https://www.prnewswire.com:443/news-releases/thanksgiving-cannabis-sales-top-238-million-mark-biggest-sales-day-of-the-year-301185045.html	DENVER, Dec. 2, 2020 /PRNewswire/ -- Business intelligence from Akerna (Nasdaq: KERN), an enterprise software, leading compliance technology provider, and developer of the cannabis industry's first seed-to-sale enterprise resource planning (ERP) software technology (MJ Platform®), finds...	(Possible_M&A)	Not Computed	('Thanksgiving', 'DATE')('$238 Million', 'MONEY')('Mark Biggest Sales Day', 'ORG')('the Year', 'DATE')	-
12/02/2020, 15:48:23	12/02/2020, 18:00:00	PRNewswire -Consumer Products & Retail	The Anti Diet Nutrition App Wellory Announces $4.2M In Funding To Help Consumers Stay Healthy At Home	https://www.prnewswire.com:443/news-releases/the-anti-diet-nutrition-app-wellory-announces-4-2m-in-funding-to-help-consumers-stay-healthy-at-home-301183987.html	NEW YORK, Dec. 2, 2020 /PRNewswire/ -- Wellory, the anti-diet app that delivers 1-1 personalized nutrition coaching, announced today that it has raised a total of $4.2 Million. Story Ventures led the round, with participation from Harlem Capital, the Co-Founders of Tinder Sean Rad and...	(Funding)	Not Computed	('$4.2M', 'MONEY')	-
12/02/2020, 15:48:23	12/02/2020, 18:00:00	PRNewswire -Consumer Products & Retail	How to Electrify Your World: Tips from Mitsubishi Electric Trane HVAC US	https://www.prnewswire.com:443/news-releases/how-to-electrify-your-world-tips-from-mitsubishi-electric-trane-hvac-us-301183965.html	SUWANEE, Ga., Dec. 2, 2020 /PRNewswire/ -- Homeowners increasingly seek sustainable choices for their homes. Their buying decisions are influenced by increasing awareness of extreme weather events and climate change, including how to help curb its effects, even in small ways. The experts...	(No Keywords detect)	(M&A)	('Mitsubishi Electric', 'ORG')('Trane HVAC US', 'PERSON')	-
12/02/2020, 15:48:23	12/02/2020, 17:00:00	PRNewswire -Consumer Products & Retail	Southeastern Hemp Processing Facility Expands Reach with Launch of Online Retail Shop	https://www.prnewswire.com:443/news-releases/southeastern-hemp-processing-facility-expands-reach-with-launch-of-online-retail-shop-301183101.html	PHENIX CITY, Ala., Dec. 2, 2020 /PRNewswire/ -- Arbor Vita8, the largest hemp processing facility in the southeastern United States, offers a wide variety of services. From the seeds and clones farmers buy to the manufacturers final extractions are sold to, the team's expertise is...	(No Keywords detect)	(M&A)		-
12/02/2020, 15:48:23	12/02/2020, 18:00:00	PRNewswire -Energy	Global $188.7 Million LED Lighting in Oil &amp; Gas Market to 2025: Key Players are Eaton, Emerson Electric, ABB, GE, Dialight, AZZ, Larson Electronics, and Adolf Schuch	https://www.prnewswire.com:443/news-releases/global-188-7-million-led-lighting-in-oil--gas-market-to-2025-key-players-are-eaton-emerson-electric-abb-ge-dialight-azz-larson-electronics-and-adolf-schuch-301183943.html	DUBLIN, Dec. 2, 2020 /PRNewswire/ -- The "LED Lighting in Oil & Gas Market - Forecast (2020 - 2025)" report has been added to ResearchAndMarkets.com's offering. The LED Lighting for Oil and Gas market is expected to reach $188.7m by 2025, growing at a steady rate of 3.4% during the...	(Possible_Funding)	Not Computed	('$188.7 Million', 'MONEY')('LED Lighting in Oil &amp', 'ORG')('Gas Market', 'ORG')('2025', 'CARDINAL')('Eaton', 'GPE')('Emerson Electric', 'ORG')('ABB', 'ORG')('GE', 'ORG')('Dialight, AZZ', 'ORG')('Larson Electronics', 'ORG')('Adolf Schuch', 'PERSON')	-
12/02/2020, 15:48:23	12/02/2020, 17:15:00	PRNewswire -Energy	Global Digital Twin Water Markets, 2020-2026: Future Growth Potential Enhanced by Value-based Outcomes and Best Practices on Quick ROI	https://www.prnewswire.com:443/news-releases/global-digital-twin-water-markets-2020-2026-future-growth-potential-enhanced-by-value-based-outcomes-and-best-practices-on-quick-roi-301183694.html	DUBLIN, Dec. 2, 2020 /PRNewswire/ -- The "Global Digital Twin Water Industry 2020-2026 - Digital Water Initiatives to Drive Digital Twin Adoption" report has been added to ResearchAndMarkets.com's offering. The global water industry's digital twin market was estimated at $415.7 million in...	(No Keywords detect)	(Possible_Funding)	('Global Digital Twin Water Markets', 'ORG')('2020-2026', 'DATE')('Outcomes and Best Practices', 'ORG')	-
12/02/2020, 15:48:23	12/02/2020, 16:30:00	PRNewswire -Energy	AWP Acquires Advantage Barricade &amp; RoadMarks	https://www.prnewswire.com:443/news-releases/awp-acquires-advantage-barricade--roadmarks-301183901.html	NORTH CANTON, Ohio, Dec. 2, 2020 /PRNewswire/ -- In support of its national growth strategy, Area Wide Protective (AWP), the leading North American provider of traffic control services and equipment, has acquired Albuquerque, New Mexico based Advantage Barricade & RoadMarks, LLC (ABR)....	(M&A)	Not Computed	('AWP Acquires Advantage Barricade &amp', 'ORG')	-
12/02/2020, 15:48:23	12/02/2020, 16:24:00	PRNewswire -Energy	AWP Acquires Traffic Safety Rentals	https://www.prnewswire.com:443/news-releases/awp-acquires-traffic-safety-rentals-301183909.html	NORTH CANTON, Ohio, Dec. 2, 2020 /PRNewswire/ -- In support of its national growth strategy, Area Wide Protective (AWP), the leading North American provider of traffic control services and equipment, has acquired Utah based Traffic Safety Rentals (TSR). "TSR has supported traffic control...	(M&A)	Not Computed	('AWP Acquires Traffic Safety Rentals', 'ORG')	-
12/02/2020, 15:48:23	12/02/2020, 15:56:00	PRNewswire -Energy	BioUrja Group has completed its acquisition of the operating businesses of Energy Alloys	https://www.prnewswire.com:443/news-releases/biourja-group-has-completed-its-acquisition-of-the-operating-businesses-of-energy-alloys-301183878.html	HOUSTON, Dec. 2, 2020 /PRNewswire/ -- BioUrja Commodities, LLC, which is part of the BioUrja Group ("BioUrja") of Houston, TX, has completed its acquisition of the operating businesses and the trade name of Energy Alloys. The acquisition was limited to acquiring the equity in those Energy...	(M&A)	Not Computed	('BioUrja Group', 'ORG')('Energy', 'ORG')	-
12/02/2020, 15:48:23	12/02/2020, 15:30:00	PRNewswire -Energy	AWP Acquires Advantage Barricade &amp; RoadMarks and Traffic Safety Rentals	https://www.prnewswire.com:443/news-releases/awp-acquires-advantage-barricade--roadmarks-and-traffic-safety-rentals-301183856.html	NORTH CANTON, Ohio, Dec. 2, 2020 /PRNewswire/ -- Area Wide Protective (AWP), the leading North American provider of traffic control services and equipment, announces two new acquisitions in recent weeks. In support of AWP's strategy to grow nationally, it has acquired Albuquerque, New...	(M&A)	Not Computed	('AWP Acquires Advantage Barricade &amp', 'ORG')('RoadMarks', 'ORG')	-
12/02/2020, 15:48:23	12/02/2020, 20:30:00	PRNewswire -Entertain­ment & Media	Global Pulmonary Devices Market Report 2020-2027 with COVID-19 Impact and Analysis	https://www.prnewswire.com:443/news-releases/global-pulmonary-devices-market-report-2020-2027-with-covid-19-impact-and-analysis-301184010.html	DUBLIN, Dec. 2, 2020 /PRNewswire/ -- The "Pulmonary Devices Market Forecast to 2027 - COVID-19 Impact and Global Analysis by Type; Application; End User, and Geography" report has been added to ResearchAndMarkets.com's offering. The market was valued at US$ 18,598.56 million in 2019 and...	(No Keywords detect)	(Possible_Funding)	('2020-2027', 'DATE')	-
12/02/2020, 15:48:23	12/02/2020, 19:00:00	PRNewswire -Entertain­ment & Media	Tinuiti Announces Investment from New Mountain Capital to Accelerate Next Phase of Growth	https://www.prnewswire.com:443/news-releases/tinuiti-announces-investment-from-new-mountain-capital-to-accelerate-next-phase-of-growth-301183922.html	NEW YORK, Dec. 2, 2020 /PRNewswire/ -- Tinuiti - the largest independent performance marketing firm across Google, Facebook and Amazon - today announced it has partnered with New Mountain Capital, a leading growth-oriented investment firm with $28 billion in assets under management. The...	(Funding)	Not Computed	('New Mountain Capital', 'ORG')	-
12/02/2020, 15:48:24	12/02/2020, 16:07:00	PRNewswire -Environ­ment	CuriosityStream Preps Original New Series: 'Rescued Chimpanzees of the Congo with Jane Goodall'	https://www.prnewswire.com:443/news-releases/curiositystream-preps-original-new-series-rescued-chimpanzees-of-the-congo-with-jane-goodall-301183893.html	SILVER SPRING, Md., Dec. 2, 2020 /PRNewswire/ -- CuriosityStream Inc., (NASDAQ: CURI), the leading global factual streaming service and media company, today announced production on the original new series, Rescued Chimpanzees of the Congo with Jane Goodall (working title), coming to...	(Possible_Funding)	Not Computed	('Congo', 'GPE')("Jane Goodall'", 'PERSON')	-
12/02/2020, 15:48:24	12/02/2020, 14:00:00	PRNewswire -Environ­ment	Johnson Controls Releases 2020 Energy Efficiency Indicator Survey Results	https://www.prnewswire.com:443/news-releases/johnson-controls-releases-2020-energy-efficiency-indicator-survey-results-301183448.html	CORK, Ireland, Dec. 2, 2020 /PRNewswire/ -- Johnson Controls (NYSE: JCI), the global leader for smart and sustainable buildings, released the findings of its annual Energy Efficiency Indicator survey, which found that more than half of organizations plan to increase investment in energy...	(No Keywords detect)	(Funding)	('Johnson Controls Releases 2020 Energy Efficiency Indicator Survey Results', 'ORG')	-
12/02/2020, 15:48:24	12/02/2020, 12:45:00	PRNewswire -Environ­ment	Ridley Scott launches climate campaign: 'We are at the threshold of an abyss of disaster'	https://www.prnewswire.com:443/news-releases/ridley-scott-launches-climate-campaign-we-are-at-the-threshold-of-an-abyss-of-disaster-301183385.html	LISBON, Portugal, Dec. 2, 2020 /PRNewswire/ -- Raised by Wolves (2020), The Martian (2015) and The Gladiator (2000) director Sir Ridley Scott launched a trailer with stark warnings for both the global tech industry and humankind itself Scott launched the trailer at Web Summit, together...	(No Keywords detect)	(Funding)	('Ridley Scott', 'PERSON')	-
12/02/2020, 15:48:24	12/02/2020, 12:00:00	PRNewswire -Environ­ment	Boralex announces closing of the acquisition of CDPQ's 49% equity stake in 3 Quebec wind farms, with a 296 MW installed capacity	https://www.prnewswire.com:443/news-releases/boralex-announces-closing-of-the-acquisition-of-cdpqs-49-equity-stake-in-3-quebec-wind-farms-with-a-296-mw-installed-capacity-301183476.html	MONTREAL, Dec. 2, 2020 /PRNewswire/ - Boralex Inc. ("Boralex" or the "Corporation") (TSX: BLX) is pleased to announce that it has closed the acquisition of the previously announced 49% equity stake held by the Caisse de dépôt et placement du Québec ("CDPQ") in 3 wind farms in Quebec,...	(M&A)	Not Computed	('CDPQ', 'ORG')('49%', 'PERCENT')('3', 'CARDINAL')('Quebec', 'ORG')('296', 'CARDINAL')	-
12/02/2020, 15:48:24	12/02/2020, 19:28:00	PRNewswire -Financial Services & Investing	Westwood Financial Announces Third Quarter 2020 Results	https://www.prnewswire.com:443/news-releases/westwood-financial-announces-third-quarter-2020-results-301185068.html	LOS ANGELES, Dec 2, 2020 /PRNewswire/ -- Westwood Financial, a leading retail real estate investment firm, announced updates today on its financial and operational results for the three months and nine months ended September 30, 2020, which included: Westwood has produced an...	(No Keywords detect)	(Funding)	('Third Quarter 2020', 'DATE')	-
12/02/2020, 15:48:24	12/02/2020, 19:02:00	PRNewswire -Financial Services & Investing	Heffernan Insurance Brokers Acquires Truckee Community Insurance Services	https://www.prnewswire.com:443/news-releases/heffernan-insurance-brokers-acquires-truckee-community-insurance-services-301185053.html	WALNUT CREEK, Calif., Dec. 2, 2020 /PRNewswire/ -- Heffernan Insurance Brokers, one of the largest full-service, independent insurance brokerage firms in the United States, has acquired Truckee Community Insurance Services located in Truckee, Calif. Jon Matosian, CEO of Truckee Community...	(M&A)	Not Computed	('Heffernan Insurance Brokers Acquires Truckee Community Insurance Services', 'ORG')	-
12/02/2020, 15:48:24	12/02/2020, 19:00:00	PRNewswire -Financial Services & Investing	Wallis Bank Surpasses Monthly Goal to Support Small Businesses With SBA 7(a) Loans, #1 in the Houston District for the SBA Fiscal Year	https://www.prnewswire.com:443/news-releases/wallis-bank-surpasses-monthly-goal-to-support-small-businesses-with-sba-7a-loans-1-in-the-houston-district-for-the-sba-fiscal-year-301185040.html	HOUSTON, Dec. 2, 2020 /PRNewswire/ -- Wallis Bank, a Preferred U.S. Small Business Administration (SBA) Lender, has announced that they have surpassed their monthly goal of SBA 7(a) loans with 55 loans totaling $83.8 million. This achievement makes the Bank the top-ranking SBA Lender in...	(No Keywords detect)	(Possible_Funding)	('Wallis Bank Surpasses Monthly Goal to', 'ORG')('1', 'MONEY')('the Houston District', 'LOC')('the SBA Fiscal Year', 'DATE')	-
12/02/2020, 15:48:24	12/02/2020, 18:46:00	PRNewswire -Financial Services & Investing	SHAREHOLDER ALERT: WeissLaw LLP Investigates Northern Genesis Acquisition Corp.	https://www.prnewswire.com:443/news-releases/shareholder-alert-weisslaw-llp-investigates-northern-genesis-acquisition-corp-301185034.html	NEW YORK, Dec. 2, 2020 /PRNewswire/ -- WeissLaw LLP is investigating possible breaches of fiduciary duty and other violations of law by the board of directors of Northern Genesis Acquisition Corp. ("NGA" or the "Company") (NYSE: NGA) in connection with the Company's proposed merger with...	(M&A)	Not Computed	('WeissLaw LLP Investigates Northern Genesis Acquisition Corp.', 'ORG')	-
12/02/2020, 15:48:24	12/02/2020, 16:13:00	PRNewswire -Heavy Industry & Manufacturing	Land Gorilla CEO Receives HousingWire 2020 Tech Trendsetters Award	https://www.prnewswire.com:443/news-releases/land-gorilla-ceo-receives-housingwire-2020-tech-trendsetters-award-301183902.html	SAN LUIS OBISPO, Calif., Dec. 2, 2020 /PRNewswire/ -- Land Gorilla, the #1 technology provider of construction loan management software, announced today that Sean Faries, Land Gorilla CEO, received the HousingWire 2020 Tech Trendsetters award for the second year in a row. The award...	(Possible_Funding)	Not Computed		-
12/02/2020, 15:48:24	12/02/2020, 16:13:00	PRNewswire -Heavy Industry & Manufacturing	Synergetics' OpenFLIS Prioritized To Go Through The JAB Authorization Process	https://www.prnewswire.com:443/news-releases/synergetics-openflis-prioritized-to-go-through-the-jab-authorization-process-301183851.html	FORT COLLINS, Colo., Dec. 2, 2020 /PRNewswire/ -- The Joint Authorization Board (JAB), consisting of the Chief Information Officers from the Department of Homeland Security, General Services Administration, and Department of Defense, has selected, from the latest round of FedRAMP Connect,...	(No Keywords detect)	(Possible_Funding)		-
12/02/2020, 15:48:24	12/02/2020, 16:05:00	PRNewswire -Heavy Industry & Manufacturing	Lument Provides $21.5 Million in Freddie Mac Financing for Affordable Housing in El Paso	https://www.prnewswire.com:443/news-releases/lument-provides-21-5-million-in-freddie-mac-financing-for-affordable-housing-in-el-paso-301183891.html	NEW YORK, Dec. 2, 2020 /PRNewswire/ -- Lument, a national leader in commercial real estate finance, announced today that it provided a $21.5 million Freddie Mac unfunded forward commitment loan to facilitate the substantial renovation of Jackie Robinson Memorial Apartments, an affordable...	(Possible_Funding)	Not Computed	('Lument Provides', 'ORG')('$21.5 Million', 'MONEY')('Freddie Mac Financing for Affordable Housing', 'ORG')('El Paso', 'GPE')	-
12/02/2020, 15:48:24	12/02/2020, 18:46:00	PRNewswire -People & Culture	ENSPIRA Reaffirms Its Dedication to Working Parents and Their Families	https://www.prnewswire.com:443/news-releases/enspira-reaffirms-its-dedication-to-working-parents-and-their-families-301185036.html	LOS ANGELES, Dec. 2, 2020 /PRNewswire/ -- Enspira, an innovative human resources consultancy, today announced it signed the "Invest in Parents" Pledge to reaffirm its commitment to advocate, support and protect working parents to enable them to remain in and thrive in the workforce. "At...	(No Keywords detect)	(Funding)		-
12/02/2020, 15:48:24	12/02/2020, 17:44:00	PRNewswire -People & Culture	Comcast RISE Awards 35 Black-Owned, Small Businesses in the Washington, D.C., Metropolitan Area with Marketing and Technology Resources and Makeovers	https://www.prnewswire.com:443/news-releases/comcast-rise-awards-35-black-owned-small-businesses-in-the-washington-dc-metropolitan-area-with-marketing-and-technology-resources-and-makeovers-301183980.html	WASHINGTON, Dec. 2, 2020 /PRNewswire/ -- Comcast Corporation (NASDAQ: CMCSA) today announced the first round of Comcast RISE award recipients, which include over 700 businesses that will receive consulting, media and creative production services from Effectv, the advertising sales...	(No Keywords detect)	(Possible_M&A /Possible_Funding)	('Washington', 'GPE')('D.C.', 'GPE')('Metropolitan Area', 'ORG')	-
12/02/2020, 15:48:24	12/02/2020, 17:34:00	PRNewswire -People & Culture	Mexican Gig Worker Platform Heru Raises $1.7M in Seed Financing	https://www.prnewswire.com:443/news-releases/mexican-gig-worker-platform-heru-raises-1-7m-in-seed-financing-301183969.html	MEXICO CITY, Dec. 2, 2020 /PRNewswire/ -- Heru, a new startup that provides the first comprehensive digital worker service platform in Mexico, today announced that it has raised a $1.7 million USD pre-seed venture financing. The round was led by Mountain Nazca with participation from...	(Funding /Possible_Funding)	Not Computed	('Mexican Gig Worker Platform Heru Raises', 'ORG')('$1.7M', 'MONEY')	-
12/02/2020, 15:48:24	12/02/2020, 18:16:00	PRNewswire -Policy & Public Interest	Project Punch Card is Now a 501(c)(3) Non-Profit Organization, Their Core Mission is to Foster Long-Term Investment Orientation Amongst Women and Minority Students	https://www.prnewswire.com:443/news-releases/project-punch-card-is-now-a-501c3-non-profit-organization-their-core-mission-is-to-foster-long-term-investment-orientation-amongst-women-and-minority-students-301183978.html	NEW YORK, Dec. 2, 2020 /PRNewswire/ -- Please enroll in PPC's newsletter to learn more about the organization and future value investing conferences. Project Punch Card's educational activities aim to encourage finance professionals and students pursuing a career in the investment...	(Funding)	Not Computed	('501(c)(3', 'CARDINAL')('Non-Profit Organization', 'ORG')('Foster Long-Term Investment Orientation Amongst Women and Minority Students', 'ORG')	-
12/02/2020, 15:48:24	12/02/2020, 16:55:00	PRNewswire -Policy & Public Interest	Montefiore and Einstein Awarded $15 Million Federal Grant to Support the Bond between Fathers and Children	https://www.prnewswire.com:443/news-releases/montefiore-and-einstein-awarded-15-million-federal-grant-to-support-the-bond-between-fathers-and-children-301183934.html	BRONX, N.Y., Dec. 2, 2020 /PRNewswire/ -- The stress of COVID-19, quarantine and social distancing has tested many relationships. It has been especially challenging for parents whose children aren't under the same roof. A $15 million grant from the United States Department of Health and...	(Possible_Funding)	Not Computed	('Einstein', 'PERSON')('$15 Million', 'MONEY')	-
12/02/2020, 15:48:25	12/02/2020, 16:30:00	PRNewswire -Telecomm­unications	Data Center Power Market Size USD 21410 Million by 2026 at CAGR 5.6% | Valuates Reports	https://www.prnewswire.com:443/news-releases/data-center-power-market-size-usd-21410-million-by-2026-at-cagr-5-6--valuates-reports-301183674.html	BANGALORE, India, Dec. 2, 2020 /PRNewswire/ -- The Data Center Power Market is Segmented by Type (AC Power Supply, DC Power Supply), by Application (BFSI, Telecom & IT, Government, Others). This report is published on Valuates Reports in the Computers & Electronics Category. It also...	(Possible_Funding)	Not Computed	('Data Center Power Market Size', 'ORG')('2026', 'DATE')('5.6%', 'PERCENT')	-
12/02/2020, 15:48:25	12/02/2020, 15:00:00	PRNewswire -Telecomm­unications	YouVersion names Verse of the Year and releases 2020's Bible App Search Trends	https://www.prnewswire.com:443/news-releases/youversion-names-verse-of-the-year-and-releases-2020s-bible-app-search-trends-301183821.html	OKLAHOMA CITY, Dec. 2, 2020 /PRNewswire/ -- In a year marked by uncertainty and turmoil, more people than ever turned to the Bible for hope. In fact, the YouVersion Community completed nearly 600 million searches within the app in 2020, an 80% increase over the previous year. With...	(No Keywords detect)	(Possible_Funding)	('YouVersion', 'ORG')('Verse of the Year', 'ORG')('2020', 'DATE')('Bible App Search', 'WORK_OF_ART')	-
12/02/2020, 15:48:25	12/02/2020, 14:35:00	PRNewswire -Telecomm­unications	Chime Solutions closes on a $30 Million Recapitalization Investment with BBH Capital Partners	https://www.prnewswire.com:443/news-releases/chime-solutions-closes-on-a-30-million-recapitalization-investment-with-bbh-capital-partners-301183574.html	MORROW, Ga., Dec. 2, 2020 /PRNewswire/ -- Chime Solutions ("Chime"), a provider of customer contact services and one of the largest and fastest-growing minority-owned businesses in the country, announced that it has closed on a $30 million recapitalization investment with BBH Capital...	(Funding /Possible_Funding)	Not Computed	('$30 Million', 'MONEY')('BBH Capital Partners', 'ORG')	-
12/02/2020, 15:48:25	12/02/2020, 16:23:00	PRNewswire -Sports	CLMBR, The World's First Connected Vertical Climbing Machine, Launches Campaign on Indiegogo and Raises More Than $500,000 In 24 hours	https://www.prnewswire.com:443/news-releases/clmbr-the-worlds-first-connected-vertical-climbing-machine-launches-campaign-on-indiegogo-and-raises-more-than-500-000-in-24-hours-301183907.html	DENVER, Dec. 2, 2020 /PRNewswire/ -- CLMBR, a leader in connected fitness technology, today announced a crowdfunding campaign on Indiegogo and reached $538,621 in sales within 24 hours. Backed by a star-studded investor team of Jay-Z, Pitbull, and Novak Djokovic, CLMBR delivers a...	(Funding)	Not Computed	('CLMBR', 'ORG')("The World's", 'ORG')('First Connected Vertical Climbing Machine', 'ORG')('Launches Campaign on Indiegogo and Raises', 'ORG')('24 hours', 'TIME')	-
