12/07/2020, 16:00:32	12/07/2020, 19:39:11	BusinessJournal	California furniture company establishing East Coast presence in High Point	https://www.bizjournals.com/triad/news/2020/12/07/ariston-hospitality-expanding-to-high-point.html?ana=brss_1028	The company is investing $1 million, creating at least 15 new jobs at a vacant site that is in both Guilford and Randolph counties.	(No Keywords detect)	(Possible_Funding)	('California', 'GPE')('East Coast', 'LOC')	-
12/07/2020, 16:00:32	12/07/2020, 19:37:37	BusinessJournal	The Funded: Coursera, Intapp may join the IPO parade next year	https://www.bizjournals.com/sanjose/news/2020/12/07/2-bay-area-companies-test-waters-for-an-ipo.html?ana=brss_1028	Several Bay Area companies set price targets for what may be the busiest December for IPOs here, while others are exploring making their Wall Street debuts next year.	(Funding /IPOs)	Not Computed	('Coursera', 'PERSON')('Intapp', 'ORG')('next year', 'DATE')	-
12/07/2020, 16:00:32	12/07/2020, 19:35:56	BusinessJournal	Is Goldman Sachs next to join Wall Street's exodus to South Florida?	https://www.bizjournals.com/newyork/news/2020/12/07/goldman-sachs-asset-management-south-florida.html?ana=brss_1028	The multinational investment bank is contemplating a move away from New York City.	(No Keywords detect)	(Possible_Funding)	('Goldman Sachs', 'ORG')('Florida', 'GPE')	-
12/07/2020, 16:00:32	12/07/2020, 19:28:35	BusinessJournal	Pittsburgh's biggest private equity firm confirms Winnipeg acquisition by portfolio company	https://www.bizjournals.com/pittsburgh/news/2020/12/07/incline-equity-confirms-winnipeg-deal.html?ana=brss_1028	Incline bought Profile Products two years ago and, yes, it's gathered moss literally with new deal.	(M&A)	Not Computed	('Pittsburgh', 'GPE')('Winnipeg', 'ORG')	-
12/07/2020, 16:00:32	12/07/2020, 19:22:17	BusinessJournal	Charlotte-based SPX Flow to acquire European company UTG Mixing Group	https://www.bizjournals.com/charlotte/news/2020/12/07/spx-flow-charlotte-acquires-utg-mixing-group.html?ana=brss_1028	Charlotte-based SPX Flow announced Monday it had come to an agreement to acquire UTG Mixing Group, which the industrial conglomerate hopes will lead to European growth.	(M&A)	Not Computed	('Charlotte', 'GPE')('SPX Flow', 'ORG')('European', 'NORP')('UTG Mixing Group', 'ORG')	-
12/07/2020, 16:00:32	12/07/2020, 19:16:56	BusinessJournal	Exclusive: Former Vology CEO Barry Shevlin is the latest Tampa Bay tech founder to launch an investment firm	https://www.bizjournals.com/tampabay/news/2020/12/07/former-vology-ceo-launches-investment-firm.html?ana=brss_1028	"This is the next slice of evolution in our companies that are growing up here," Shevlin said.	(Possible_Funding)	Not Computed	('Barry Shevlin', 'PERSON')('Tampa Bay', 'LOC')	-
12/07/2020, 16:00:32	12/07/2020, 19:13:51	BusinessJournal	Banking ranking: Top 10 banks that doled out the most PPP funds in Memphis area	https://www.bizjournals.com/memphis/news/2020/12/07/banking-ranking-ppp-memphis-area.html?ana=brss_1028	A total of $1.83 billion in PPP funds were approved for Memphis-area companies. Here are the top 10 banks to give out the most locally, and to the most number of businesses.	(Funding)	Not Computed	('10', 'CARDINAL')('Memphis', 'GPE')	-
12/07/2020, 16:00:32	12/07/2020, 19:12:26	BusinessJournal	Airbnb boosts IPO targets, could be valued as high as $42B	https://www.bizjournals.com/sanjose/news/2020/12/07/airbnb-ipo-tweaks-numbers-raises-demand-questions.html?ana=brss_1028	When it goes public later this week, its valuation could be as high as $42 billion, making it the most highly valued alumnus of the Mountain View-based Y Combinator accelerator program.	(IPOs)	Not Computed	('Airbnb', 'GPE')('as high as $42B', 'MONEY')	-
12/07/2020, 16:00:32	12/07/2020, 19:06:22	BusinessJournal	As Tampa developers prepare to deliver 1M square feet of office space, new JLL report says workers are banking on hybrid arrangements post-pandemic	https://www.bizjournals.com/tampabay/news/2020/12/07/workers-hope-hybrid-working-arrangements-endure.html?ana=brss_1028	Seventy-two percent of employees want to continue working from home after the pandemic has passed — and that will have a meaningful effect in the Tampa Bay area, where 1 million square feet of office space is set to open in 2021.	(No Keywords detect)	(Possible_Funding)	('Tampa', 'GPE')('1M square feet', 'QUANTITY')('JLL', 'ORG')	-
12/07/2020, 16:00:32	12/07/2020, 19:06:17	BusinessJournal	Silicon Valley startup Upstart doubling its Short North office after upcoming IPO	https://www.bizjournals.com/columbus/news/2020/12/07/silicon-valley-based-upstart-doubling-columbus-hq2.html?ana=brss_1028	A Silicon Valley consumer lending startup heading for an IPO plans to double its "HQ2" office in Columbus to 500 jobs.	(IPOs)	Not Computed	('Silicon Valley', 'LOC')('Short North', 'ORG')	-
12/07/2020, 16:00:32	12/07/2020, 19:05:37	BusinessJournal	British billionaires acquire $135M mortgage behind Bal Harbour Resort	https://www.bizjournals.com/southflorida/news/2020/12/07/135m-bal-harbour-resort-mortgage-acquired.html?ana=brss_1028	This isn't the first major purchase the Reuben brothers have made in South Florida since the onset of the Covid-19 pandemic.	(M&A)	Not Computed	('British', 'NORP')('135', 'MONEY')('Bal Harbour Resort', 'FAC')	-
12/07/2020, 16:00:32	12/07/2020, 19:01:53	BusinessJournal	Diagnostic startup closes its Series A for second time — and it’s raising again	https://www.bizjournals.com/washington/news/2020/12/07/this-diagnostic-startup-has-finally-closed-a-3m-r.html?ana=brss_1028	The Sterling biotech has raised another $1.2 million on top of $1.8 million it secured in 2019.	(Funding)	Not Computed	('second', 'ORDINAL')	-
12/07/2020, 16:00:32	12/07/2020, 19:01:49	BusinessJournal	Virtual groundbreaking set for Tom Lee Park redesign	https://www.bizjournals.com/memphis/news/2020/12/07/virtual-groundbreaking-set-for-tom-lee-park.html?ana=brss_1028	The $60 million redesign of Tom Lee Park will soon take another big step.	(No Keywords detect)	(Possible_Funding)	('Tom Lee Park', 'PERSON')	-
12/07/2020, 16:00:32	12/07/2020, 18:59:16	BusinessJournal	Lordstown Motors leads NE Ohio winners of $33.9M in job creation tax credits	https://www.bizjournals.com/cleveland/news/2020/12/07/ne-ohio-companies-win-339m-in-tax-credits.html?ana=brss_1028	Lordstown Motors, launching with the Endurance electric pickup truck in September 2021, expects to create 1,570 full-time positions and generate $91 million in new annual payroll by Dec. 31, 2025.	(No Keywords detect)	(Possible_Funding)	('Lordstown Motors', 'ORG')('Ohio', 'GPE')('$33.9M', 'MONEY')	-
12/07/2020, 16:00:32	12/07/2020, 18:58:54	BusinessJournal	Big deals, relentless housing market lift Wake County property sales to high mark for 2020	https://www.bizjournals.com/triangle/news/2020/12/07/wake-county-property-sales-november-2020.html?ana=brss_1028	Wake County property sales saw its biggest month of the year in November as housing demand continues to surge and big commercial transactions hit the market.	(Possible_M&A)	Not Computed	('Wake County', 'GPE')('2020', 'DATE')	-
12/07/2020, 16:00:32	12/07/2020, 18:53:13	BusinessJournal	Digital ad firm Adzerk raises $11 million, changes name to Kevel	https://www.bizjournals.com/newyork/news/2020/12/07/digital-ad-firm-adzerk-raises-11-million-changes.html?ana=brss_1028	Investors participating in the round were Fulcrum Equity, Commerce Ventures, Math Capital, Food Retail Ventures and "multiple angels."	(Funding /Possible_Funding)	Not Computed	('Digital', 'ORG')('Adzerk', 'ORG')('$11 million', 'MONEY')	-
12/07/2020, 16:00:32	12/07/2020, 18:48:08	BusinessJournal	Country Club of the Poconos along with more than 400 acres comes up for sale	https://www.bizjournals.com/philadelphia/news/2020/12/07/country-club-and-400-acres-comes-up-for-sale.html?ana=brss_1028	It’s not often such expansive properties come up for sale and it’s unusual for townships to sell land that is open space. However, Middle Smithfield Township officials have patiently and methodically planned out what it envisions with new ownership.	(Possible_M&A)	Not Computed	('Country Club of the Poconos', 'ORG')('more than 400 acres', 'QUANTITY')	-
12/07/2020, 16:00:32	12/07/2020, 18:40:56	BusinessJournal	Baird adds to portfolio with investment in finance and legal services tech company	https://www.bizjournals.com/milwaukee/news/2020/12/07/baird-invests-in-finance-and-legal-service.html?ana=brss_1028	HSP Group provides headquarters-based finance, tax, legal, mergers and acquisition, consulting and human resources services and personnel to help companies expand and manage their international operations.	(Possible_Funding)	Not Computed	('Baird', 'ORG')	-
12/07/2020, 16:00:32	12/07/2020, 18:25:29	BusinessJournal	TBJ Plus: The Fast 50 winners hiring the most; CEO confidence soars; Chick-fil-A sues over chicken meat	https://www.bizjournals.com/triangle/news/2020/12/07/fast-growing-companies-raleigh-durham-are-hiring.html?ana=brss_1028	A list of the Fast 50 winners that are hiring the most in the next 12 months; large retailer files for bankruptcy; Chick-fil-A filing lawsuit.	(No Keywords detect)	(Bankruptcy)	('The Fast 50', 'WORK_OF_ART')('Chick-fil-A', 'PERSON')	-
12/07/2020, 16:00:32	12/07/2020, 18:23:09	BusinessJournal	Recruitment and hiring company Cielo acquires California business	https://www.bizjournals.com/milwaukee/news/2020/12/07/recruitment-and-hiring-company-cielo-acquires-cali.html?ana=brss_1028	Earlier this year, Cielo announced a partnership with Talent Function to help craft the organization’s digitization strategy.	(M&A)	Not Computed	('Cielo', 'ORG')('California', 'GPE')	-
12/07/2020, 16:00:32	12/07/2020, 18:10:36	BusinessJournal	NortonLifeLock to expand global reach with acquisition of German company	https://www.bizjournals.com/phoenix/news/2020/12/07/nortonlifelock-to-acquire-german-company.html?ana=brss_1028	NortonLifeLock Inc. announced on Dec. 7 plans to acquire German cybersecurity company Avira, giving the Tempe-based company a strong foothold in Europe and other emerging markets as it looks to expand internationally.	(M&A)	Not Computed	('German', 'NORP')	-
12/07/2020, 16:00:32	12/07/2020, 18:03:43	BusinessJournal	How Central Ohio restaurants fared in PPP — and what they need now	https://www.bizjournals.com/columbus/news/2020/12/07/restaurant-ppp-what-they-got-in-the-spring-what.html?ana=brss_1028	Columbus area restaurants landed $215 million in Paycheck Protection Program approvals, but that isn’t expected to be enough support for the struggling industry.	(No Keywords detect)	(Possible_Funding)	('Ohio', 'GPE')	-
12/07/2020, 16:00:32	12/07/2020, 18:02:44	BusinessJournal	Fifth Third commits nearly $3 billion to racial equality, inclusion	https://www.bizjournals.com/cincinnati/news/2020/12/07/fifth-third-commits-28-billion-to-racial-equalit.html?ana=brss_1028	Fifth Third Bank has committed to investing $2.8 billion over the next three years in racial equality, equity and inclusion.	(No Keywords detect)	(Possible_Funding)	('Fifth Third', 'PERSON')('nearly $3 billion', 'MONEY')	-
12/07/2020, 16:00:32	12/07/2020, 17:56:07	BusinessJournal	St. Louis fiber startup Arcadian Infracom raises $1.5M, receives key regulatory approval	https://www.bizjournals.com/stlouis/news/2020/12/07/st-louis-long-haul-fiber-startup-raises-1-5m.html?ana=brss_1028	The startup said the financing, announced earlier this month, was led by a group of “seasoned communications infrastructure industry executives.” The fresh funding comes after Arcadian last year raised $1.35 million.	(Funding)	Not Computed	('St. Louis', 'GPE')('Arcadian', 'NORP')('Infracom', 'ORG')('$1.5M', 'MONEY')	-
12/07/2020, 16:00:32	12/07/2020, 17:31:55	BusinessJournal	Hawaii to receive $9M in disaster relief funding for 2018 Kilauea eruption	https://www.bizjournals.com/pacific/news/2020/12/07/hawaii-receives-9m-for-eruptions.html?ana=brss_1028	The aid, which comes from the Federal Emergency Management Agency, will help to cover HI-EMA operational costs during and after the eruptions.	(Funding)	Not Computed	('Hawaii', 'GPE')('$9M', 'MONEY')('2018', 'DATE')('Kilauea', 'GPE')	-
12/07/2020, 16:00:32	12/07/2020, 17:31:16	BusinessJournal	Loves Furniture & Mattresses exiting Pittsburgh market as well as the state after recent debut	https://www.bizjournals.com/pittsburgh/news/2020/12/07/loves-furniture-exiting-stores-in-pennsylvania.html?ana=brss_1028	New furniture retailer launched amid the bankruptcy of Michigan's Art Van Furniture cutting back store presence after opening in the region only a few months ago.	(No Keywords detect)	(Bankruptcy)	('Loves Furniture & Mattresses', 'ORG')('Pittsburgh', 'GPE')	-
12/07/2020, 16:00:32	12/07/2020, 17:28:20	BusinessJournal	NBA to give $30M each to Bucks, rest of teams to protect finances as season approaches	https://www.bizjournals.com/milwaukee/news/2020/12/07/nba-to-give-30m-to-each-of-its-teams-to-protect-t.html?ana=brss_1028	As it did at the start of the Covid-19 crisis, the NBA is making the first move, this time using the private placement market to raise money to help teams through the tough times.	(Possible_Funding)	Not Computed	('NBA', 'ORG')('30', 'MONEY')('Bucks', 'ORG')	-
12/07/2020, 16:00:32	12/07/2020, 17:26:24	BusinessJournal	Lonely Planet sold to Charlotte-based Red Ventures	https://www.bizjournals.com/nashville/news/2020/12/07/red-ventures-lonely-planet-acquisition-travel.html?ana=brss_1028	Red Ventures, a digital brands and marketing firm, acquired Lonely Planet from NC2 Media for an undisclosed price.	(No Keywords detect)	(M&A)	('Charlotte', 'GPE')('Red Ventures', 'ORG')	-
12/07/2020, 16:00:32	12/07/2020, 17:19:32	BusinessJournal	Wizards to receive $30M from NBA to bolster finances	https://www.bizjournals.com/washington/news/2020/12/07/wizards-to-receive-30m-from-nba.html?ana=brss_1028	Each franchise in the 30-team league is getting funding.	(Possible_Funding)	Not Computed	('30', 'MONEY')('NBA', 'ORG')	-
12/07/2020, 16:00:32	12/07/2020, 17:04:32	BusinessJournal	Mountain View-based Aeva touts 'lidar on a chip' as it gets set to go public via SPAC merger	https://www.bizjournals.com/sanjose/news/2020/12/07/aeva-puts-lidar-on-a-chip-prepares-to-go-public.html?ana=brss_1028	Aeva CEO tells why his company's lidar is a leap forward and why he plans to go public in a "blank check" merger.	(M&A)	Not Computed	('Mountain View', 'GPE')('Aeva', 'GPE')('SPAC', 'ORG')	-
12/07/2020, 16:00:32	12/07/2020, 17:00:00	BusinessJournal	Last lot in Kapolei Business Park's Phase 2 sold as industrial land shrinks	https://www.bizjournals.com/pacific/news/2020/12/07/last-industrial-kapolei-business-park-phase-2-sold.html?ana=brss_1028	The amount of available land for warehouse use is shrinking in West Oahu as more industrial lots sell.	(Possible_Funding)	Not Computed	("Kapolei Business Park's", 'FAC')('Phase 2', 'FAC')	-
12/07/2020, 16:00:32	12/07/2020, 16:54:08	BusinessJournal	Indian Hills shopping center sells to Equisset, at least for the short term	https://www.bizjournals.com/wichita/news/2020/12/07/indian-hills-shopping-center-sells-to-equisset.html?ana=brss_1028	The deal is an example of Equisset's asset-based financing solutions that allow clients to temporarily liquidate their assets and then buy them back.	(Possible_M&A)	Not Computed	('Indian Hills', 'GPE')('Equisset', 'GPE')	-
12/07/2020, 16:00:32	12/07/2020, 16:45:36	BusinessJournal	Raleigh real estate marketing firm expands reach by acquiring competitor	https://www.bizjournals.com/triangle/news/2020/12/07/real-estate-marketing-raleigh-acquisition.html?ana=brss_1028	A Raleigh real estate marketing firm has doubled its reach in the industry by acquiring and rebranding a South Carolina competitor.	(M&A)	Not Computed		-
12/07/2020, 16:00:32	12/07/2020, 16:38:45	BusinessJournal	Billionaire Siebel's C3.ai boosts IPO targets 12%, hopes to raise up to $677M	https://www.bizjournals.com/sanfrancisco/news/2020/12/07/c3ai-boosts-ipo-targets-12.html?ana=brss_1028	The Redwood City software company's Wall Street debut comes amid a flood of IPOs planned by Bay Area companies in what may be the busiest December ever.	(Funding /IPOs)	Not Computed	("Billionaire Siebel's", 'PERSON')('12%', 'PERCENT')('up to $677', 'MONEY')	-
12/07/2020, 16:00:32	12/07/2020, 16:35:53	BusinessJournal	These Dayton-area defense contractors received over $1M in PPP loans	https://www.bizjournals.com/dayton/news/2020/12/07/defense-contractors-ppp.html?ana=brss_1028	Newly released data tied to a federal loan program that delivered billions of dollars to businesses during the Covid-19 pandemic shows there were several Dayton-area defense contractors that benefitted from the funding initiative.	(No Keywords detect)	(Funding)	('Dayton', 'ORG')('$1M', 'MONEY')	-
12/07/2020, 16:00:32	12/07/2020, 16:33:55	BusinessJournal	Airbnb boosts IPO pricing range	https://www.bizjournals.com/sanfrancisco/news/2020/12/07/airbnb-ipo-tweaks-numbers-raises-demand-questions.html?ana=brss_1028	When it goes public later this week, its valuation could be as high as $42 billion.	(IPOs)	Not Computed	('Airbnb', 'GPE')	-
12/07/2020, 16:00:32	12/07/2020, 16:29:04	BusinessJournal	More than 50,000 PNC employees supporting early childhood education this season via gift cards funded by PNC Foundation	https://www.bizjournals.com/pittsburgh/news/2020/12/07/pnc-employees-support-early-childhood-educatoin.html?ana=brss_1028	Bank's Grow Up Great initiative gives through gift cards funded by its foundation this holiday season.	(Funding)	Not Computed	('More than 50,000', 'CARDINAL')('PNC', 'ORG')('PNC Foundation', 'ORG')	-
12/07/2020, 16:00:32	12/07/2020, 16:27:12	BusinessJournal	Ready Capital acquiring specialty mortgage company Anworth Mortgage Asset Corp.	https://www.bizjournals.com/newyork/news/2020/12/07/ready-capital-acquiring-santa-monica-specialty-mor.html?ana=brss_1028	The combined company will operate under the name Ready Capital, its shares will be traded under the stock symbol "RC," and company headquarters will be located in New York.	(M&A)	Not Computed	('Ready Capital', 'PERSON')('Anworth Mortgage Asset Corp.', 'ORG')	-
12/07/2020, 16:00:32	12/07/2020, 16:22:16	BusinessJournal	BART approves agreements with unions ahead of deadlines	https://www.bizjournals.com/sanfrancisco/news/2020/12/07/bart-reaches-agreements-unions-ahead-deadline.html?ana=brss_1028	The transit agency faces a $33 million shortfall this fiscal year.	(No Keywords detect)	(Possible_Funding)	('BART', 'ORG')	-
12/07/2020, 16:00:32	12/07/2020, 16:01:55	BusinessJournal	Richmond development on contaminated land secures approval	https://www.bizjournals.com/sanfrancisco/news/2020/12/07/richmond-development-on-contaminated-land-approve.html?ana=brss_1028	Plans by developer Shopoff Realty Investments call for 2,000 to 4,000 units of housing and up to 50,000 square feet for retail.	(Possible_Funding)	Not Computed	('Richmond', 'GPE')	-
12/07/2020, 16:00:32	12/07/2020, 15:45:56	BusinessJournal	Is Goldman Sachs next to join Wall Street's exodus to South Florida?	https://www.bizjournals.com/southflorida/news/2020/12/07/goldman-sachs-asset-management-south-florida.html?ana=brss_1028	The multinational investment bank is contemplating a move away from New York City.	(No Keywords detect)	(Possible_Funding)	('Goldman Sachs', 'ORG')('Florida', 'GPE')	-
12/07/2020, 16:00:32	12/07/2020, 15:43:16	BusinessJournal	Dish reaches $210M settlement in robocall telemarketing case	https://www.bizjournals.com/sanjose/news/2020/12/07/dish-settlement-robocall-case.html?ana=brss_1028	Four states, including California, and the federal government sued Dish Network in 2009 for making 55 million illegal robocalls.	(No Keywords detect)	(Possible_Funding)	('210', 'MONEY')	-
12/07/2020, 16:00:32	12/07/2020, 15:36:35	BusinessJournal	Billionaire Siebel's C3.ai boosts IPO targets 12%, hopes to raise up to $677M	https://www.bizjournals.com/sanjose/news/2020/12/07/c3ai-boosts-ipo-targets-12.html?ana=brss_1028	The Redwood City software company's Wall Street debut comes amid a flood of IPOs planned by Bay Area companies in what may be the busiest December ever.	(Funding /IPOs)	Not Computed	("Billionaire Siebel's", 'PERSON')('12%', 'PERCENT')('up to $677', 'MONEY')	-
12/07/2020, 16:00:32	12/07/2020, 15:28:48	BusinessJournal	Association of local governments lists projects for state transit-oriented development funds	https://www.bizjournals.com/sacramento/news/2020/12/07/sacog-lists-projects-for-state-development-funds.html?ana=brss_1028	James Corless, CEO of the Sacramento Area Council of Governments, said the Green Means Go project is a bid to match local needs with state money toward infill and transit-oriented developments that reduce greenhouse gas emissions.	(Funding)	Not Computed		-
12/07/2020, 16:00:32	12/07/2020, 15:12:02	BusinessJournal	Sold for $400K in 2008, Delaware Avenue building sells again for $7 million	https://www.bizjournals.com/buffalo/news/2020/12/07/california-investors-make-big-buffalo-deal.html?ana=brss_1028	The 58-year-old Lutheran Nursing Home was renovated into a 49-unit apartment building.	(Possible_M&A /Possible_Funding)	Not Computed	('$400K', 'MONEY')('2008', 'DATE')('Delaware Avenue', 'FAC')('$7 million', 'MONEY')	-
12/07/2020, 16:00:32	12/07/2020, 15:08:04	BusinessJournal	Dish reaches $210M settlement in robocall telemarketing case	https://www.bizjournals.com/denver/news/2020/12/07/dish-settlement-robocall-case.html?ana=brss_1028	Four states and the federal government sued Dish Network in 2009 for making 55 million illegal robocalls.	(No Keywords detect)	(Possible_Funding)	('210', 'MONEY')	-
12/07/2020, 16:00:32	12/07/2020, 15:07:32	BusinessJournal	Texas firm acquires fast-growing Greater Cincinnati hospice care provider	https://www.bizjournals.com/cincinnati/news/2020/12/07/texas-firm-acquires-fast-growing-cincinnati-hospic.html?ana=brss_1028	The Frisco, Texas-based company acquired the fast-growing Greater Cincinnati hospice care provider for nearly $200 million.	(M&A)	Not Computed	('Texas', 'GPE')('Greater Cincinnati', 'ORG')	-
12/07/2020, 16:00:32	12/07/2020, 14:53:51	BusinessJournal	Stevie Nicks sells majority of her song catalog for $100 million	https://www.bizjournals.com/bizwomen/news/latest-news/2020/12/stevie-nicks-sells-majority-of-her-song-catalog.html?ana=brss_1028	Her 'Dreams' hit the charts again this year thanks to a viral TikTok video.	(Possible_M&A /Possible_Funding)	Not Computed	('Nicks', 'ORG')('$100 million', 'MONEY')	-
12/07/2020, 16:00:32	12/07/2020, 14:40:18	BusinessJournal	Francesca's files Chapter 11 bankruptcy, plans to sell to investor	https://www.bizjournals.com/bizwomen/news/latest-news/2020/12/francescas-files-chapter-11-bankruptcy-plans-to.html?ana=brss_1028	The company previously announced plans to close 140 stores.	(Bankruptcy)	Not Computed	('Francesca', 'PERSON')('Chapter 11', 'LAW')	-
12/07/2020, 16:00:32	12/07/2020, 14:39:14	BusinessJournal	Small colleges landed more than $1.2B in PPP funds amid spring-semester swoon	https://www.bizjournals.com/bizjournals/news/2020/12/07/colleges-ppp-loans-covid-19-pandemic-challenges.html?ana=brss_1028	Many of the schools to receive PPP funds also were among the 419 colleges and universities on cash-management programs implemented by the U.S. Department of Education.	(Funding /Possible_Funding)	Not Computed	('more than $1.2B', 'MONEY')('spring-semester', 'DATE')	-
12/07/2020, 16:00:32	12/07/2020, 14:29:05	BusinessJournal	Superior Energy Services files Chapter 11 bankruptcy to restructure	https://www.bizjournals.com/houston/news/2020/12/07/superior-energy-services-chapter-11-bankruptcy.html?ana=brss_1028	Superior, which provides completion and production services and equipment to companies in the oil and gas business, has been planning to file for bankruptcy since at least September.	(Bankruptcy)	Not Computed	('Superior Energy Services', 'ORG')('Chapter 11', 'LAW')	-
12/07/2020, 16:00:32	12/07/2020, 14:27:35	BusinessJournal	Cisco bolsters software, services with pair of European software acquisitions	https://www.bizjournals.com/sanjose/news/2020/12/07/cisco-buys-imimobile.html?ana=brss_1028	The deals come as Cisco CEO Chuck Robbins seeks to add more networking software and services to the hardware that the company has dominated for years.	(M&A)	Not Computed	('Cisco', 'GPE')('European', 'NORP')	-
12/07/2020, 16:00:32	12/07/2020, 14:27:24	BusinessJournal	Apartment building in Albany's Center Square sells for $1 million	https://www.bizjournals.com/albany/news/2020/12/07/albany-willett-street-apartment-building-sold.html?ana=brss_1028	Multi-unit residential buildings have been among the most in-demand properties during the pandemic. And this one sold above asking price.	(Possible_M&A /Possible_Funding)	Not Computed	('Albany', 'GPE')('Center Square', 'FAC')('$1 million', 'MONEY')	-
12/07/2020, 16:00:32	12/07/2020, 14:14:55	BusinessJournal	Tech firm focused on commercial real estate raises more funding as demand grows	https://www.bizjournals.com/dallas/news/2020/12/07/redefinere-ryan-turner.html?ana=brss_1028	The company has raised $3 million in a new investment that was led by Mucker Capital.	(Funding)	Not Computed		-
12/07/2020, 16:00:32	12/07/2020, 14:09:23	BusinessJournal	Parimal Rohit joins ABJ to cover real estate	https://www.bizjournals.com/austin/news/2020/12/07/parimal-rohit-abj-real-estate-reporter.html?ana=brss_1028	Parimal Rohit is the new real estate reporter at ABJ, tasked with covering both the commercial and residential sectors. He'll cover the big deals that have continued even during these calamitous economic times. But he’ll also look into how Covid-19 is shifting real estate trends, and how mom-and-pop shops are trying to keep up on rent when their sales might have dropped off a cliff.	(No Keywords detect)	(Possible_M&A)	('Parimal Rohit', 'ORG')('ABJ', 'ORG')	-
