12/07/2020, 16:00:26	12/03/2020, 13:00:00	VCNews	Apty Receives $5.4M Post-Seed Financing	https://vcnewsdaily.com/apty/venture-capital-funding/ryvjhbfngn	FRISCO, TX, Apty, a leading Digital Adoption Platform, today announced that it secured $5.4 million in post-seed funding.	(Possible_Funding)	Not Computed	('Apty Receives', 'PERSON')('5.4M Post-Seed', 'FAC')	-
12/07/2020, 16:00:26	12/03/2020, 13:00:00	VCNews	PreAct Technologies Nabs $1.6M	https://vcnewsdaily.com/preact-technologies/venture-capital-funding/nrppgmtmdb	PORTLAND, OR, PreAct Technologies, a leader in the next generation of automotive safety, has raised $1.6 million in funding.	(Possible_Funding)	Not Computed	('PreAct Technologies', 'ORG')	-
12/07/2020, 16:00:26	12/03/2020, 13:00:00	VCNews	Space Perspective Pulls In $7M Seed Funding	https://vcnewsdaily.com/space-perspective/venture-capital-funding/dhcrjxnytq	KENNEDY SPACE CENTER, FL, Space Perspective today announced it has closed a $7 million series seed financing.	(Funding /Possible_Funding)	Not Computed		-
12/07/2020, 16:00:26	12/03/2020, 13:00:00	VCNews	Virta Health Raises $65M Series D Round	https://vcnewsdaily.com/virta-health/venture-capital-funding/vxmsdkpdgh	SAN FRANCISCO, CA, Virta Health, the first company dedicated to reversing type 2 diabetes without medications or surgery, has raised $65 million in Series D funding.	(Funding)	Not Computed	('Virta Health Raises', 'ORG')('$65', 'MONEY')	-
12/07/2020, 16:00:26	12/03/2020, 13:00:00	VCNews	Actasys Closes $5M Seed Funding Round	https://vcnewsdaily.com/actasys/venture-capital-funding/xlmxrgswtt	BROOKLYN, NY, Actasys has closed a $5M seed funding round led by Volvo Cars Tech Fund and NextGear Ventures.	(Funding /Possible_Funding)	Not Computed		-
12/07/2020, 16:00:26	12/03/2020, 13:00:00	VCNews	Everlywell Raises $175M Series D Funding	https://vcnewsdaily.com/everlywell/venture-capital-funding/vqlgjdfvxt	AUSTIN, TX, Everlywell, a leading digital health company, today announced an oversubscribed Series D financing of $175 million.	(Funding)	Not Computed	('Everlywell Raises', 'ORG')('175', 'MONEY')	-
12/07/2020, 16:00:26	12/03/2020, 13:00:00	VCNews	The Real Brokerage Lands $20M	https://vcnewsdaily.com/the-real-brokerage/venture-capital-funding/vqjpbfspsx	NEW YORK, NY, The Real Brokerage has announced the closing of a $20 million equity investment by Insight Partners.	(Possible_Funding)	Not Computed	('$20', 'MONEY')	-
12/07/2020, 16:00:26	12/03/2020, 13:00:00	VCNews	FA Match Announces $1M Pre-Seed Round	https://vcnewsdaily.com/fa-match/venture-capital-funding/pwbbsxyfwx	LONGMEADOW, MA, FA Match, the wealth management industry's only data-driven solution for advisor recruiting, has announced a $1 million pre-seed funding round.	(Possible_Funding)	Not Computed	('FA Match Announces', 'ORG')('$1M', 'MONEY')	-
12/07/2020, 16:00:26	12/03/2020, 13:00:00	VCNews	NUBURU Scores $20M Series B Financing	https://vcnewsdaily.com/nuburu/venture-capital-funding/rgyjspqnyx	CENTENNIAL, CO, NUBURU, the leader in high power blue laser technology, has raised $20 million in Series B funding.	(Possible_Funding)	Not Computed		-
12/07/2020, 16:00:26	12/03/2020, 13:00:00	VCNews	Rubedo Life Sciences Inks $12M Seed Round	https://vcnewsdaily.com/rubedo-life-sciences/venture-capital-funding/bsfjghbxsw	SUNNYVALE, CA, Rubedo Life Sciences today announced the closing of a $12 million seed financing round.	(Possible_Funding)	Not Computed	('Rubedo Life Sciences Inks', 'ORG')	-
12/07/2020, 16:00:26	12/03/2020, 13:00:00	VCNews	Supergreat Raises $6.5M in Series A	https://vcnewsdaily.com/supergreat/venture-capital-funding/crbrrvrbvj	NEW YORK, NY, Supergreat announced a $6.5 million series A funding led by Benchmark.	(Funding)	Not Computed	('Supergreat Raises', 'ORG')('$6.5M', 'MONEY')	-
12/07/2020, 16:00:26	12/02/2020, 13:00:00	VCNews	Step Pockets $50M in Series B Funding	https://vcnewsdaily.com/step/venture-capital-funding/bltgvknkbm	SAN FRANCISCO, CA, Step announced a $50 million Series B round of funding led by Coatue.	(Funding)	Not Computed		-
12/07/2020, 16:00:26	12/02/2020, 13:00:00	VCNews	Ridecell Secures $45M in Series C	https://vcnewsdaily.com/ridecell/venture-capital-funding/ypzdztzymr	SAN FRANCISCO, CA, Ridecell announced it has secured $45 million for its Series C financing round led by Fort Ross Ventures.	(Funding)	Not Computed	('Ridecell Secures', 'ORG')('45', 'MONEY')	-
12/07/2020, 16:00:26	12/02/2020, 13:00:00	VCNews	GreenPark Sports $14M Series A Round	https://vcnewsdaily.com/greenpark-sports/venture-capital-funding/jzkyqhkjhv	BURLINGAME, CA, GreenPark Sports has added $14 million in a Series A investment round.	(Funding /Possible_Funding)	Not Computed	('GreenPark Sports', 'ORG')('14', 'MONEY')('M Series A Round', 'EVENT')	-
12/07/2020, 16:00:26	12/02/2020, 13:00:00	VCNews	Deduce Secures $7.3M in Seed Funding	https://vcnewsdaily.com/deduce/venture-capital-funding/fxnhbjqcvh	NEW YORK, NY, Deduce announced a $7.3M in Seed round led by True Ventures with participation from Ridge Ventures and other angel investors.	(Funding)	Not Computed	('Deduce Secures', 'ORG')('7.3M', 'ORG')	-
12/07/2020, 16:00:26	12/02/2020, 13:00:00	VCNews	Shop-Ware Procures $15M in Series A	https://vcnewsdaily.com/shop-ware/venture-capital-funding/grlhfmmzbk	SAN FRANCISCO, CA, Shop-Ware has procured $15M in series A funding led by Insight Partners.	(Funding)	Not Computed	('$15M', 'MONEY')	-
12/07/2020, 16:00:26	12/02/2020, 13:00:00	VCNews	Segmed Raises $2M Seed Round	https://vcnewsdaily.com/segmed/venture-capital-funding/pvfxndqfkb	STANFORD, CA, Segmed has closed $2 million dollars in seed funding led by Blumberg Capital.	(Funding /Possible_Funding)	Not Computed	('Segmed Raises', 'ORG')	-
12/07/2020, 16:00:26	12/02/2020, 13:00:00	VCNews	Fylamynt Snags $6.5M in Seed Funding	https://vcnewsdaily.com/fylamynt/venture-capital-funding/qpcsgvnnbh	MOUNTAIN VIEW, CA, Fylamynt announced its launch with $6.5 million in seed funding.	(Funding)	Not Computed	('Fylamynt', 'NORP')('$6.5M', 'MONEY')	-
12/07/2020, 16:00:26	12/02/2020, 13:00:00	VCNews	AgentSync Gains $6.7M in Seed Funding	https://vcnewsdaily.com/agentsync/venture-capital-funding/fqskqcgbvt	DENVER, CO, AgentSync gains $6.7M in seed funding led by David Sacks' Craft Ventures with participation from Operator Collective.	(Funding)	Not Computed	('AgentSync Gains', 'PERSON')('6.7', 'MONEY')	-
12/07/2020, 16:00:26	12/02/2020, 13:00:00	VCNews	Amount Snares $81M in Series C	https://vcnewsdaily.com/amount/venture-capital-funding/xqgchjdnpb	CHICAGO, IL, Amount has raised a $81 million Series C round led by Goldman Sachs Growth.	(Funding)	Not Computed		-
12/07/2020, 16:00:26	12/02/2020, 13:00:00	VCNews	Soil Connect Raises $3.25M in Seed Funding	https://vcnewsdaily.com/soil-connect/venture-capital-funding/hfsrjszpql	NEW YORK, NY, Soil Connect has announced the closing of its $3.25 million seed funding round led by TIA Ventures.	(Funding)	Not Computed	('Soil Connect Raises', 'ORG')('3.25', 'MONEY')	-
12/07/2020, 16:00:26	12/02/2020, 13:00:00	VCNews	Genesis Therapeutics Secures $52M in Series A	https://vcnewsdaily.com/genesis-therapeutics/venture-capital-funding/stsbkzclnr	BURLINGAME, CA, Genesis Therapeutics completed its $52M Series A financing round, led by Rock Springs Capital.	(Funding)	Not Computed	('Genesis Therapeutics Secures', 'PERSON')	-
12/07/2020, 16:00:26	12/02/2020, 13:00:00	VCNews	ShipMonk Raises $290M Growth Financing	https://vcnewsdaily.com/shipmonk/venture-capital-funding/zxyndrqxhv	FORT LAUDERDALE, FL, ShipMonk has raised a $290 million growth equity round, led by Summit Partners.	(Funding /Possible_Funding)	Not Computed	('ShipMonk Raises', 'ORG')('290', 'MONEY')	-
12/07/2020, 16:00:26	12/02/2020, 13:00:00	VCNews	CoreStack Snares $4M Investment	https://vcnewsdaily.com/corestack/venture-capital-funding/mxhjtsgmnb	BELLEVUE, WA, CoreStack has received a $4M investment from Iron Pillar.	(Possible_Funding)	Not Computed	('CoreStack Snares', 'PERSON')	-
12/07/2020, 16:00:26	12/01/2020, 13:00:00	VCNews	Olive Scoops Up $225.5M	https://vcnewsdaily.com/olive/venture-capital-funding/svprxjjhgy	COLUMBUS, OH, Olive announced today it closed $225.5 million in financing.	(No Keywords detect)	(Possible_Funding)	('225.5', 'MONEY')	-
12/07/2020, 16:00:27	12/07/2020, 17:00:19	Venturebeat	Humble Bundle’s Black Game Developer Fund makes first 5 investments	https://venturebeat.com/2020/12/07/humble-bundles-black-game-developer-fund-makes-first-5-investments/	Humble Bundle has awarded its first five grants from its $1 million Black Game Developer Fund to Black-led game studios.	(Funding /Possible_Funding)	Not Computed	('5', 'CARDINAL')	-
12/07/2020, 16:00:27	12/07/2020, 15:20:46	Venturebeat	Juniper Networks acquires datacenter network automation startup Apstra	https://venturebeat.com/2020/12/07/juniper-networks-acquires-datacenter-network-automation-startup-apstra/	Juniper Networks acquired Apstra, a startup specializing in datacenter network automation, for an undisclosed sum.	(M&A)	Not Computed	('Apstra', 'PERSON')	-
12/07/2020, 16:00:27	12/07/2020, 14:35:41	Venturebeat	Deepcell raises $20 million to identify cells with computer vision	https://venturebeat.com/2020/12/07/deepcell-raises-20-million-to-identify-cells-with-computer-vision/	Deepcell, a startup developing technologies to identify cells using computer vision, has raised $20 million in venture capital.	(Funding /Possible_Funding)	Not Computed	('$20 million', 'MONEY')	-
12/07/2020, 16:00:27	12/07/2020, 12:00:24	Venturebeat	Exclaimer raises $133 million to help companies manage email signatures	https://venturebeat.com/2020/12/07/exclaimer-raises-135-million-to-help-companies-manage-email-signatures/	Email signature management platform Exclaimer has raised $135 million in a round of funding led by Insight Partners. 	(Funding /Possible_Funding)	Not Computed	('$133 million', 'MONEY')	-
12/07/2020, 16:00:27	12/07/2020, 08:00:57	Venturebeat	Wonder raises $11 million to make large virtual events more sociable	https://venturebeat.com/2020/12/07/wonder-raises-11-million-to-make-large-virtual-events-more-sociable/	Berlin-based Wonder has raised an $11 million seed round of funding to make large online gatherings more sociable.	(Funding /Possible_Funding)	Not Computed	('$11 million', 'MONEY')	-
12/07/2020, 16:00:27	12/07/2020, 02:56:38	Venturebeat	Bombay Play raises $1 million for social games as India’s game studios blossom	https://venturebeat.com/2020/12/06/bombay-play-raises-1-million-for-social-games-as-indias-startup-market-grows/	Bombay Play, a Bangalore, India-based game studio, has raised $1 million to make social games for global markets.	(Funding /Possible_Funding)	Not Computed	('Bombay', 'ORG')('$1 million', 'MONEY')('India', 'GPE')	-
12/07/2020, 16:00:27	12/06/2020, 14:16:47	Venturebeat	Sony doubled TV ad spend for PlayStation 5 launch	https://venturebeat.com/2020/12/06/sony-doubled-tv-ad-spend-for-playstation-5-launch/	Game brands in November saw a 76.65% increase in estimated outlay on TV ads at $49.7 million, led by Sony's PlayStation 5 ad blitz.	(No Keywords detect)	(Possible_Funding)	('Sony', 'ORG')('PlayStation 5', 'PRODUCT')	-
12/07/2020, 16:00:27	12/05/2020, 18:25:50	Venturebeat	Why THQ Nordic has joined the game studio acquisition binge	https://venturebeat.com/2020/12/05/why-thq-nordic-has-joined-the-game-studio-acquisition-binge/	I spoke with THQ Nordic CEO Klemens Kreuzer, who described the thinking behind the company's frenetic expansion pace.	(M&A)	Not Computed	('Nordic', 'PERSON')	-
12/07/2020, 16:00:27	12/04/2020, 17:30:24	Venturebeat	Core Loop raises $2.4 million to build cross-platform MMO with co-op gameplay	https://venturebeat.com/2020/12/04/core-loop-raises-2-4-million-to-build-cross-platform-mmo-with-co-op-gameplay/	New game studio Core Loop has raised $2.4 million to develop a new cross-platform massively multiplayer online game.	(Funding /Possible_Funding)	Not Computed	('Core Loop', 'ORG')('$2.4 million', 'MONEY')('MMO', 'ORG')	-
12/07/2020, 16:00:27	12/07/2020, 20:21:00	PRNewswire -All News Releases	Huawei annonce les gagnants mondiaux du concours Apps Up 2020	https://www.prnewswire.com:443/news-releases/huawei-annonce-les-gagnants-mondiaux-du-concours-apps-up-2020-813266745.html	Huawei annonce les gagnants de son concours mondial d'innovation d'applications Huawei HMS Plus de 3 000 équipes du monde entier ont concouru pour un total d'un million de dollars américains en espèces Plus de 100 gagnants dans cinq régions du concours ont remporté les plus hauts prix,...	(No Keywords detect)	(Possible_Funding)		-
12/07/2020, 16:00:27	12/07/2020, 20:18:00	PRNewswire -All News Releases	No Negative COVID Effects on NFL Betting Action	https://www.prnewswire.com:443/news-releases/no-negative-covid-effects-on-nfl-betting-action-301187679.html	SAN JOSE, Costa Rica, Dec. 7, 2020 /PRNewswire/ - Leading price per head sportsbook software company PayPerHead.com recently announced that the coronavirus pandemic had no adverse effects on the amount of revenue their agents have acquired since the start of the 2020 NFL Season. In doing...	(No Keywords detect)	(M&A)		-
12/07/2020, 16:00:27	12/07/2020, 20:15:00	PRNewswire -All News Releases	Global Genomics Market Research Report 2020	https://www.prnewswire.com:443/news-releases/global-genomics-market-research-report-2020-301187445.html	DUBLIN, Dec. 7, 2020 /PRNewswire/ -- The "Genomics Global Market - Forecast to 2027" report has been added to ResearchAndMarkets.com's offering. The genomics global market is expected to reach $31,835.9 million by 2027 growing at a mid single-digit CAGR from 2020 to 2027 The factors...	(No Keywords detect)	(Possible_Funding)	('Global Genomics Market Research Report', 'ORG')	-
12/07/2020, 16:00:27	12/07/2020, 20:15:00	PRNewswire -All News Releases	Texas-based Calvetti Ferguson LLC announces its intent to acquire Mark M. Jones &amp; Associates, RLLP	https://www.prnewswire.com:443/news-releases/texas-based-calvetti-ferguson-llc-announces-its-intent-to-acquire-mark-m-jones--associates-rllp-301187676.html	FORT WORTH, Texas, Dec. 7, 2020 /PRNewswire/ -- Texas-based Calvetti Ferguson LLC announces its intent to acquire Mark M. Jones & Associates, RLLP ("MMJ"). "We chose Calvetti Ferguson because their culture is a perfect match for our clients and staff. They started their firm the same year...	(M&A)	Not Computed	('Texas', 'GPE')('Calvetti Ferguson LLC', 'ORG')('Mark M. Jones &amp', 'ORG')('Associates', 'ORG')('RLLP', 'ORG')	-
12/07/2020, 16:00:27	12/07/2020, 20:00:00	PRNewswire -All News Releases	RV Retailer, LLC Expands in the Carolinas with New Stores in the Charlotte and Raleigh Markets	https://www.prnewswire.com:443/news-releases/rv-retailer-llc-expands-in-the-carolinas-with-new-stores-in-the-charlotte-and-raleigh-markets-301187670.html	FORT LAUDERDALE, Fla., Dec. 7, 2020 /PRNewswire/ -- RV Retailer, LLC announced the acquisition of Golden Gait Trailers and RVs (GGT) in the Charlotte, North Carolina market and Camptown RV in the Raleigh, NC market. Jon Ferrando, Chief Executive Officer and President, stated, "We have had...	(No Keywords detect)	(M&A)	('RV Retailer', 'PERSON')('LLC Expands', 'ORG')('Carolinas', 'GPE')('New Stores', 'ORG')('Charlotte', 'GPE')	-
12/07/2020, 16:00:27	12/07/2020, 20:00:00	PRNewswire -All News Releases	StoneBridge Healthcare Makes Bid to Acquire Care New England Health System	https://www.prnewswire.com:443/news-releases/stonebridge-healthcare-makes-bid-to-acquire-care-new-england-health-system-301187518.html	LAHASKA, Pa., Dec. 7, 2020 /PRNewswire/ -- StoneBridge Healthcare, LLC (StoneBridge), an innovative company formed to buy, save and turn around distressed hospitals in the cities and suburbs of America, today announced it has presented a Letter of Intent (LOI) to purchase Rhode...	(M&A)	Not Computed		-
12/07/2020, 16:00:28	12/07/2020, 19:48:00	PRNewswire -Auto & Transportation	NASA Celebrates 50th Anniversary of Wind Tunnel	https://www.prnewswire.com:443/news-releases/nasa-celebrates-50th-anniversary-of-wind-tunnel-301187658.html	HAMPTON, Va., Dec. 7, 2020 /PRNewswire/ -- Friday, December 11, 2020, marks the 50th anniversary of NASA's Langley Research Center's 14x22 Subsonic Wind Tunnel. The facility is used to assess aerodynamic performance of aircraft over a wide range of takeoff, landing, cruise, and high...	(No Keywords detect)	(Possible_Funding)	('NASA', 'ORG')('50th', 'ORDINAL')	-
12/07/2020, 16:00:28	12/07/2020, 19:45:00	PRNewswire -Auto & Transportation	Global Light Commercial Vehicle Market Outlook 2020 - Renault-Nissan-Mitsubishi (RNM) Group Retained its Global Leadership in the Light-Duty Trucks and Vans Segment	https://www.prnewswire.com:443/news-releases/global-light-commercial-vehicle-market-outlook-2020---renault-nissan-mitsubishi-rnm-group-retained-its-global-leadership-in-the-light-duty-trucks-and-vans-segment-301187433.html	DUBLIN, Dec. 7, 2020 /PRNewswire/ -- The "Global Light Commercial Vehicle Market Outlook, 2020" report has been added to ResearchAndMarkets.com's offering. Global sales of light commercial vehicle (LCV) are expected to reach 9.49 million units in 2020, with pickups contributing to 4.62...	(No Keywords detect)	(Possible_M&A /Possible_Funding)		-
12/07/2020, 16:00:28	12/07/2020, 18:20:00	PRNewswire -Auto & Transportation	NASA Defines Science Priorities for First Crewed Artemis Landing on Moon	https://www.prnewswire.com:443/news-releases/nasa-defines-science-priorities-for-first-crewed-artemis-landing-on-moon-301187573.html	WASHINGTON, Dec. 7, 2020 /PRNewswire/ -- NASA has identified the agency's science priorities for the Artemis III mission, which will launch the first woman and next man to the Moon in 2024. The priorities and a candidate set of activities are included in a new report. The Artemis III...	(Possible_Funding)	Not Computed	('NASA', 'ORG')('First', 'ORDINAL')('Moon', 'GPE')	-
12/07/2020, 16:00:28	12/07/2020, 19:54:00	PRNewswire -Business Technology	Laird Connectivity Announces New Bluetooth 5.2 Module for Advanced Applications Requiring High Performance and Low Power Budget	https://www.prnewswire.com:443/news-releases/laird-connectivity-announces-new-bluetooth-5-2-module-for-advanced-applications-requiring-high-performance-and-low-power-budget-301187664.html	AKRON, Ohio, Dec. 7, 2020 /PRNewswire/ -- Laird Connectivity, a global leader in wireless technology, has announced the new BL5340 series of Bluetooth 5.2 and 802.15.4 modules, the latest addition to their multi-wireless portfolio. Based on Nordic Semiconductor's nRF5340 system-on-chip...	(No Keywords detect)	(Funding)	('5.2', 'CARDINAL')	-
12/07/2020, 16:00:28	12/07/2020, 19:52:00	PRNewswire -Business Technology	WSGF - Goldman Small Cap Research Scheduled To Release Vaycaychella Analyst Research Report Tomorrow	https://www.prnewswire.com:443/news-releases/wsgf--goldman-small-cap-research-scheduled-to-release-vaycaychella-analyst-research-report-tomorrow-301187661.html	DALLAS, Dec. 7, 2020 /PRNewswire/ -- World Series of Golf, Inc. (USOTC: WSGF) ("WSGF"), in conjunction with its new sharing economy technology business focus serving the short-term rental market through its subsidiary, Vaycaychella, today confirmed engaging Goldman Small Cap Research to...	(No Keywords detect)	(Funding)	('Tomorrow', 'DATE')	-
12/07/2020, 16:00:28	12/07/2020, 19:47:00	PRNewswire -Business Technology	Tile e HP disponibilizam tecnologia de busca Tile para mais PCs	https://www.prnewswire.com:443/news-releases/tile-e-hp-disponibilizam-tecnologia-de-busca-tile-para-mais-pcs-807323564.html	EliteBook 800 Series e ZBook Firefly 14 e 15 G8 da HP agora saem de fábrica com software Tile pré-instalado SAN MATEO, Califórnia, 7 de dezembro de 2020 /PRNewswire/ -- A Tile, maior empresa de localização inteligente do mundo, e a HPestão implementando a tecnologia de busca da Tile em...	(No Keywords detect)	(Funding)		-
12/07/2020, 16:00:28	12/07/2020, 19:45:00	PRNewswire -Business Technology	Tile y HP expanden la tecnología de rastreo Tile a más computadoras	https://www.prnewswire.com:443/news-releases/tile-y-hp-expanden-la-tecnologia-de-rastreo-tile-a-mas-computadoras-849700596.html	Los dispositivos EliteBook Serie 800 y ZBook Firefly 14 y 15 G8 ahora se entregan con el software Tile preinstalado SAN MATEO, California, 7 de diciembre de 2020 /PRNewswire/ -- Tile, empresa líder en localización inteligente a nivel global, y HP están presentando nuevas computadoras con...	(No Keywords detect)	(Funding)	('y HP', 'FAC')	-
12/07/2020, 16:00:28	12/07/2020, 18:48:00	PRNewswire -Business Technology	Despite COVID-19: Israeli Technological Innovation Sets New Capital Rounds Record; Approaches The $10 Billion Line	https://www.prnewswire.com:443/news-releases/despite-covid-19-israeli-technological-innovation-sets-new-capital-rounds-record-approaches-the-10-billion-line-301187609.html	TEL AVIV, Israel, Dec. 7, 2020 /PRNewswire/ -- Start-Up Nation Central (SNC) today published a research report that shows that 2020 was a record year in terms of capital raised by Israeli companies. As of the beginning of December 2020, Israeli companies raised $9.5 billion in capital,...	(Possible_Funding)	Not Computed	('Israeli', 'NORP')('Rounds Record', 'PERSON')('$10 Billion', 'MONEY')	-
12/07/2020, 16:00:28	12/07/2020, 18:31:00	PRNewswire -Business Technology	ICP Brings Their Robust Global Transaction Processing Platform to the United States	https://www.prnewswire.com:443/news-releases/icp-brings-their-robust-global-transaction-processing-platform-to-the-united-states-301187593.html	PRIOR LAKE, Minn., Dec. 7, 2020 /PRNewswire/ -- Innovative Computer Professionals (ICP), a fintech corporation and international issuing and acquiring processor, today announced their certification and the official launch of their transaction processing platform in the United States....	(No Keywords detect)	(M&A)	('the United States', 'GPE')	-
12/07/2020, 16:00:28	12/07/2020, 18:24:00	PRNewswire -Business Technology	Tile und HP dehnen die Suchtechnologie von Tile auf weitere PCs aus	https://www.prnewswire.com:443/news-releases/tile-und-hp-dehnen-die-suchtechnologie-von-tile-auf-weitere-pcs-aus-856022261.html	Die EliteBook 800 Serie von HP sowie ZBook Firefly 14 und 15 G8 werden jetzt mit vorinstallierter Tile-Software ausgeliefert SAN MATEO, Kalifornien, 7. Dezember 2020 /PRNewswire/ -- Tile, das weltweit führende Unternehmen für intelligente Lokalisierung, und HP führen zusätzliche PC-Geräte...	(No Keywords detect)	(Funding)	('HP', 'FAC')	-
12/07/2020, 16:00:28	12/07/2020, 18:21:00	PRNewswire -Business Technology	Adaptas Solutions Acquires Cadence Fluidics	https://www.prnewswire.com:443/news-releases/adaptas-solutions-acquires-cadence-fluidics-301187575.html	PALMER, Mass., Dec. 7, 2020 /PRNewswire/ -- Adaptas Solutions, LLC, a leading manufacturer of critical components for mass spectrometers, analytical lab equipment and clinical instruments, has completed the acquisition of Cadence Fluidics. Cadence Fluidics designs and manufactures custom...	(M&A)	Not Computed	('Adaptas Solutions Acquires Cadence Fluidics', 'ORG')	-
12/07/2020, 16:00:28	12/07/2020, 18:20:00	PRNewswire -Consumer Products & Retail	Mastronardi Produce Announces New Southwestern Omnichannel Distribution Center	https://www.prnewswire.com:443/news-releases/mastronardi-produce-announces-new-southwestern-omnichannel-distribution-center-301187574.html	Purpose-built facility to provide faster, smarter service KINGSVILLE, ON and LAREDO, TX, Dec. 7, 2020 /PRNewswire/ - Mastronardi Produce, an industry-leading greenhouse pioneer that sells and markets fresh fruits and vegetables under the SUNSET® brand, today announced the opening of a new...	(No Keywords detect)	(Possible_M&A)	('Mastronardi Produce Announces New', 'ORG')	-
12/07/2020, 16:00:28	12/07/2020, 17:48:00	PRNewswire -Consumer Products & Retail	Rancher's Prime is Giving Consumers Access to Exclusive Prime Cuts while Supporting Stewards of the Land	https://www.prnewswire.com:443/news-releases/ranchers-prime-is-giving-consumers-access-to-exclusive-prime-cuts-while-supporting-stewards-of-the-land-301187543.html	DALLAS, Dec. 7, 2020 /PRNewswire/ -- Rancher's Prime is giving ranchers the tools they need to deliver the most exclusive meat products directly to consumers. Generations of ranching taught them how to curate the best meat cuts, but they were only reserved for leading steakhouses and...	(Possible_Funding)	Not Computed		-
12/07/2020, 16:00:28	12/07/2020, 19:14:00	PRNewswire -Consumer Technology	Huawei gibt die Gewinner des globalen Apps Up 2020 bekannt	https://www.prnewswire.com:443/news-releases/huawei-gibt-die-gewinner-des-globalen-apps-up-2020-bekannt-876174621.html	Huawei gibt die Gewinner seines globalen HUAWEI HMS App-Innovationswettbewerbs bekannt Mehr als 3.000 Teams weltweit konkurrieren um Preise in Höhe von insgesamt 1 Million USD in bar Mehr als 100 Gewinner aus fünf Wettbewerbsregionen gewannen die höchsten Preise mit jeweils 15.000...	(No Keywords detect)	(Possible_Funding)	('2020', 'DATE')	-
12/07/2020, 16:00:28	12/07/2020, 18:23:00	PRNewswire -Energy	NAES Corporation Acquires Bay4 Energy	https://www.prnewswire.com:443/news-releases/naes-corporation-acquires-bay4-energy-301187582.html	ISSAQUAH, Wash., Dec. 7, 2020 /PRNewswire/ -- NAES Corporation ("NAES") announced that it acquired Bay4 Energy Services, LLC ("Bay4"), a leading independent renewable energy service provider, effective 12/02/20.   The acquisition of Bay4 Energy adds 1.6GW of solar energy to the NAES Power...	(M&A)	Not Computed		-
