link,title
https://fortune.com/newsletter/termsheet/,"Alliance Holdings, backed by Align Capital Partners, acquired Blue Mountain Environmental Management , a Decatur, Ala.-based provider of emission testing services to those in the Northeastern and Midwestern U.S. Financial terms weren't disclosed."
https://www.pehub.com/clearlake-to-acquire-primesource-from-platinum-equity/,"Clearlake Capital Group agreed to acquire PriSo Holding Corporation,  a distributor of specialty building materials serving residential, commercial, and industrial new-construction and remodeling markets, from Platinum Equity. Financial terms weren't disclosed."
https://www.prnewswire.com/news-releases/nuance-announces-sale-of-him-transcription-and-ehr-go-live-services-businesses-to-accelerate-growth-as-conversational-ai-market-leader-301176427.html,"DeliverHealth Solutions, formed by Assured Healthcare Partners and Aeries Technology Group, acquired Nuance Communications’ (Nasdaq: NUAN) health information management transcription business and the Electronic Health Record business. Financial terms weren't disclosed."
http://www.businesswire.com/news/home/20201123006133/en/Elion-Partners-Expands-Last-Mile-Logistics-Portfolio-with-Acquisition-in-Pompano-Beach-FL/,"DeliverHealth Solutions, formed by Assured Healthcare Partners and Aeries Technology Group, acquired Nuance Communications’ (Nasdaq: NUAN) health information management transcription business and the Electronic Health Record business. Financial terms weren't disclosed."
https://www.businesswire.com/news/home/20201110005440/en/HST-Pathways-and-Casetabs-Merge-and-Secure-Majority-Investment-Led-by-Bain-Capital-Tech-Opportunities,"Bain Capital Tech Opportunities acquired and merged HST Pathways and Casetabs, two Lafayette, Calif., and Boston, Mass.-based providers of cloud-based practice management software for ambulatory surgery centers. Nexxus Holdings also invested. Financial terms weren't disclosed."
http://www.globenewswire.com/news-release/2020/11/12/2125894/0/en/Epiq-Expands-its-Legal-Transformation-Services-Offerings-with-Acquisition-of-Hyperion-Global-Partners.html,"NEW YORK, Nov.  12, 2020  (GLOBE NEWSWIRE) -- Epiq, a global leader in the legal services industry, announced today that it is has acquired Hyperion Global Partners (Hyperion), the premier global business and technology advisory practice for legal operations and transformation."